source,source_url,category,rank,headline,link,collected_at_iso
ET Panache Health,https://economictimes.indiatimes.com/magazines/panache/health,health,1,FMT eases pain. Ask an ex-boxer!,https://economictimes.indiatimes.com/articleshow/49323452.cms,2026-07-06T19:50:55+00:00
ET Panache Health,https://economictimes.indiatimes.com/magazines/panache/health,health,2,"He was 34, active. No diabetes, no high BP. Doctor reveals one 'harmless habit' which caused 34-year-old to almost die from stroke",https://economictimes.indiatimes.com/articleshow/132180534.cms,2026-07-06T19:50:55+00:00
ET Panache Health,https://economictimes.indiatimes.com/magazines/panache/health,health,3,"A simple 10-minute daily habit can help in better blood sugar control and lower diabetics risk, say health experts. They explain the science behind it",https://economictimes.indiatimes.com/articleshow/132176513.cms,2026-07-06T19:50:55+00:00
ET Panache Health,https://economictimes.indiatimes.com/magazines/panache/health,health,4,Top nutritionist reveals 6 everyday foods that have more fibre than your salad. Simple swaps to boost gut health naturally,https://economictimes.indiatimes.com/articleshow/132175162.cms,2026-07-06T19:50:55+00:00
ET Panache Health,https://economictimes.indiatimes.com/magazines/panache/health,health,5,Celebrity nutritionist shares 7 underrated exercises for health and longevity: They're not about the gym or lifting weights,https://economictimes.indiatimes.com/articleshow/132174452.cms,2026-07-06T19:50:55+00:00
ET Panache Health,https://economictimes.indiatimes.com/magazines/panache/health,health,6,He was 30 and had perfect diet. No blood sugar. Yet one habit almost cost him his life. Doctor reveals: 'He learned a hard lesson...',https://economictimes.indiatimes.com/articleshow/132167709.cms,2026-07-06T19:50:55+00:00
ET Panache Health,https://economictimes.indiatimes.com/magazines/panache/health,health,7,Not serums or supplements: Harvard-trained gut doctor shares 5 anti-ageing secrets he wished he knew in his 20s,https://economictimes.indiatimes.com/articleshow/132141440.cms,2026-07-06T19:50:55+00:00
ET Panache Health,https://economictimes.indiatimes.com/magazines/panache/health,health,8,Energy drinks vs sports drinks: Top neurologist explains the key difference you’re missing,https://economictimes.indiatimes.com/articleshow/132129447.cms,2026-07-06T19:50:55+00:00
ET Panache Health,https://economictimes.indiatimes.com/magazines/panache/health,health,9,Can drinking baking soda water help you lose weight? Doctor reveals what it really does to your body,https://economictimes.indiatimes.com/articleshow/132106465.cms,2026-07-06T19:50:55+00:00
ET Panache Health,https://economictimes.indiatimes.com/magazines/panache/health,health,10,"At 46, Ankur Warikoo reached 13% body fat. Here are the habits he swears by",https://economictimes.indiatimes.com/articleshow/132104665.cms,2026-07-06T19:50:55+00:00
ET Panache Health,https://economictimes.indiatimes.com/magazines/panache/health,health,11,"650g cucumber, 20g namkeen: Top nutritionist reveals how different 100 calories can look",https://economictimes.indiatimes.com/articleshow/131925111.cms,2026-07-06T19:50:55+00:00
ET Panache Health,https://economictimes.indiatimes.com/magazines/panache/health,health,12,Is boba tea healthy? Harvard-trained gut doctor shares 8 common foods that may be harming your digestive health,https://economictimes.indiatimes.com/articleshow/131905725.cms,2026-07-06T19:50:55+00:00
ET Panache Health,https://economictimes.indiatimes.com/magazines/panache/health,health,13,Top neurologist lost 29 kilos. He also lowered his resting heart rate from 70 to 40. Here's how he did it,https://economictimes.indiatimes.com/articleshow/131901232.cms,2026-07-06T19:50:55+00:00
ET Panache Health,https://economictimes.indiatimes.com/magazines/panache/health,health,14,"High blood pressure? Top nutritionist reveals the fruits, vegetables and seeds to add to your diet",https://economictimes.indiatimes.com/articleshow/131888878.cms,2026-07-06T19:50:55+00:00
ET Panache Health,https://economictimes.indiatimes.com/magazines/panache/health,health,15,"Avocados, smoothies, muesli: Celebrity nutritionist reveals 5 healthy foods that may be secretly slowing your weight loss",https://economictimes.indiatimes.com/articleshow/131873849.cms,2026-07-06T19:50:55+00:00
ET Panache Health,https://economictimes.indiatimes.com/magazines/panache/health,health,16,"Correct sleep posture, mindful eating, mini walks: Harvard-trained gut doctor shares 6 simple ways to manage acid reflux naturally",https://economictimes.indiatimes.com/articleshow/131873775.cms,2026-07-06T19:50:55+00:00
ET Panache Health,https://economictimes.indiatimes.com/magazines/panache/health,health,17,"Hair fall bothering you? Top nutritionist shares 5 simple foods for stronger, healthier hair",https://economictimes.indiatimes.com/articleshow/131858777.cms,2026-07-06T19:50:55+00:00
ET Panache Health,https://economictimes.indiatimes.com/magazines/panache/health,health,18,"4 meals, 40 g fibre: Top nutritionist shares simple foods to help you meet your daily fibre goals",https://economictimes.indiatimes.com/articleshow/131836637.cms,2026-07-06T19:50:55+00:00
ET Panache Health,https://economictimes.indiatimes.com/magazines/panache/health,health,19,Techie kept getting migraines every Saturday. Top neurologist points to one hidden reason,https://economictimes.indiatimes.com/articleshow/131697400.cms,2026-07-06T19:50:55+00:00
ET Panache Health,https://economictimes.indiatimes.com/magazines/panache/health,health,20,Pushpa 2 Online Leaked,https://economictimes.indiatimes.com/articleshow/115993157.cms,2026-07-06T19:50:55+00:00
ET Panache Health,https://economictimes.indiatimes.com/magazines/panache/health,health,21,Google Doodle Staurikosaurus,https://economictimes.indiatimes.com/articleshow/114370181.cms,2026-07-06T19:50:55+00:00
ET Panache Health,https://economictimes.indiatimes.com/magazines/panache/health,health,22,Google rejects‘too good’employee,https://economictimes.indiatimes.com/articleshow/114371359.cms,2026-07-06T19:50:55+00:00
ET Panache Health,https://economictimes.indiatimes.com/magazines/panache/health,health,23,Priyanka flashes belly button rings,https://economictimes.indiatimes.com/articleshow/114372935.cms,2026-07-06T19:50:55+00:00
ET Panache Health,https://economictimes.indiatimes.com/magazines/panache/health,health,24,Amid Lawrence Bishnoi,https://economictimes.indiatimes.com/articleshow/114367306.cms,2026-07-06T19:50:55+00:00
ET Panache Health,https://economictimes.indiatimes.com/magazines/panache/health,health,25,Varun Dhawan Samantha,https://economictimes.indiatimes.com/articleshow/114368753.cms,2026-07-06T19:50:55+00:00
ET Panache Health,https://economictimes.indiatimes.com/magazines/panache/health,health,26,Akshay Kumar COVID News,https://economictimes.indiatimes.com/articleshow/111685146.cms,2026-07-06T19:50:55+00:00
ET Panache Health,https://economictimes.indiatimes.com/magazines/panache/health,health,27,Sarfira Movie Review,https://economictimes.indiatimes.com/articleshow/111677493.cms,2026-07-06T19:50:55+00:00
ET Panache Health,https://economictimes.indiatimes.com/magazines/panache/health,health,28,Cristiano Ronaldo Retirement,https://economictimes.indiatimes.com/articleshow/111438820.cms,2026-07-06T19:50:55+00:00
ET Panache Health,https://economictimes.indiatimes.com/magazines/panache/health,health,29,Sonakshi Sinha Wedding,https://economictimes.indiatimes.com/articleshow/111203848.cms,2026-07-06T19:50:55+00:00
ET Panache Health,https://economictimes.indiatimes.com/magazines/panache/health,health,30,Sania Mirza Mohammed Shami,https://economictimes.indiatimes.com/articleshow/111157002.cms,2026-07-06T19:50:55+00:00
ET Panache Health,https://economictimes.indiatimes.com/magazines/panache/health,health,31,Bigg Boss OTT 3,https://economictimes.indiatimes.com/articleshow/111104026.cms,2026-07-06T19:50:55+00:00
ET Panache Health,https://economictimes.indiatimes.com/magazines/panache/health,health,32,Panchayat Season 3 OTT Release,https://economictimes.indiatimes.com/articleshow/110140474.cms,2026-07-06T19:50:55+00:00
ET Panache Health,https://economictimes.indiatimes.com/magazines/panache/health,health,33,Cannes 2024 Live Streaming,https://economictimes.indiatimes.com/articleshow/110116799.cms,2026-07-06T19:50:55+00:00
ET Panache Health,https://economictimes.indiatimes.com/magazines/panache/health,health,34,Pavitra Jayaram Death,https://economictimes.indiatimes.com/articleshow/110069299.cms,2026-07-06T19:50:55+00:00
ET Panache Health,https://economictimes.indiatimes.com/magazines/panache/health,health,35,Rituraj Singh Death,https://economictimes.indiatimes.com/articleshow/107842242.cms,2026-07-06T19:50:55+00:00
ET Panache Health,https://economictimes.indiatimes.com/magazines/panache/health,health,36,"Kharif sowing picks up, but still 21% below last year",https://economictimes.indiatimes.com/articleshow/132224809.cms,2026-07-06T19:50:55+00:00
ET Panache Health,https://economictimes.indiatimes.com/magazines/panache/health,health,37,Firm up the Troika within the Quad,https://economictimes.indiatimes.com/articleshow/132224828.cms,2026-07-06T19:50:55+00:00
ET Panache Health,https://economictimes.indiatimes.com/magazines/panache/health,health,38,Taiwan Travelogue by Yang Shuang-zi,https://economictimes.indiatimes.com/articleshow/132224826.cms,2026-07-06T19:50:55+00:00
ET Panache Health,https://economictimes.indiatimes.com/magazines/panache/health,health,39,The red card that didn't stick,https://economictimes.indiatimes.com/articleshow/132224611.cms,2026-07-06T19:50:55+00:00
ET Panache Health,https://economictimes.indiatimes.com/magazines/panache/health,health,40,Govt plans LNG buffer mandate for terminals,https://economictimes.indiatimes.com/articleshow/132224888.cms,2026-07-06T19:50:55+00:00
ET Panache Health,https://economictimes.indiatimes.com/magazines/panache/health,health,41,Tamil Nadu spends too much; Bengal earns too little: A tale of two deficits,https://economictimes.indiatimes.com/articleshow/132224608.cms,2026-07-06T19:50:55+00:00
ET Panache Health,https://economictimes.indiatimes.com/magazines/panache/health,health,42,"When in India, play by Indian rules",https://economictimes.indiatimes.com/articleshow/132224873.cms,2026-07-06T19:50:55+00:00
ET Panache Health,https://economictimes.indiatimes.com/magazines/panache/health,health,43,"if(typeof objAd !=""undefined""){ objAd.loadAds(); } Quote of the day by Julia Roberts: 'We've all been broken at some point. Forgiving...' Life lessons on emotional resilience, hardships, self-compassion, healing and why is it essential to let go of past",https://economictimes.indiatimes.com/articleshow/132197213.cms,2026-07-06T19:50:55+00:00
ET Panache Health,https://economictimes.indiatimes.com/magazines/panache/health,health,44,"Middle class, aspirational consumers to drive 93% of India's spending by 2036: Sitharaman",https://economictimes.indiatimes.com/articleshow/132193476.cms,2026-07-06T19:50:55+00:00
ET Panache Health,https://economictimes.indiatimes.com/magazines/panache/health,health,45,"​Two CRPF inspectors clear every round of promotion exam, then failed over forearm tattoo: Delhi HC refuses relief despite tattoo removal; tattoos went unnoticed since joining",https://economictimes.indiatimes.com/articleshow/132195612.cms,2026-07-06T19:50:55+00:00
ET Panache Health,https://economictimes.indiatimes.com/magazines/panache/health,health,46,"if(typeof objAd !=""undefined""){ objAd.loadAds(); } Mumbai schools, colleges to remain shut on July 6 amid heavy rains",https://economictimes.indiatimes.com/articleshow/132197714.cms,2026-07-06T19:50:55+00:00
ET Panache Health,https://economictimes.indiatimes.com/magazines/panache/health,health,47,BJP-RSS responsible for Ram Temple 'loot': Cong chief Mallikarjun Kharge,https://economictimes.indiatimes.com/articleshow/132195690.cms,2026-07-06T19:50:55+00:00
ET Panache Health,https://economictimes.indiatimes.com/magazines/panache/health,health,48,"if(typeof objAd !=""undefined""){ objAd.loadAds(); } India, Australia set to seal uranium supply pact during PM Modi’s visit",https://economictimes.indiatimes.com/articleshow/132205236.cms,2026-07-06T19:50:55+00:00
ET Panache Health,https://economictimes.indiatimes.com/magazines/panache/health,health,49,"if(typeof objAd !=""undefined""){ objAd.loadAds(); } Shah Rukh Khan’s co-star Chandrachur Singh steps out as bulldozer demolishes ramp outside Gurugram home, his calm exchange with officials goes viral. Watch",https://economictimes.indiatimes.com/articleshow/132192986.cms,2026-07-06T19:50:55+00:00
ET Panache Health,https://economictimes.indiatimes.com/magazines/panache/health,health,50,"if(typeof objAd !=""undefined""){ objAd.loadAds(); } America’s battlefield dominance is under serious threat",https://economictimes.indiatimes.com/articleshow/132193035.cms,2026-07-06T19:50:55+00:00
ET Panache Health,https://economictimes.indiatimes.com/magazines/panache/health,health,51,"if(typeof objAd !=""undefined""){ objAd.loadAds(); } Mumbai issues work from home advisory for private offices, some govt offices to observe half day amid heavy rains",https://economictimes.indiatimes.com/articleshow/132207972.cms,2026-07-06T19:50:55+00:00
ET Panache Health,https://economictimes.indiatimes.com/magazines/panache/health,health,52,Pakistani forces open fire on protest rally as massive anti-Islamabad uprising grips PoJK,https://economictimes.indiatimes.com/articleshow/132195732.cms,2026-07-06T19:50:55+00:00
ET Panache Health,https://economictimes.indiatimes.com/magazines/panache/health,health,53,QR code in red envelope leads to “invite-only” Instagram page: What we know so far,https://economictimes.indiatimes.com/articleshow/121338235.cms,2026-07-06T19:50:55+00:00
ET Panache Health,https://economictimes.indiatimes.com/magazines/panache/health,health,54,"if(typeof objAd !=""undefined""){ objAd.loadAds(); } Psychology says people who are scared of dogs aren't always animal haters, they may be responding to past experiences and fears",https://economictimes.indiatimes.com/articleshow/132195868.cms,2026-07-06T19:50:55+00:00
ET Panache Health,https://economictimes.indiatimes.com/magazines/panache/health,health,55,"if(typeof objAd !=""undefined""){ objAd.loadAds(); } Adani Defence to invest Rs 2,500 crore in missile manufacturing complex in Madhya Pradesh",https://economictimes.indiatimes.com/articleshow/132194310.cms,2026-07-06T19:50:55+00:00
ET Panache Health,https://economictimes.indiatimes.com/magazines/panache/health,health,56,"Ayodhya donation probe: Teacher, car mechanic, retired bank employee among 8 accused",https://economictimes.indiatimes.com/articleshow/132194548.cms,2026-07-06T19:50:55+00:00
ET Panache Health,https://economictimes.indiatimes.com/magazines/panache/health,health,57,"if(typeof objAd !=""undefined""){ objAd.loadAds(); } China's dominance in rare earth industry has key structural weakness as US, Japan hold core patents: Study",https://economictimes.indiatimes.com/articleshow/132197557.cms,2026-07-06T19:50:55+00:00
ET Panache Health,https://economictimes.indiatimes.com/magazines/panache/health,health,58,"Go to Horoscope Today, 7 July, 2026 Page",https://economictimes.indiatimes.com/articleshow/132221457.cms,2026-07-06T19:50:55+00:00
ET Panache Health,https://economictimes.indiatimes.com/magazines/panache/health,health,59,"Go to Horoscope Tomorrow, 7 July 2026 Page",https://economictimes.indiatimes.com/articleshow/132208661.cms,2026-07-06T19:50:55+00:00
ET Panache Health,https://economictimes.indiatimes.com/magazines/panache/health,health,60,Go to Mumbai rain Page,https://economictimes.indiatimes.com/articleshow/132189858.cms,2026-07-06T19:50:55+00:00
ET Panache Health,https://economictimes.indiatimes.com/magazines/panache/health,health,61,Go to EPFO Latest Update Page,https://economictimes.indiatimes.com/articleshow/132153209.cms,2026-07-06T19:50:55+00:00
ET Panache Health,https://economictimes.indiatimes.com/magazines/panache/health,health,62,Go to Happy Father’s Day Wishes 2026 Page,https://economictimes.indiatimes.com/articleshow/131885271.cms,2026-07-06T19:50:55+00:00
ET Panache Health,https://economictimes.indiatimes.com/magazines/panache/health,health,63,Go to DoorDash Down Page,https://economictimes.indiatimes.com/articleshow/131775980.cms,2026-07-06T19:50:55+00:00
ET Panache Health,https://economictimes.indiatimes.com/magazines/panache/health,health,64,Go to Crude Oil Price Today Page,https://economictimes.indiatimes.com/articleshow/131731293.cms,2026-07-06T19:50:55+00:00
ET Panache Health,https://economictimes.indiatimes.com/magazines/panache/health,health,65,Go to IAF AN-32 aircraft crashes Page,https://economictimes.indiatimes.com/articleshow/131698440.cms,2026-07-06T19:50:55+00:00
ET Panache Health,https://economictimes.indiatimes.com/magazines/panache/health,health,66,Go to Folarin Balogun Page,https://economictimes.indiatimes.com/articleshow/131696996.cms,2026-07-06T19:50:55+00:00
ET Panache Health,https://economictimes.indiatimes.com/magazines/panache/health,health,67,Go to is Facebook Instagram messenger Down Page,https://economictimes.indiatimes.com/articleshow/131687112.cms,2026-07-06T19:50:55+00:00
ET Panache Health,https://economictimes.indiatimes.com/magazines/panache/health,health,68,Go to Maggie Smith News Page,https://economictimes.indiatimes.com/articleshow/113743204.cms,2026-07-06T19:50:55+00:00
ET Panache Health,https://economictimes.indiatimes.com/magazines/panache/health,health,69,Go to Sunita Williams Space Station Routine Page,https://economictimes.indiatimes.com/articleshow/113340209.cms,2026-07-06T19:50:55+00:00
ET Panache Health,https://economictimes.indiatimes.com/magazines/panache/health,health,70,Go to Cristiano Ronaldo Youtube Channel Page,https://economictimes.indiatimes.com/articleshow/112701776.cms,2026-07-06T19:50:55+00:00
ET Panache Health,https://economictimes.indiatimes.com/magazines/panache/health,health,71,Go to Who is Miles Routledge Page,https://economictimes.indiatimes.com/articleshow/112706059.cms,2026-07-06T19:50:55+00:00
ET Panache Health,https://economictimes.indiatimes.com/magazines/panache/health,health,72,Go to Isha Ambani Lehenga Page,https://economictimes.indiatimes.com/articleshow/111678035.cms,2026-07-06T19:50:55+00:00
ET Panache Health,https://economictimes.indiatimes.com/magazines/panache/health,health,73,"India, EU aim to complete FTA legal scrubbing in 15-20 days, says Piyush Goyal",https://economictimes.indiatimes.com/articleshow/132224978.cms,2026-07-06T19:50:55+00:00
ET Panache Health,https://economictimes.indiatimes.com/magazines/panache/health,health,74,"Direct cash transfers to women boost savings, spending: EAC-PM",https://economictimes.indiatimes.com/articleshow/132224959.cms,2026-07-06T19:50:55+00:00
ET Panache Health,https://economictimes.indiatimes.com/magazines/panache/health,health,75,"To ride the EV wave, M&M takes premium path, Tata Motors bets on scale",https://economictimes.indiatimes.com/articleshow/132225117.cms,2026-07-06T19:50:55+00:00
ET Panache Health,https://economictimes.indiatimes.com/magazines/panache/health,health,76,Pahalgam Attack: LeT-TRF Chief Saeed named in NIA charge sheet,https://economictimes.indiatimes.com/articleshow/132225035.cms,2026-07-06T19:50:55+00:00
ET Panache Health,https://economictimes.indiatimes.com/magazines/panache/health,health,77,"From Indonesia to Australia to New Zealand, PM Modi charts India's Indo-Pacific arc",https://economictimes.indiatimes.com/articleshow/132225114.cms,2026-07-06T19:50:55+00:00
ET Panache Health,https://economictimes.indiatimes.com/magazines/panache/health,health,78,Education Ministry in discussions to ease 1-km norm for EWS admissions,https://economictimes.indiatimes.com/articleshow/132225119.cms,2026-07-06T19:50:55+00:00
ET Panache Health,https://economictimes.indiatimes.com/magazines/panache/health,health,79,Push to enhance ease of doing business: Govt vendor payments to be cleared in 3 days,https://economictimes.indiatimes.com/articleshow/132225069.cms,2026-07-06T19:50:55+00:00
ET Panache Health,https://economictimes.indiatimes.com/magazines/panache/health,health,80,Ayodhya Ram Temple: Trust accepts resignations of key officials; set to appoint CEO,https://economictimes.indiatimes.com/articleshow/132224758.cms,2026-07-06T19:50:55+00:00
ET Panache Health,https://economictimes.indiatimes.com/magazines/panache/health,health,81,SC declines urgent hearing on PIL over Nazia Elahi Khan's Prophet remarks,https://economictimes.indiatimes.com/articleshow/132225089.cms,2026-07-06T19:50:55+00:00
ET Panache Health,https://economictimes.indiatimes.com/magazines/panache/health,health,82,Cooktops in high demand as West Asia war alters household habits,https://economictimes.indiatimes.com/articleshow/132225154.cms,2026-07-06T19:50:55+00:00
ET Panache Health,https://economictimes.indiatimes.com/magazines/panache/health,health,83,Pakistan deputy PM Ishaq Dar faces heat over grandson's arrest in rape case,https://economictimes.indiatimes.com/articleshow/132225159.cms,2026-07-06T19:50:55+00:00
ET Panache Health,https://economictimes.indiatimes.com/magazines/panache/health,health,84,"French Proverb of the Day: “You should never say… — Life lessons on regret, change, future, unpredictability and why life's greatest opportunities often come from unexpected places",https://economictimes.indiatimes.com/articleshow/132218718.cms,2026-07-06T19:50:55+00:00
ET Panache Lifestyle,https://economictimes.indiatimes.com/magazines/panache/lifestyle,lifestyle,1,"Lens-shaped windows, film roll balconies, ‘Click’-worthy decor: Karnataka man’s camera-themed home is a tribute to his 30-year love for photography",https://economictimes.indiatimes.com/articleshow/132218212.cms,2026-07-06T19:50:55+00:00
ET Panache Lifestyle,https://economictimes.indiatimes.com/magazines/panache/lifestyle,lifestyle,2,"Delayed healing, emotional distress, false hope: Psychologists say stalking your ex's social media may be doing more harm than good",https://economictimes.indiatimes.com/articleshow/132217396.cms,2026-07-06T19:50:55+00:00
ET Panache Lifestyle,https://economictimes.indiatimes.com/magazines/panache/lifestyle,lifestyle,3,"Loud silences, unfiltered thoughts, quiet strength: 25-year-old Gurgaon-based product manager shares 6 lessons living alone taught him. ‘I hope everyone gets to meet themselves’",https://economictimes.indiatimes.com/articleshow/132216415.cms,2026-07-06T19:50:55+00:00
ET Panache Lifestyle,https://economictimes.indiatimes.com/magazines/panache/lifestyle,lifestyle,4,Want more butterflies and bees in your garden? These 7 plants can make it happen,https://economictimes.indiatimes.com/articleshow/132207962.cms,2026-07-06T19:50:55+00:00
ET Panache Lifestyle,https://economictimes.indiatimes.com/magazines/panache/lifestyle,lifestyle,5,Anand Mahindra is in search of 'monsoon magic' at a small 'picture book' city in the East,https://economictimes.indiatimes.com/articleshow/132194108.cms,2026-07-06T19:50:55+00:00
ET Panache Lifestyle,https://economictimes.indiatimes.com/magazines/panache/lifestyle,lifestyle,6,"He sold his business for Rs 4,000 crore. Within four years, he lost more than Rs 3,000 crore. Harsh Goenka reveals: 'Creating wealth is a talent but...'",https://economictimes.indiatimes.com/articleshow/132191748.cms,2026-07-06T19:50:55+00:00
ET Panache Lifestyle,https://economictimes.indiatimes.com/magazines/panache/lifestyle,lifestyle,7,"Fashion Playbook: From Wimbledon whites to F1 paddock chic, the biggest sports fashion trends ruling 2026",https://economictimes.indiatimes.com/articleshow/132189999.cms,2026-07-06T19:50:55+00:00
ET Panache Lifestyle,https://economictimes.indiatimes.com/magazines/panache/lifestyle,lifestyle,8,Persian proverb of the day: 'This game is not suitable for you whose house is made of straw' ; life lessons on resisting impulsive behaviour and knowing your flaws before judging others,https://economictimes.indiatimes.com/articleshow/132184615.cms,2026-07-06T19:50:55+00:00
ET Panache Lifestyle,https://economictimes.indiatimes.com/magazines/panache/lifestyle,lifestyle,9,"Sadhguru says a 100-year-old food has ‘tremendous’ healing properties, can cure IBS, strengthen immunity",https://economictimes.indiatimes.com/articleshow/132178664.cms,2026-07-06T19:50:55+00:00
ET Panache Lifestyle,https://economictimes.indiatimes.com/magazines/panache/lifestyle,lifestyle,10,"‘Harmony of the wild’: IAS officer marvels at elephant's chance encounter with deer herd. Just 240 km from Bengaluru, this lush tiger reserve promises an unforgettable wildlife escape",https://economictimes.indiatimes.com/articleshow/132177463.cms,2026-07-06T19:50:55+00:00
ET Panache Lifestyle,https://economictimes.indiatimes.com/magazines/panache/lifestyle,lifestyle,11,Quote of the day by Coldplay front man Chris Martin: 'I think in life everyone needs to be broken in some way..' ; life lessons on dealing with setbacks from British singer,https://economictimes.indiatimes.com/articleshow/132162473.cms,2026-07-06T19:50:55+00:00
ET Panache Lifestyle,https://economictimes.indiatimes.com/magazines/panache/lifestyle,lifestyle,12,"5 unusual edible plants you can grow at home for better taste, nutrition and variety",https://economictimes.indiatimes.com/articleshow/132154780.cms,2026-07-06T19:50:55+00:00
ET Panache Lifestyle,https://economictimes.indiatimes.com/magazines/panache/lifestyle,lifestyle,13,Ever wondered what Amitabh Bachchan reads? Here are 6 books he has personally recommended,https://economictimes.indiatimes.com/articleshow/132151348.cms,2026-07-06T19:50:55+00:00
