source,source_url,category,rank,headline,link,collected_at_iso
Healthline Recent,https://www.healthline.com/directory/recent,health,188,Does Zepbound Need To Be Refrigerated?,https://www.healthline.com/health/drugs/does-zepbound-need-to-be-refrigerated,2026-04-13T09:52:31+00:00
Healthline Recent,https://www.healthline.com/directory/recent,health,189,How to Manage the Costs of Multiple Myeloma Treatment,https://www.healthline.com/health/multiple-myeloma/managing-treatment-costs,2026-04-13T09:52:31+00:00
Healthline Recent,https://www.healthline.com/directory/recent,health,190,What to Know About Monoclonal Antibodies for Inflammatory Bowel Disease,https://www.healthline.com/health/ibd/monoclonal-antibodies,2026-04-13T09:52:31+00:00
Healthline Recent,https://www.healthline.com/directory/recent,health,191,Hemangioma of the Liver (Hepatic Hemangioma),https://www.healthline.com/health/hepatic-hemangioma,2026-04-13T09:52:31+00:00
Healthline Recent,https://www.healthline.com/directory/recent,health,192,Quiz: Do You Know What a Balanced Meal Really Looks Like?,https://www.healthline.com/health/quiz/quiz-can-you-spot-the-balanced-meal,2026-04-13T09:52:31+00:00
Healthline Recent,https://www.healthline.com/directory/recent,health,193,Reltone: What You Need to Know for Gallstone Care,https://www.healthline.com/health/drugs/reltone,2026-04-13T09:52:31+00:00
Healthline Recent,https://www.healthline.com/directory/recent,health,194,"What Does Pet Insurance Cover, and How Can I Choose the Right Plan?",https://www.healthline.com/health/pet-health/what-does-pet-insurance-cover,2026-04-13T09:52:31+00:00
Healthline Recent,https://www.healthline.com/directory/recent,health,195,Enspryng Side Effects and Tips for Managing Them,https://www.healthline.com/health/drugs/enspryng-side-effects,2026-04-13T09:52:31+00:00
Healthline Recent,https://www.healthline.com/directory/recent,health,196,How to Treat Hormone-Related Dry Eye During and After Menopause,https://www.healthline.com/health/dry-eye/treating-hormone-related-dry-eye,2026-04-13T09:52:31+00:00
Healthline Recent,https://www.healthline.com/directory/recent,health,197,Your Guide to Dental Health for Cats,https://www.healthline.com/health/pet-health/dental-health-for-cats,2026-04-13T09:52:31+00:00
Healthline Recent,https://www.healthline.com/directory/recent,health,198,Making a Migraine-Friendly Grocery List: A Shopping Guide,https://www.healthline.com/health/migraine/a-migraine-friendly-grocery-list,2026-04-13T09:52:31+00:00
Healthline Recent,https://www.healthline.com/directory/recent,health,199,I Quit Doomscrolling a Year Ago: My Experience with Analog Bags and Digital Minimalism,https://www.healthline.com/health/analog-bags,2026-04-13T09:52:31+00:00
Healthline Recent,https://www.healthline.com/directory/recent,health,200,Yeztugo Side Effects and Warnings,https://www.healthline.com/health/drugs/yeztugo-side-effects,2026-04-13T09:52:31+00:00
Healthline Recent,https://www.healthline.com/directory/recent,health,201,Is Repatha Safe?,https://www.healthline.com/health/drugs/is-repatha-safe,2026-04-13T09:52:31+00:00
Healthline Recent,https://www.healthline.com/directory/recent,health,202,About Spay Surgery and How to Help Your Cat Recover,https://www.healthline.com/health/pet-health/cat-spay-surgery,2026-04-13T09:52:31+00:00
Healthline Recent,https://www.healthline.com/directory/recent,health,203,How Much Food Should I Give My Cat Each Day,https://www.healthline.com/health/pet-health/how-much-food-should-i-give-my-cat-each-day,2026-04-13T09:52:31+00:00
Healthline Recent,https://www.healthline.com/directory/recent,health,204,Possible Complications of B-Cell Lymphoma,https://www.healthline.com/health/possible-complications-of-b-cell-lymphoma-infographic,2026-04-13T09:52:31+00:00
Healthline Recent,https://www.healthline.com/directory/recent,health,205,What Is Chrononutrition and Is It Right for You?,https://www.healthline.com/health/nutrition/what-is-chrononutrition,2026-04-13T09:52:31+00:00
Healthline Recent,https://www.healthline.com/directory/recent,health,206,Ask the Expert About EGFR-Positive Lung Cancer Recurrence,https://www.healthline.com/health/lung-cancer/ask-the-expert-about-egfr-positive-lung-cancer-recurrence,2026-04-13T09:52:31+00:00
Healthline Recent,https://www.healthline.com/directory/recent,health,207,"How to Travel with Mounjaro: Flights, Road Trips, and Storage Made Simple",https://www.healthline.com/health/drugs/how-to-travel-with-mounjaro,2026-04-13T09:52:31+00:00
Healthline Recent,https://www.healthline.com/directory/recent,health,208,Ask the Advocate: Coping with Fatigue in Multiple Myeloma,https://www.healthline.com/health/multiple-myeloma/coping-with-fatigue-advocate,2026-04-13T09:52:31+00:00
Healthline Recent,https://www.healthline.com/directory/recent,health,209,Insulin for Cats,https://www.healthline.com/health/drugs/insulin-for-cats,2026-04-13T09:52:31+00:00
Healthline Recent,https://www.healthline.com/directory/recent,health,210,An Expert Explains What to Expect When Switching Medications for Crohn’s Disease,https://www.healthline.com/health/crohns-disease/ask-the-expert-switching-medications,2026-04-13T09:52:31+00:00
Healthline Nutrition,https://www.healthline.com/nutrition,health,1,How Well Do You Sleep?,https://www.healthline.com/health/healthy-sleep/quiz-how-well-do-you-sleep,2026-04-13T09:52:31+00:00
Healthline Nutrition,https://www.healthline.com/nutrition,health,2,Are You a Workaholic?,https://www.healthline.com/health/mental-health/quiz-are-you-a-workaholic,2026-04-13T09:52:31+00:00
Healthline Nutrition,https://www.healthline.com/nutrition,health,3,5 Tips for a Healthy Lifestyle,https://www.healthline.com/health/fitness-nutrition/healthy-lifestyle-benefits,2026-04-13T09:52:31+00:00
Healthline Nutrition,https://www.healthline.com/nutrition,health,4,How to Disinfect Your House After the Flu,https://www.healthline.com/health/flu/how-to-disinfect-house-after-flu,2026-04-13T09:52:31+00:00
Healthline Nutrition,https://www.healthline.com/nutrition,health,5,Best Vegan and Plant-Based Meal Delivery for 2025,https://www.healthline.com/nutrition/plant-based-meal-delivery,2026-04-13T09:52:31+00:00
Healthline Nutrition,https://www.healthline.com/nutrition,health,6,Does Medicare Cover Pneumonia Shots?,https://www.healthline.com/health/medicare/does-medicare-cover-pneumonia-shots,2026-04-13T09:52:31+00:00
Healthline Nutrition,https://www.healthline.com/nutrition,health,7,"Chromosomes, Genetics, and Your Health",https://www.healthline.com/health/chromosomes-and-genetics,2026-04-13T09:52:31+00:00
Healthline Nutrition,https://www.healthline.com/nutrition,health,8,Best Multivitamins for Women,https://www.healthline.com/nutrition/multivitamins-womens-health,2026-04-13T09:52:31+00:00
Healthline Nutrition,https://www.healthline.com/nutrition,health,9,Best Multivitamins for Men,https://www.healthline.com/nutrition/best-multivitamins-for-men,2026-04-13T09:52:31+00:00
Healthline Nutrition,https://www.healthline.com/nutrition,health,10,Best Online Therapy Services,https://www.healthline.com/health/our-top-10-online-therapy-picks,2026-04-13T09:52:31+00:00
Healthline Nutrition,https://www.healthline.com/nutrition,health,11,Online Therapy That Takes Insurance,https://www.healthline.com/health/mental-health/online-therapy-that-takes-insurance,2026-04-13T09:52:31+00:00
Healthline Nutrition,https://www.healthline.com/nutrition,health,12,Buy Ozempic Online,https://www.healthline.com/nutrition/buy-ozempic-online,2026-04-13T09:52:31+00:00
Healthline Nutrition,https://www.healthline.com/nutrition,health,13,Through an Artist's Eye,https://www.healthline.com/health/breast-cancer/metastatic-breast-cancer-artist-eye,2026-04-13T09:52:31+00:00
Healthline Nutrition,https://www.healthline.com/nutrition,health,14,Feel Good Food,https://www.healthline.com/nutrition/feel-good-food,2026-04-13T09:52:31+00:00
Healthline Nutrition,https://www.healthline.com/nutrition,health,15,Vitamins & Supplements,https://www.healthline.com/nutrition/vitamins-and-supplements,2026-04-13T09:52:31+00:00
Healthline Nutrition,https://www.healthline.com/nutrition,health,16,Eat It or Leave It? A Comprehensive Ingredient Dictionary to Simplify Your Shopping Trip,https://www.healthline.com/nutrition/eat-it-or-leave-it-a-comprehensive-ingredient-dictionary-to-simplify-your-shopping-trip,2026-04-13T09:52:31+00:00
Healthline Nutrition,https://www.healthline.com/nutrition,health,17,Healthy Eating Refresh: Letter from the Editor,https://www.healthline.com/nutrition/healthy-eating-refresh-letter-from-the-editor,2026-04-13T09:52:31+00:00
Healthline Nutrition,https://www.healthline.com/nutrition,health,18,Get Your Vitamin P: Why Pleasure Matters When It Comes to What You Eat,https://www.healthline.com/nutrition/get-your-vitamin-p-why-pleasure-matters-when-it-comes-to-what-you-eat,2026-04-13T09:52:31+00:00
Healthline Nutrition,https://www.healthline.com/nutrition,health,19,10 Ways to Lower Your Grocery Bill as Prices Increase,https://www.healthline.com/nutrition/lower-grocery-bill-inflation,2026-04-13T09:52:31+00:00
Healthline Nutrition,https://www.healthline.com/nutrition,health,20,15 Staple Foods to Make Healthy Eating Easy All Week Long,https://www.healthline.com/nutrition/staple-foods-to-make-healthy-eating-easy-all-week-long,2026-04-13T09:52:31+00:00
Healthline Nutrition,https://www.healthline.com/nutrition,health,21,The Definitive Guide to Healthy Eating in Real Life,https://www.healthline.com/nutrition/how-to-eat-healthy-guide,2026-04-13T09:52:31+00:00
Healthline Nutrition,https://www.healthline.com/nutrition,health,22,How to Stock Your Pantry for Quick & Easy Meals in Minutes,https://www.healthline.com/nutrition/how-to-stock-your-pantry-for-quick-easy-meals-in-minutes,2026-04-13T09:52:31+00:00
Healthline Nutrition,https://www.healthline.com/nutrition,health,23,"Plant-based Protein: The Best, the Worst, and Everything In Between",https://www.healthline.com/nutrition/plant-based-protein-the-best-the-worst-and-everything-in-between,2026-04-13T09:52:31+00:00
Healthline Nutrition,https://www.healthline.com/nutrition,health,24,The Definitive Guide to Healthy Grocery Shopping,https://www.healthline.com/nutrition/healthy-grocery-shopping-guide,2026-04-13T09:52:31+00:00
Healthline Nutrition,https://www.healthline.com/nutrition,health,25,Try it or Toss it? The Supplements You Need and the Ones You Can Skip,https://www.healthline.com/nutrition/try-it-or-toss-it-the-supplements-you-need-and-the-ones-you-can-skip,2026-04-13T09:52:31+00:00
Healthline Nutrition,https://www.healthline.com/nutrition,health,26,"How to Find Wisdom in Food Cravings, Plus 7 Ways to Make Peace With…",https://www.healthline.com/nutrition/finding-the-wisdom-in-food-cravings-plus-tk-techniques-to-make-peace-with-them,2026-04-13T09:52:31+00:00
Healthline Nutrition,https://www.healthline.com/nutrition,health,27,How to Ditch Diet Culture and Learn to Trust Your Body’s Cues,https://www.healthline.com/nutrition/what-is-food-freedom-getting-started-weight-loss-and-tips,2026-04-13T09:52:31+00:00
Healthline Nutrition,https://www.healthline.com/nutrition,health,28,"Dear Fat, Black Girls Who Were Not Spared from Diet Culture—I…",https://www.healthline.com/health/diet-culture-affects-fat-black-women,2026-04-13T09:52:31+00:00
Healthline Nutrition,https://www.healthline.com/nutrition,health,29,The Dangers of Diet Culture: 10 Women Share How Toxic It Is,https://www.healthline.com/health/mental-health/diet-culture,2026-04-13T09:52:31+00:00
Healthline Nutrition,https://www.healthline.com/nutrition,health,30,12 High Carb Foods That Are Incredibly Healthy,https://www.healthline.com/nutrition/12-healthy-high-carb-foods,2026-04-13T09:52:31+00:00
Healthline Nutrition,https://www.healthline.com/nutrition,health,31,"9 Tips for Joyful, Balanced Eating from Divya's Ayurvedic Kitchen",https://www.healthline.com/nutrition/tips-for-finding-balance-and-joy-through-food-from-divyas-ayurvedic-kitchen,2026-04-13T09:52:31+00:00
Healthline Nutrition,https://www.healthline.com/nutrition,health,32,"Vegan Teen Chef Tabay Atkins on Healthy, Heart-Based Eating",https://www.healthline.com/nutrition/vegan-teen-chef-tabay-atkins-on-healthy-heart-based-eating,2026-04-13T09:52:31+00:00
Healthline Nutrition,https://www.healthline.com/nutrition,health,33,How to Be an Ethical Omnivore,https://www.healthline.com/nutrition/ethical-omnivore,2026-04-13T09:52:31+00:00
Healthline Nutrition,https://www.healthline.com/nutrition,health,34,Is BMI a Fair Health Metric for Black Women?,https://www.healthline.com/nutrition/bmi-for-black-women,2026-04-13T09:52:31+00:00
Healthline Nutrition,https://www.healthline.com/nutrition,health,35,How Long Does It Take to Lose Weight?,https://www.healthline.com/nutrition/how-long-does-it-take-to-lose-weight,2026-04-13T09:52:31+00:00
Healthline Nutrition,https://www.healthline.com/nutrition,health,36,Omega-3 Supplement Guide,https://www.healthline.com/nutrition/omega-3-supplement-guide,2026-04-13T09:52:31+00:00
Healthline Nutrition,https://www.healthline.com/nutrition,health,37,The 15 Best Supplements to Boost Your Immune System Right Now,https://www.healthline.com/nutrition/immune-boosting-supplements,2026-04-13T09:52:31+00:00
Healthline Nutrition,https://www.healthline.com/nutrition,health,38,8 Best Vitamin D Supplements for Optimal Absorption: Reviewed by…,https://www.healthline.com/nutrition/best-vitamin-d-supplements,2026-04-13T09:52:31+00:00
Healthline Nutrition,https://www.healthline.com/nutrition,health,39,Can Vitamin D Lower Your Risk of COVID-19?,https://www.healthline.com/nutrition/vitamin-d-coronavirus,2026-04-13T09:52:31+00:00
Healthline Nutrition,https://www.healthline.com/nutrition,health,40,"5 Best Fish Oil Supplements to Boost Your Omega-3s in 2026, According…",https://www.healthline.com/nutrition/best-fish-oil-supplement,2026-04-13T09:52:31+00:00
Healthline Nutrition,https://www.healthline.com/nutrition,health,41,"3 Best Personalized Vitamin Subscription Services in 2026, According…",https://www.healthline.com/nutrition/personalized-vitamins,2026-04-13T09:52:31+00:00
Healthline Nutrition,https://www.healthline.com/nutrition,health,42,The 17 Best Foods for High Blood Pressure,https://www.healthline.com/nutrition/foods-high-blood-pressure,2026-04-13T09:52:31+00:00
Healthline Nutrition,https://www.healthline.com/nutrition,health,43,The 13 Most Anti-Inflammatory Foods You Can Eat,https://www.healthline.com/nutrition/13-anti-inflammatory-foods,2026-04-13T09:52:31+00:00
Healthline Nutrition,https://www.healthline.com/nutrition,health,44,"Hashimoto Diet: Overview, Foods, Supplements, and Tips",https://www.healthline.com/nutrition/hashimoto-diet,2026-04-13T09:52:31+00:00
Healthline Nutrition,https://www.healthline.com/nutrition,health,45,18 of the Best Non-Perishables for People with Diabetes,https://www.healthline.com/nutrition/non-perishables-for-people-with-diabetes,2026-04-13T09:52:31+00:00
Healthline Nutrition,https://www.healthline.com/nutrition,health,46,Foods and Beverages to Avoid with Arthritis,https://www.healthline.com/nutrition/foods-to-avoid-arthritis,2026-04-13T09:52:31+00:00
Healthline Nutrition,https://www.healthline.com/nutrition,health,47,How to Follow a Vestibular Migraine Diet,https://www.healthline.com/nutrition/vestibular-migraine-diet,2026-04-13T09:52:31+00:00
Healthline Nutrition,https://www.healthline.com/nutrition,health,48,Reflecting on the Intersection of Veganism and Blackness During Black…,https://www.healthline.com/nutrition/reflecting-on-the-intersection-of-veganism-and-blackness-2,2026-04-13T09:52:31+00:00
Healthline Nutrition,https://www.healthline.com/nutrition,health,49,How to Build a Balanced Caribbean Meal,https://www.healthline.com/nutrition/balanced-caribbean-meal,2026-04-13T09:52:31+00:00
Healthline Nutrition,https://www.healthline.com/nutrition,health,50,I’m a Black Dietitian — Here’s What I Want You to Know About Food and…,https://www.healthline.com/health/food-nutrition/black-dietician-food-and-racism,2026-04-13T09:52:31+00:00
Healthline Nutrition,https://www.healthline.com/nutrition,health,51,Welcome to Healthline Nutrition: A Letter from the Editor,https://www.healthline.com/nutrition/welcome-to-nutrition-editor-letter,2026-04-13T09:52:31+00:00
Healthline Nutrition,https://www.healthline.com/nutrition,health,52,I’m a Dietitian with Hashimoto’s Disease — Here’s My Story,https://www.healthline.com/nutrition/im-a-dietitian-living-with-hashimotos-disease,2026-04-13T09:52:31+00:00
Healthline Nutrition,https://www.healthline.com/nutrition,health,53,What’s the Difference Between a Dietitian and a Nutritionist?,https://www.healthline.com/nutrition/dietitian-vs-nutritionist,2026-04-13T09:52:31+00:00
Healthline Nutrition,https://www.healthline.com/nutrition,health,54,Cultural Competence in Nutrition and Dietetics: What We Need to Know,https://www.healthline.com/nutrition/cultural-competence-in-dietetics,2026-04-13T09:52:31+00:00
Healthline Nutrition,https://www.healthline.com/nutrition,health,55,5 Types of Eco-Friendly Food Packaging (and 3 to Avoid),https://www.healthline.com/nutrition/eco-friendly-food-packaging,2026-04-13T09:52:31+00:00
Healthline Nutrition,https://www.healthline.com/nutrition,health,56,How to Start Composting at Home,https://www.healthline.com/nutrition/composting-beginners-guide,2026-04-13T09:52:31+00:00
Healthline Nutrition,https://www.healthline.com/nutrition,health,57,I'm Raising My Kids on a Plant-Based Diet for Their Future,https://www.healthline.com/nutrition/raising-kids-vegetarian,2026-04-13T09:52:31+00:00
Healthline Nutrition,https://www.healthline.com/nutrition,health,58,Can You Follow an Eco-Friendly Diet and Still Eat Meat?,https://www.healthline.com/nutrition/eco-friendly-meat-eating,2026-04-13T09:52:31+00:00
Healthline Nutrition,https://www.healthline.com/nutrition,health,59,Palm Oil’s Environmental Impact: Can It Be Grown Sustainably?,https://www.healthline.com/nutrition/palm-oil-deforestation,2026-04-13T09:52:31+00:00
Healthline Nutrition,https://www.healthline.com/nutrition,health,60,Nutrition in Daily Life: A Trinbagonian Dietitian's Journey,https://www.healthline.com/nutrition/nutrition-in-daily-life,2026-04-13T09:52:31+00:00
TOI Life & Style,https://timesofindia.indiatimes.com/life-style,lifestyle,1,"When Hardik Pandya revealed what made him connect with girlfriend Mahieka Sharma: ""We started talking...""",https://timesofindia.indiatimes.com/articleshow/130232018.cms,2026-04-13T09:52:31+00:00
TOI Life & Style,https://timesofindia.indiatimes.com/life-style,lifestyle,2,This one habit can strengthen your relationship,https://timesofindia.indiatimes.com/articleshow/130231263.cms,2026-04-13T09:52:31+00:00
TOI Life & Style,https://timesofindia.indiatimes.com/life-style,lifestyle,3,"Love quote of the day by Sadhguru: ""If there is love in your heart, it will...""",https://timesofindia.indiatimes.com/articleshow/130225866.cms,2026-04-13T09:52:31+00:00
TOI Life & Style,https://timesofindia.indiatimes.com/life-style,lifestyle,4,2 red flags you should never ignore,https://timesofindia.indiatimes.com/articleshow/130208482.cms,2026-04-13T09:52:31+00:00
TOI Life & Style,https://timesofindia.indiatimes.com/life-style,lifestyle,5,4 simple habits that can fix any relationship,https://timesofindia.indiatimes.com/articleshow/130208293.cms,2026-04-13T09:52:31+00:00
TOI Life & Style,https://timesofindia.indiatimes.com/life-style,lifestyle,6,"Sleep well, cut belly fat to reduce breast cancer risk",https://timesofindia.indiatimes.com/articleshow/126379620.cms,2026-04-13T09:52:31+00:00
TOI Life & Style,https://timesofindia.indiatimes.com/life-style,lifestyle,7,‘Something’s tightening under my skin’,https://timesofindia.indiatimes.com/articleshow/126379459.cms,2026-04-13T09:52:31+00:00
TOI Life & Style,https://timesofindia.indiatimes.com/life-style,lifestyle,8,Baby formula recall across multiple countries: Safety concerns and symptoms to watch,https://timesofindia.indiatimes.com/articleshow/126377435.cms,2026-04-13T09:52:31+00:00
TOI Life & Style,https://timesofindia.indiatimes.com/life-style,lifestyle,9,"Typhoid myths that delay diagnosis, treatment and recovery",https://timesofindia.indiatimes.com/articleshow/126375787.cms,2026-04-13T09:52:31+00:00
TOI Life & Style,https://timesofindia.indiatimes.com/life-style,lifestyle,10,"Struggling with diabetes, blood pressure, or heart issues? Here are some simple exercises that can help",https://timesofindia.indiatimes.com/articleshow/126372859.cms,2026-04-13T09:52:31+00:00
TOI Life & Style,https://timesofindia.indiatimes.com/life-style,lifestyle,11,"Stop wearing these 7 staples: Fashion experts spill the beans on outdated styles, suggest what to buy instead",https://timesofindia.indiatimes.com/articleshow/130230102.cms,2026-04-13T09:52:31+00:00
TOI Life & Style,https://timesofindia.indiatimes.com/life-style,lifestyle,12,Devil Wears Prada 2 ends Asia tour - Meryl Streep’s blue look is the real headliner,https://timesofindia.indiatimes.com/articleshow/130229199.cms,2026-04-13T09:52:31+00:00
TOI Life & Style,https://timesofindia.indiatimes.com/life-style,lifestyle,13,How to pick the most flattering earring style for your face shape: Jewellery expert reveals,https://timesofindia.indiatimes.com/articleshow/130223856.cms,2026-04-13T09:52:31+00:00
TOI Life & Style,https://timesofindia.indiatimes.com/life-style,lifestyle,14,Transparent raincoat to coronation dress: Queen Elizabeth II's five iconic outfits from her royal exhibition,https://timesofindia.indiatimes.com/articleshow/130224636.cms,2026-04-13T09:52:31+00:00
TOI Life & Style,https://timesofindia.indiatimes.com/life-style,lifestyle,15,"Cheering for RCB, Anushka Sharma nails effortless style",https://timesofindia.indiatimes.com/articleshow/130224410.cms,2026-04-13T09:52:31+00:00
TOI Life & Style,https://timesofindia.indiatimes.com/life-style,lifestyle,16,Kareena stuns in red Valentino as Saif can’t take eyes off her,https://timesofindia.indiatimes.com/articleshow/130209251.cms,2026-04-13T09:52:31+00:00
TOI Life & Style,https://timesofindia.indiatimes.com/life-style,lifestyle,17,Ankur Warikoo’s post on parents is hitting everyone right in the heart,https://timesofindia.indiatimes.com/articleshow/130231910.cms,2026-04-13T09:52:31+00:00
TOI Life & Style,https://timesofindia.indiatimes.com/life-style,lifestyle,18,Who is Richard Maza? YouTuber arrested after pepper spray clash; lawsuit crosses $1 million,https://timesofindia.indiatimes.com/articleshow/130231139.cms,2026-04-13T09:52:31+00:00
TOI Life & Style,https://timesofindia.indiatimes.com/life-style,lifestyle,19,What is Bixonimania? How AI treated a fake illness as a real medical condition,https://timesofindia.indiatimes.com/articleshow/130230032.cms,2026-04-13T09:52:31+00:00
TOI Life & Style,https://timesofindia.indiatimes.com/life-style,lifestyle,20,‘Priorities clear’: Hilarious KKR vs LSG clip shows husband glued to match as wife walks away mid-argument,https://timesofindia.indiatimes.com/articleshow/130225505.cms,2026-04-13T09:52:31+00:00
TOI Life & Style,https://timesofindia.indiatimes.com/life-style,lifestyle,21,Foreign woman rates Indian cities; Delhi’s shocking score doesn’t surprise many,https://timesofindia.indiatimes.com/articleshow/130224421.cms,2026-04-13T09:52:31+00:00
TOI Life & Style,https://timesofindia.indiatimes.com/life-style,lifestyle,22,From sleeping on streets to giving shelter to others: NYC restaurant owner builds refuge for the homeless,https://timesofindia.indiatimes.com/articleshow/130232214.cms,2026-04-13T09:52:31+00:00
TOI Life & Style,https://timesofindia.indiatimes.com/life-style,lifestyle,23,Sadhguru tells Alia to learn from daughter Raha on how to live,https://timesofindia.indiatimes.com/articleshow/130230550.cms,2026-04-13T09:52:31+00:00
TOI Life & Style,https://timesofindia.indiatimes.com/life-style,lifestyle,24,Clean eating vs. realistic cravings during pregnancy: Can both coexist?,https://timesofindia.indiatimes.com/articleshow/130206818.cms,2026-04-13T09:52:31+00:00
TOI Life & Style,https://timesofindia.indiatimes.com/life-style,lifestyle,25,Kindergarten students learn sign language to surprise their deaf janitor,https://timesofindia.indiatimes.com/articleshow/130226174.cms,2026-04-13T09:52:31+00:00
TOI Life & Style,https://timesofindia.indiatimes.com/life-style,lifestyle,26,5 Clean eating myths parents should know,https://timesofindia.indiatimes.com/articleshow/130228570.cms,2026-04-13T09:52:31+00:00
TOI Life & Style,https://timesofindia.indiatimes.com/life-style,lifestyle,27,How parents can make Mondays positive for kids,https://timesofindia.indiatimes.com/articleshow/130225825.cms,2026-04-13T09:52:31+00:00
TOI Life & Style,https://timesofindia.indiatimes.com/life-style,lifestyle,28,7 Benefits of summer classes for children,https://timesofindia.indiatimes.com/articleshow/130224954.cms,2026-04-13T09:52:31+00:00
TOI Life & Style,https://timesofindia.indiatimes.com/life-style,lifestyle,29,Quote of the day by Byron Katie: “Placing the blame or judgment on someone else leaves you powerless to change your experience; taking...”,https://timesofindia.indiatimes.com/articleshow/130199085.cms,2026-04-13T09:52:31+00:00
TOI Life & Style,https://timesofindia.indiatimes.com/life-style,lifestyle,30,"Quote of the day by Jay Shetty: “There is toxicity everywhere around us. In the environment, in the political atmosphere, but the origin is in people’s hearts. Unless we…”",https://timesofindia.indiatimes.com/articleshow/130146913.cms,2026-04-13T09:52:31+00:00
TOI Life & Style,https://timesofindia.indiatimes.com/life-style,lifestyle,31,Quote of the day by Dalai Lama: “Peace does not mean an absence of conflicts; differences will always be there. Peace means…”,https://timesofindia.indiatimes.com/articleshow/130115879.cms,2026-04-13T09:52:31+00:00
