source,source_url,category,rank,headline,link,collected_at_iso
ET Panache Worklife,https://economictimes.indiatimes.com/magazines/panache/worklife,worklife,28,Sonakshi Sinha Wedding,https://economictimes.indiatimes.com/articleshow/111203848.cms,2026-07-06T19:50:55+00:00
ET Panache Worklife,https://economictimes.indiatimes.com/magazines/panache/worklife,worklife,29,Sania Mirza Mohammed Shami,https://economictimes.indiatimes.com/articleshow/111157002.cms,2026-07-06T19:50:55+00:00
ET Panache Worklife,https://economictimes.indiatimes.com/magazines/panache/worklife,worklife,30,Bigg Boss OTT 3,https://economictimes.indiatimes.com/articleshow/111104026.cms,2026-07-06T19:50:55+00:00
ET Panache Worklife,https://economictimes.indiatimes.com/magazines/panache/worklife,worklife,31,Panchayat Season 3 OTT Release,https://economictimes.indiatimes.com/articleshow/110140474.cms,2026-07-06T19:50:55+00:00
ET Panache Worklife,https://economictimes.indiatimes.com/magazines/panache/worklife,worklife,32,Cannes 2024 Live Streaming,https://economictimes.indiatimes.com/articleshow/110116799.cms,2026-07-06T19:50:55+00:00
ET Panache Worklife,https://economictimes.indiatimes.com/magazines/panache/worklife,worklife,33,Pavitra Jayaram Death,https://economictimes.indiatimes.com/articleshow/110069299.cms,2026-07-06T19:50:55+00:00
ET Panache Worklife,https://economictimes.indiatimes.com/magazines/panache/worklife,worklife,34,Rituraj Singh Death,https://economictimes.indiatimes.com/articleshow/107842242.cms,2026-07-06T19:50:55+00:00
ET Panache Worklife,https://economictimes.indiatimes.com/magazines/panache/worklife,worklife,35,"Quote of the Day by Audrey Hepburn: “Why change? Everyone has his own style. When you have found it, you should...” - Inspiring life lessons on Discipline, Self-Control, Identity, Simplicity, and Courage from a British actress, humanitarian, film and fashion icon, and one of Classical Hollywood's greatest screen legends",https://economictimes.indiatimes.com/articleshow/132222442.cms,2026-07-06T19:50:55+00:00
ET Panache Worklife,https://economictimes.indiatimes.com/magazines/panache/worklife,worklife,36,"Don't just assemble, innovate: The missing hero in India's smartphone success story",https://economictimes.indiatimes.com/articleshow/132224706.cms,2026-07-06T19:50:55+00:00
ET Panache Worklife,https://economictimes.indiatimes.com/magazines/panache/worklife,worklife,37,Pedagogy of Vishnu,https://economictimes.indiatimes.com/articleshow/132224759.cms,2026-07-06T19:50:55+00:00
ET Panache Worklife,https://economictimes.indiatimes.com/magazines/panache/worklife,worklife,38,"Kharif sowing picks up, but still 21% below last year",https://economictimes.indiatimes.com/articleshow/132224809.cms,2026-07-06T19:50:55+00:00
ET Panache Worklife,https://economictimes.indiatimes.com/magazines/panache/worklife,worklife,39,Firm up the Troika within the Quad,https://economictimes.indiatimes.com/articleshow/132224828.cms,2026-07-06T19:50:55+00:00
ET Panache Worklife,https://economictimes.indiatimes.com/magazines/panache/worklife,worklife,40,Taiwan Travelogue by Yang Shuang-zi,https://economictimes.indiatimes.com/articleshow/132224826.cms,2026-07-06T19:50:55+00:00
ET Panache Worklife,https://economictimes.indiatimes.com/magazines/panache/worklife,worklife,41,The red card that didn't stick,https://economictimes.indiatimes.com/articleshow/132224611.cms,2026-07-06T19:50:55+00:00
ET Panache Worklife,https://economictimes.indiatimes.com/magazines/panache/worklife,worklife,42,"if(typeof objAd !=""undefined""){ objAd.loadAds(); } Quote of the day by Julia Roberts: 'We've all been broken at some point. Forgiving...' Life lessons on emotional resilience, hardships, self-compassion, healing and why is it essential to let go of past",https://economictimes.indiatimes.com/articleshow/132197213.cms,2026-07-06T19:50:55+00:00
ET Panache Worklife,https://economictimes.indiatimes.com/magazines/panache/worklife,worklife,43,"Middle class, aspirational consumers to drive 93% of India's spending by 2036: Sitharaman",https://economictimes.indiatimes.com/articleshow/132193476.cms,2026-07-06T19:50:55+00:00
ET Panache Worklife,https://economictimes.indiatimes.com/magazines/panache/worklife,worklife,44,"​Two CRPF inspectors clear every round of promotion exam, then failed over forearm tattoo: Delhi HC refuses relief despite tattoo removal; tattoos went unnoticed since joining",https://economictimes.indiatimes.com/articleshow/132195612.cms,2026-07-06T19:50:55+00:00
ET Panache Worklife,https://economictimes.indiatimes.com/magazines/panache/worklife,worklife,45,"if(typeof objAd !=""undefined""){ objAd.loadAds(); } Mumbai schools, colleges to remain shut on July 6 amid heavy rains",https://economictimes.indiatimes.com/articleshow/132197714.cms,2026-07-06T19:50:55+00:00
ET Panache Worklife,https://economictimes.indiatimes.com/magazines/panache/worklife,worklife,46,BJP-RSS responsible for Ram Temple 'loot': Cong chief Mallikarjun Kharge,https://economictimes.indiatimes.com/articleshow/132195690.cms,2026-07-06T19:50:55+00:00
ET Panache Worklife,https://economictimes.indiatimes.com/magazines/panache/worklife,worklife,47,"if(typeof objAd !=""undefined""){ objAd.loadAds(); } India, Australia set to seal uranium supply pact during PM Modi’s visit",https://economictimes.indiatimes.com/articleshow/132205236.cms,2026-07-06T19:50:55+00:00
ET Panache Worklife,https://economictimes.indiatimes.com/magazines/panache/worklife,worklife,48,"if(typeof objAd !=""undefined""){ objAd.loadAds(); } Shah Rukh Khan’s co-star Chandrachur Singh steps out as bulldozer demolishes ramp outside Gurugram home, his calm exchange with officials goes viral. Watch",https://economictimes.indiatimes.com/articleshow/132192986.cms,2026-07-06T19:50:55+00:00
ET Panache Worklife,https://economictimes.indiatimes.com/magazines/panache/worklife,worklife,49,"if(typeof objAd !=""undefined""){ objAd.loadAds(); } America’s battlefield dominance is under serious threat",https://economictimes.indiatimes.com/articleshow/132193035.cms,2026-07-06T19:50:55+00:00
ET Panache Worklife,https://economictimes.indiatimes.com/magazines/panache/worklife,worklife,50,"if(typeof objAd !=""undefined""){ objAd.loadAds(); } Mumbai issues work from home advisory for private offices, some govt offices to observe half day amid heavy rains",https://economictimes.indiatimes.com/articleshow/132207972.cms,2026-07-06T19:50:55+00:00
ET Panache Worklife,https://economictimes.indiatimes.com/magazines/panache/worklife,worklife,51,Pakistani forces open fire on protest rally as massive anti-Islamabad uprising grips PoJK,https://economictimes.indiatimes.com/articleshow/132195732.cms,2026-07-06T19:50:55+00:00
ET Panache Worklife,https://economictimes.indiatimes.com/magazines/panache/worklife,worklife,52,QR code in red envelope leads to “invite-only” Instagram page: What we know so far,https://economictimes.indiatimes.com/articleshow/121338235.cms,2026-07-06T19:50:55+00:00
ET Panache Worklife,https://economictimes.indiatimes.com/magazines/panache/worklife,worklife,53,"if(typeof objAd !=""undefined""){ objAd.loadAds(); } Psychology says people who are scared of dogs aren't always animal haters, they may be responding to past experiences and fears",https://economictimes.indiatimes.com/articleshow/132195868.cms,2026-07-06T19:50:55+00:00
ET Panache Worklife,https://economictimes.indiatimes.com/magazines/panache/worklife,worklife,54,"if(typeof objAd !=""undefined""){ objAd.loadAds(); } Adani Defence to invest Rs 2,500 crore in missile manufacturing complex in Madhya Pradesh",https://economictimes.indiatimes.com/articleshow/132194310.cms,2026-07-06T19:50:55+00:00
ET Panache Worklife,https://economictimes.indiatimes.com/magazines/panache/worklife,worklife,55,"Ayodhya donation probe: Teacher, car mechanic, retired bank employee among 8 accused",https://economictimes.indiatimes.com/articleshow/132194548.cms,2026-07-06T19:50:55+00:00
ET Panache Worklife,https://economictimes.indiatimes.com/magazines/panache/worklife,worklife,56,"if(typeof objAd !=""undefined""){ objAd.loadAds(); } China's dominance in rare earth industry has key structural weakness as US, Japan hold core patents: Study",https://economictimes.indiatimes.com/articleshow/132197557.cms,2026-07-06T19:50:55+00:00
ET Panache Worklife,https://economictimes.indiatimes.com/magazines/panache/worklife,worklife,57,"Go to Horoscope Today, 7 July, 2026 Page",https://economictimes.indiatimes.com/articleshow/132221457.cms,2026-07-06T19:50:55+00:00
ET Panache Worklife,https://economictimes.indiatimes.com/magazines/panache/worklife,worklife,58,"Go to Horoscope Tomorrow, 7 July 2026 Page",https://economictimes.indiatimes.com/articleshow/132208661.cms,2026-07-06T19:50:55+00:00
ET Panache Worklife,https://economictimes.indiatimes.com/magazines/panache/worklife,worklife,59,Go to Mumbai rain Page,https://economictimes.indiatimes.com/articleshow/132189858.cms,2026-07-06T19:50:55+00:00
ET Panache Worklife,https://economictimes.indiatimes.com/magazines/panache/worklife,worklife,60,Go to EPFO Latest Update Page,https://economictimes.indiatimes.com/articleshow/132153209.cms,2026-07-06T19:50:55+00:00
ET Panache Worklife,https://economictimes.indiatimes.com/magazines/panache/worklife,worklife,61,Go to Happy Father’s Day Wishes 2026 Page,https://economictimes.indiatimes.com/articleshow/131885271.cms,2026-07-06T19:50:55+00:00
ET Panache Worklife,https://economictimes.indiatimes.com/magazines/panache/worklife,worklife,62,Go to DoorDash Down Page,https://economictimes.indiatimes.com/articleshow/131775980.cms,2026-07-06T19:50:55+00:00
ET Panache Worklife,https://economictimes.indiatimes.com/magazines/panache/worklife,worklife,63,Go to Crude Oil Price Today Page,https://economictimes.indiatimes.com/articleshow/131731293.cms,2026-07-06T19:50:55+00:00
ET Panache Worklife,https://economictimes.indiatimes.com/magazines/panache/worklife,worklife,64,Go to IAF AN-32 aircraft crashes Page,https://economictimes.indiatimes.com/articleshow/131698440.cms,2026-07-06T19:50:55+00:00
ET Panache Worklife,https://economictimes.indiatimes.com/magazines/panache/worklife,worklife,65,Go to Folarin Balogun Page,https://economictimes.indiatimes.com/articleshow/131696996.cms,2026-07-06T19:50:55+00:00
ET Panache Worklife,https://economictimes.indiatimes.com/magazines/panache/worklife,worklife,66,Go to is Facebook Instagram messenger Down Page,https://economictimes.indiatimes.com/articleshow/131687112.cms,2026-07-06T19:50:55+00:00
ET Panache Worklife,https://economictimes.indiatimes.com/magazines/panache/worklife,worklife,67,Go to Maggie Smith News Page,https://economictimes.indiatimes.com/articleshow/113743204.cms,2026-07-06T19:50:55+00:00
ET Panache Worklife,https://economictimes.indiatimes.com/magazines/panache/worklife,worklife,68,Go to Sunita Williams Space Station Routine Page,https://economictimes.indiatimes.com/articleshow/113340209.cms,2026-07-06T19:50:55+00:00
ET Panache Worklife,https://economictimes.indiatimes.com/magazines/panache/worklife,worklife,69,Go to Cristiano Ronaldo Youtube Channel Page,https://economictimes.indiatimes.com/articleshow/112701776.cms,2026-07-06T19:50:55+00:00
ET Panache Worklife,https://economictimes.indiatimes.com/magazines/panache/worklife,worklife,70,Go to Who is Miles Routledge Page,https://economictimes.indiatimes.com/articleshow/112706059.cms,2026-07-06T19:50:55+00:00
ET Panache Worklife,https://economictimes.indiatimes.com/magazines/panache/worklife,worklife,71,Go to Isha Ambani Lehenga Page,https://economictimes.indiatimes.com/articleshow/111678035.cms,2026-07-06T19:50:55+00:00
ET Panache Worklife,https://economictimes.indiatimes.com/magazines/panache/worklife,worklife,72,Govt plans LNG buffer mandate for terminals,https://economictimes.indiatimes.com/articleshow/132224888.cms,2026-07-06T19:50:55+00:00
ET Panache Worklife,https://economictimes.indiatimes.com/magazines/panache/worklife,worklife,73,Tamil Nadu spends too much; Bengal earns too little: A tale of two deficits,https://economictimes.indiatimes.com/articleshow/132224608.cms,2026-07-06T19:50:55+00:00
ET Panache Worklife,https://economictimes.indiatimes.com/magazines/panache/worklife,worklife,74,"When in India, play by Indian rules",https://economictimes.indiatimes.com/articleshow/132224873.cms,2026-07-06T19:50:55+00:00
ET Panache Worklife,https://economictimes.indiatimes.com/magazines/panache/worklife,worklife,75,"India, EU aim to complete FTA legal scrubbing in 15-20 days, says Piyush Goyal",https://economictimes.indiatimes.com/articleshow/132224978.cms,2026-07-06T19:50:55+00:00
ET Panache Worklife,https://economictimes.indiatimes.com/magazines/panache/worklife,worklife,76,"Direct cash transfers to women boost savings, spending: EAC-PM",https://economictimes.indiatimes.com/articleshow/132224959.cms,2026-07-06T19:50:55+00:00
ET Panache Worklife,https://economictimes.indiatimes.com/magazines/panache/worklife,worklife,77,"To ride the EV wave, M&M takes premium path, Tata Motors bets on scale",https://economictimes.indiatimes.com/articleshow/132225117.cms,2026-07-06T19:50:55+00:00
ET Panache Worklife,https://economictimes.indiatimes.com/magazines/panache/worklife,worklife,78,Pahalgam Attack: LeT-TRF Chief Saeed named in NIA charge sheet,https://economictimes.indiatimes.com/articleshow/132225035.cms,2026-07-06T19:50:55+00:00
ET Panache Worklife,https://economictimes.indiatimes.com/magazines/panache/worklife,worklife,79,"From Indonesia to Australia to New Zealand, PM Modi charts India's Indo-Pacific arc",https://economictimes.indiatimes.com/articleshow/132225114.cms,2026-07-06T19:50:55+00:00
ET Panache Worklife,https://economictimes.indiatimes.com/magazines/panache/worklife,worklife,80,Education Ministry in discussions to ease 1-km norm for EWS admissions,https://economictimes.indiatimes.com/articleshow/132225119.cms,2026-07-06T19:50:55+00:00
ET Panache Worklife,https://economictimes.indiatimes.com/magazines/panache/worklife,worklife,81,Push to enhance ease of doing business: Govt vendor payments to be cleared in 3 days,https://economictimes.indiatimes.com/articleshow/132225069.cms,2026-07-06T19:50:55+00:00
ET Panache Worklife,https://economictimes.indiatimes.com/magazines/panache/worklife,worklife,82,Ayodhya Ram Temple: Trust accepts resignations of key officials; set to appoint CEO,https://economictimes.indiatimes.com/articleshow/132224758.cms,2026-07-06T19:50:55+00:00
ET Panache Worklife,https://economictimes.indiatimes.com/magazines/panache/worklife,worklife,83,SC declines urgent hearing on PIL over Nazia Elahi Khan's Prophet remarks,https://economictimes.indiatimes.com/articleshow/132225089.cms,2026-07-06T19:50:55+00:00
ET Panache Worklife,https://economictimes.indiatimes.com/magazines/panache/worklife,worklife,84,Cooktops in high demand as West Asia war alters household habits,https://economictimes.indiatimes.com/articleshow/132225154.cms,2026-07-06T19:50:55+00:00
ET Panache Worklife,https://economictimes.indiatimes.com/magazines/panache/worklife,worklife,85,Pakistan deputy PM Ishaq Dar faces heat over grandson's arrest in rape case,https://economictimes.indiatimes.com/articleshow/132225159.cms,2026-07-06T19:50:55+00:00
ET Panache Worklife,https://economictimes.indiatimes.com/magazines/panache/worklife,worklife,86,"French Proverb of the Day: “You should never say… — Life lessons on regret, change, future, unpredictability and why life's greatest opportunities often come from unexpected places",https://economictimes.indiatimes.com/articleshow/132218718.cms,2026-07-06T19:50:55+00:00
ScienceDaily,https://www.sciencedaily.com/,science,1,Scientists Discover Why Exercise Reverses Muscle Aging,https://www.sciencedaily.com/releases/2026/06/260623014026.htm,2026-07-06T19:50:55+00:00
ScienceDaily,https://www.sciencedaily.com/,science,2,Scientists Solve a 30-year Rye Pollen Mystery That Could Transform Cancer Research,https://www.sciencedaily.com/releases/2026/06/260625014838.htm,2026-07-06T19:50:55+00:00
ScienceDaily,https://www.sciencedaily.com/,science,3,Engineers Solved an Airflow Mystery Hidden Nearly a Mile Underground,https://www.sciencedaily.com/releases/2026/06/260624025416.htm,2026-07-06T19:50:55+00:00
ScienceDaily,https://www.sciencedaily.com/,science,4,Scientists Want to Quarantine Alien Life on the Moon Before It Reaches Earth,https://www.sciencedaily.com/releases/2026/06/260623083144.htm,2026-07-06T19:50:55+00:00
ScienceDaily,https://www.sciencedaily.com/,science,5,Millions May Be Getting the Wrong Cholesterol Test,https://www.sciencedaily.com/releases/2026/06/260626125714.htm,2026-07-06T19:50:55+00:00
ScienceDaily,https://www.sciencedaily.com/,science,6,Streetlights Are Trapping Thousands of Pill Bugs in Giant “Death Spirals”,https://www.sciencedaily.com/releases/2026/06/260626125707.htm,2026-07-06T19:50:55+00:00
ScienceDaily,https://www.sciencedaily.com/,science,7,Astronomers Witness the Birth of a Magnetar for the First Time,https://www.sciencedaily.com/releases/2026/06/260626030450.htm,2026-07-06T19:50:55+00:00
ScienceDaily,https://www.sciencedaily.com/,science,8,Scientists Found 45 Chemicals in Pregnant Women and Many Were Linked to Birth Risks,https://www.sciencedaily.com/releases/2026/06/260622091431.htm,2026-07-06T19:50:55+00:00
ScienceDaily,https://www.sciencedaily.com/,science,9,Scientists Find the “Achilles’ Heel” of Deadly Gut Bacteria,https://www.sciencedaily.com/releases/2026/06/260619101345.htm,2026-07-06T19:50:55+00:00
ScienceDaily,https://www.sciencedaily.com/,science,10,Scientists May Have Finally Found How Alzheimer's Kills Brain Cells,https://www.sciencedaily.com/releases/2026/06/260626124701.htm,2026-07-06T19:50:55+00:00
ScienceDaily,https://www.sciencedaily.com/,science,11,"5,000-year-old Wolves Found on Remote Island Rewrite What We Know About Domestication",https://www.sciencedaily.com/releases/2026/06/260624115624.htm,2026-07-06T19:50:55+00:00
ScienceDaily,https://www.sciencedaily.com/,science,12,Record-breaking Ocean Drilling Reveals Why Japan's 2011 Tsunami Was so Deadly,https://www.sciencedaily.com/releases/2026/06/260625060220.htm,2026-07-06T19:50:55+00:00
ScienceDaily,https://www.sciencedaily.com/,science,13,"Scientists Discover the Deep Sleep Circuit That Builds Muscle, Burns Fat, and Boosts the Brain",https://www.sciencedaily.com/releases/2026/06/260626030433.htm,2026-07-06T19:50:55+00:00
ScienceDaily,https://www.sciencedaily.com/,science,14,Light Switch Wakes Sleeping Cancer Cells and Makes Them Vulnerable Again,https://www.sciencedaily.com/releases/2026/06/260619020503.htm,2026-07-06T19:50:55+00:00
ScienceDaily,https://www.sciencedaily.com/,science,15,Scientists Discover Why Some Brains Resist Alzheimer's,https://www.sciencedaily.com/releases/2026/06/260626125709.htm,2026-07-06T19:50:55+00:00
ScienceDaily,https://www.sciencedaily.com/,science,16,Old Muscle Stem Cells Can Act Young Again but There’s a Catch,https://www.sciencedaily.com/releases/2026/06/260622014315.htm,2026-07-06T19:50:55+00:00
ScienceDaily,https://www.sciencedaily.com/,science,17,Quantum Mechanics Once Baffled Scientists. Now It's Changing the World,https://www.sciencedaily.com/releases/2026/06/260624025516.htm,2026-07-06T19:50:55+00:00
ScienceDaily,https://www.sciencedaily.com/,science,18,Scientists Make Quantum Time Flow Backward in Stunning Physics Breakthrough,https://www.sciencedaily.com/releases/2026/06/260625014802.htm,2026-07-06T19:50:55+00:00
ScienceDaily,https://www.sciencedaily.com/,science,19,Simple Water Trick Slashes Diesel Engine Pollution by Over 60%,https://www.sciencedaily.com/releases/2026/06/260621052413.htm,2026-07-06T19:50:55+00:00
ScienceDaily,https://www.sciencedaily.com/,science,20,The Milky Way’s Weird Gamma-Ray Glow May Be Dark Matter After All,https://www.sciencedaily.com/releases/2026/06/260619101334.htm,2026-07-06T19:50:55+00:00
ScienceDaily,https://www.sciencedaily.com/,science,21,New Research Reveals the Hidden Pollution Left Behind by Fireworks,https://www.sciencedaily.com/releases/2026/07/260701205009.htm,2026-07-06T19:50:55+00:00
ScienceDaily,https://www.sciencedaily.com/,science,22,A Popular Climate Fix Could Accidentally Trigger Massive Changes to Global Weather,https://www.sciencedaily.com/releases/2026/06/260626030448.htm,2026-07-06T19:50:55+00:00
ScienceDaily,https://www.sciencedaily.com/,science,23,Climate Scientist Who “proved” Humanity Is Warming Earth Says Government Report Got It Wrong,https://www.sciencedaily.com/releases/2026/06/260625060214.htm,2026-07-06T19:50:55+00:00
ScienceDaily,https://www.sciencedaily.com/,science,24,These Tiny Soil Microbes Could Rescue Crops from Salty Farmland,https://www.sciencedaily.com/releases/2026/06/260626124703.htm,2026-07-06T19:50:55+00:00
ScienceDaily,https://www.sciencedaily.com/,science,25,This Spray-on Powder Can Stop Life-threatening Bleeding in 1 Second,https://www.sciencedaily.com/releases/2026/06/260625014835.htm,2026-07-06T19:50:55+00:00
ScienceDaily,https://www.sciencedaily.com/,science,26,A Surprising Brain Discovery Is Forcing Scientists to Rethink Movement Disorders,https://www.sciencedaily.com/releases/2026/06/260623014004.htm,2026-07-06T19:50:55+00:00
ScienceDaily,https://www.sciencedaily.com/,science,27,Scientists Discover a Surprising Link Between Vitamin C and Brain Health,https://www.sciencedaily.com/releases/2026/06/260626030428.htm,2026-07-06T19:50:55+00:00
ScienceDaily,https://www.sciencedaily.com/,science,28,Melanoma's Secret to Cheating Death Has Finally Been Revealed,https://www.sciencedaily.com/releases/2026/06/260625014833.htm,2026-07-06T19:50:55+00:00
ScienceDaily,https://www.sciencedaily.com/,science,29,Scientists Discover a Completely Different Way to Fight Viruses,https://www.sciencedaily.com/releases/2026/06/260630020534.htm,2026-07-06T19:50:55+00:00
ScienceDaily,https://www.sciencedaily.com/,science,30,One Injection Reversed Osteoarthritis in Weeks,https://www.sciencedaily.com/releases/2026/06/260619101356.htm,2026-07-06T19:50:55+00:00
ScienceDaily,https://www.sciencedaily.com/,science,31,Scientists May Have Finally Found How Alzheimer's Spreads Through the Brain,https://www.sciencedaily.com/releases/2026/06/260630020521.htm,2026-07-06T19:50:55+00:00
ScienceDaily,https://www.sciencedaily.com/,science,32,Scientists Say Creatine May Help Fight Depression,https://www.sciencedaily.com/releases/2026/06/260630020231.htm,2026-07-06T19:50:55+00:00
ScienceDaily,https://www.sciencedaily.com/,science,33,USC Scientists Just Unlocked an Endless Supply of Cancer-fighting Immune Cells,https://www.sciencedaily.com/releases/2026/06/260620100317.htm,2026-07-06T19:50:55+00:00
ScienceDaily,https://www.sciencedaily.com/,science,34,Millions Take Omega-3 Fish Oil for Brain Health but a New Study Found No Benefit,https://www.sciencedaily.com/releases/2026/06/260622014300.htm,2026-07-06T19:50:55+00:00
ScienceDaily,https://www.sciencedaily.com/,science,35,Common Pesticide Linked to More Than Double the Risk of Parkinson’s Disease,https://www.sciencedaily.com/releases/2026/06/260621111113.htm,2026-07-06T19:50:55+00:00
ScienceDaily,https://www.sciencedaily.com/,science,36,Scientists Discover What Triggers Belly Fat as We Age,https://www.sciencedaily.com/releases/2026/06/260624115133.htm,2026-07-06T19:50:55+00:00
ScienceDaily,https://www.sciencedaily.com/,science,37,The Secret to Healthy Aging May Be Hidden in Your Blood,https://www.sciencedaily.com/releases/2026/06/260625060212.htm,2026-07-06T19:50:55+00:00
ScienceDaily,https://www.sciencedaily.com/,science,38,A Hidden Weakness in Deadly Cancers Could Lead to Powerful New Treatments,https://www.sciencedaily.com/releases/2026/06/260626030430.htm,2026-07-06T19:50:55+00:00
ScienceDaily,https://www.sciencedaily.com/,science,39,Johns Hopkins Scientists Develop Nose Spray DNA Vaccine for Tuberculosis,https://www.sciencedaily.com/releases/2026/06/260619101400.htm,2026-07-06T19:50:55+00:00
ScienceDaily,https://www.sciencedaily.com/,science,40,Drinking to Cope With Stress May Permanently Rewire Your Brain,https://www.sciencedaily.com/releases/2026/06/260626030437.htm,2026-07-06T19:50:55+00:00
ScienceDaily,https://www.sciencedaily.com/,science,41,The Real Cause of a Common Stroke May Have Been Missed for Decades,https://www.sciencedaily.com/releases/2026/06/260622091521.htm,2026-07-06T19:50:55+00:00
ScienceDaily,https://www.sciencedaily.com/,science,42,These Fat-Filled Brain Cells May Be Making Multiple Sclerosis Worse,https://www.sciencedaily.com/releases/2026/06/260621060307.htm,2026-07-06T19:50:55+00:00
ScienceDaily,https://www.sciencedaily.com/,science,43,Massive Study Links Teen Marijuana Use to Double the Risk of Serious Mental Illness,https://www.sciencedaily.com/releases/2026/06/260622091515.htm,2026-07-06T19:50:55+00:00
ScienceDaily,https://www.sciencedaily.com/,science,44,New Vitamin B12 Therapy Shows Promise Against Deadly Brain Cancer,https://www.sciencedaily.com/releases/2026/06/260622091518.htm,2026-07-06T19:50:55+00:00
ScienceDaily,https://www.sciencedaily.com/,science,45,Scientists Discover a Protein Switch That Burns Fat and Blocks New Fat Cells,https://www.sciencedaily.com/releases/2026/06/260624115324.htm,2026-07-06T19:50:55+00:00
ScienceDaily,https://www.sciencedaily.com/,science,46,Only One Workout Helped Older Adults Lose Fat Without Losing Muscle,https://www.sciencedaily.com/releases/2026/06/260622014305.htm,2026-07-06T19:50:55+00:00
ScienceDaily,https://www.sciencedaily.com/,science,47,Butter and Margarine Look Similar but Their Chemistry Changes Everything,https://www.sciencedaily.com/releases/2026/06/260618041504.htm,2026-07-06T19:50:55+00:00
ScienceDaily,https://www.sciencedaily.com/,science,48,Researchers Discover Why Fructose Doesn't Satisfy Hunger Like Glucose,https://www.sciencedaily.com/releases/2026/06/260623083106.htm,2026-07-06T19:50:55+00:00
