source,source_url,category,rank,headline,link,collected_at_iso
ET Panache Worklife,https://economictimes.indiatimes.com/magazines/panache/worklife,worklife,39,FIFA World Cup 2026 top scorers: Who is leading the Golden Boot race?,https://economictimes.indiatimes.com/articleshow/132104535.cms,2026-07-01T03:29:40+00:00
ET Panache Worklife,https://economictimes.indiatimes.com/magazines/panache/worklife,worklife,40,Afghan air force strikes ISIS targets inside Pakistan; warns 'we'll target every threat',https://economictimes.indiatimes.com/articleshow/132104818.cms,2026-07-01T03:29:40+00:00
ET Panache Worklife,https://economictimes.indiatimes.com/magazines/panache/worklife,worklife,41,Asset servicing startup Dovetail Capital raises Rs 100 crore in funding from Elev8 Venture Partners,https://economictimes.indiatimes.com/articleshow/132104797.cms,2026-07-01T03:29:40+00:00
ET Panache Worklife,https://economictimes.indiatimes.com/magazines/panache/worklife,worklife,42,"if(typeof objAd !=""undefined""){ objAd.loadAds(); } Kerala Lottery Sthree Sakthi SS-526 result today (30-06-2026): Check Rs 1 crore prize winning number and full list here",https://economictimes.indiatimes.com/articleshow/132088434.cms,2026-07-01T03:29:40+00:00
ET Panache Worklife,https://economictimes.indiatimes.com/magazines/panache/worklife,worklife,43,Slumdogs no more: Can tycoons take the Mumbai Model to other cities?,https://economictimes.indiatimes.com/articleshow/132089928.cms,2026-07-01T03:29:40+00:00
ET Panache Worklife,https://economictimes.indiatimes.com/magazines/panache/worklife,worklife,44,Quote of the Day by Mother Teresa: ‘Some people come in our life as blessings; some come in your life as lessons’ - why not everyone is meant to stay in your life explained by Saint Teresa of Calcutta,https://economictimes.indiatimes.com/articleshow/132088903.cms,2026-07-01T03:29:40+00:00
ET Panache Worklife,https://economictimes.indiatimes.com/magazines/panache/worklife,worklife,45,"if(typeof objAd !=""undefined""){ objAd.loadAds(); } A pail of water may unleash India's ₹20 lakh crore opportunity",https://economictimes.indiatimes.com/articleshow/132086740.cms,2026-07-01T03:29:40+00:00
ET Panache Worklife,https://economictimes.indiatimes.com/magazines/panache/worklife,worklife,46,"if(typeof objAd !=""undefined""){ objAd.loadAds(); } How Ambani built Project Jupiter to launch India’s biggest IPO",https://economictimes.indiatimes.com/articleshow/132082679.cms,2026-07-01T03:29:40+00:00
ET Panache Worklife,https://economictimes.indiatimes.com/magazines/panache/worklife,worklife,47,"if(typeof objAd !=""undefined""){ objAd.loadAds(); } India's next stock market headache isn't oil but a bigger storm brewing in the skies",https://economictimes.indiatimes.com/articleshow/132083174.cms,2026-07-01T03:29:40+00:00
ET Panache Worklife,https://economictimes.indiatimes.com/magazines/panache/worklife,worklife,48,"As new Rajya Sabha MPs take oath, NDA edges closer to two-thirds mark",https://economictimes.indiatimes.com/articleshow/132083917.cms,2026-07-01T03:29:40+00:00
ET Panache Worklife,https://economictimes.indiatimes.com/magazines/panache/worklife,worklife,49,"if(typeof objAd !=""undefined""){ objAd.loadAds(); } Quote of the Day by Bruce Willis: “Who I am as a father is far more important to me than… – Inspiring lessons on parenting, fatherhood, sacrifice, perception, responsibility and why family matters more than public recognition by the American actor known for his deep insights into family values, resilience, and authentic living",https://economictimes.indiatimes.com/articleshow/132074881.cms,2026-07-01T03:29:40+00:00
ET Panache Worklife,https://economictimes.indiatimes.com/magazines/panache/worklife,worklife,50,"if(typeof objAd !=""undefined""){ objAd.loadAds(); } Gold rate today (June 30, 2026): Check 24k, 22k, 20k and 18k gold jewellery prices from IBJA, Joyalukkas, Malabar Gold & Diamonds and Tanishq in Delhi, Mumbai, Hyderabad, other cities",https://economictimes.indiatimes.com/articleshow/132087561.cms,2026-07-01T03:29:40+00:00
ET Panache Worklife,https://economictimes.indiatimes.com/magazines/panache/worklife,worklife,51,India plans to add strategic fuel reserves after Iran war shock,https://economictimes.indiatimes.com/articleshow/132087132.cms,2026-07-01T03:29:40+00:00
ET Panache Worklife,https://economictimes.indiatimes.com/magazines/panache/worklife,worklife,52,QR code in red envelope leads to “invite-only” Instagram page: What we know so far,https://economictimes.indiatimes.com/articleshow/121338235.cms,2026-07-01T03:29:40+00:00
ET Panache Worklife,https://economictimes.indiatimes.com/magazines/panache/worklife,worklife,53,"if(typeof objAd !=""undefined""){ objAd.loadAds(); } India's youngest self-made billionaire is looking for a room on D-Street",https://economictimes.indiatimes.com/articleshow/132087953.cms,2026-07-01T03:29:40+00:00
ET Panache Worklife,https://economictimes.indiatimes.com/magazines/panache/worklife,worklife,54,"if(typeof objAd !=""undefined""){ objAd.loadAds(); } India's much-delayed bullet train project picks up speed",https://economictimes.indiatimes.com/articleshow/132083170.cms,2026-07-01T03:29:40+00:00
ET Panache Worklife,https://economictimes.indiatimes.com/magazines/panache/worklife,worklife,55,'BJP looted Ram Mandir more than Ghaznavi': UBT Sena MP Sanjay Raut,https://economictimes.indiatimes.com/articleshow/132088893.cms,2026-07-01T03:29:40+00:00
ET Panache Worklife,https://economictimes.indiatimes.com/magazines/panache/worklife,worklife,56,"if(typeof objAd !=""undefined""){ objAd.loadAds(); } Greek proverb of the day: 'A fox is not caught twice in the...' - motivational saying teaches why past mistakes can become life’s greatest lessons",https://economictimes.indiatimes.com/articleshow/132077514.cms,2026-07-01T03:29:40+00:00
ET Panache Worklife,https://economictimes.indiatimes.com/magazines/panache/worklife,worklife,57,"Go to Horoscope Today, 1 July, 2026 Page",https://economictimes.indiatimes.com/articleshow/132095182.cms,2026-07-01T03:29:40+00:00
ET Panache Worklife,https://economictimes.indiatimes.com/magazines/panache/worklife,worklife,58,"Go to Horoscope Tomorrow, July 1, 2026 Page",https://economictimes.indiatimes.com/articleshow/132085665.cms,2026-07-01T03:29:40+00:00
ET Panache Worklife,https://economictimes.indiatimes.com/magazines/panache/worklife,worklife,59,"Go to Horoscope Today, 30 June, 2026 Page",https://economictimes.indiatimes.com/articleshow/132074407.cms,2026-07-01T03:29:40+00:00
ET Panache Worklife,https://economictimes.indiatimes.com/magazines/panache/worklife,worklife,60,Go to Happy Father’s Day Wishes 2026 Page,https://economictimes.indiatimes.com/articleshow/131885271.cms,2026-07-01T03:29:40+00:00
ET Panache Worklife,https://economictimes.indiatimes.com/magazines/panache/worklife,worklife,61,Go to DoorDash Down Page,https://economictimes.indiatimes.com/articleshow/131775980.cms,2026-07-01T03:29:40+00:00
ET Panache Worklife,https://economictimes.indiatimes.com/magazines/panache/worklife,worklife,62,Go to Crude Oil Price Today Page,https://economictimes.indiatimes.com/articleshow/131731293.cms,2026-07-01T03:29:40+00:00
ET Panache Worklife,https://economictimes.indiatimes.com/magazines/panache/worklife,worklife,63,Go to IAF AN-32 aircraft crashes Page,https://economictimes.indiatimes.com/articleshow/131698440.cms,2026-07-01T03:29:40+00:00
ET Panache Worklife,https://economictimes.indiatimes.com/magazines/panache/worklife,worklife,64,Go to Folarin Balogun Page,https://economictimes.indiatimes.com/articleshow/131696996.cms,2026-07-01T03:29:40+00:00
ET Panache Worklife,https://economictimes.indiatimes.com/magazines/panache/worklife,worklife,65,Go to is Facebook Instagram messenger Down Page,https://economictimes.indiatimes.com/articleshow/131687112.cms,2026-07-01T03:29:40+00:00
ET Panache Worklife,https://economictimes.indiatimes.com/magazines/panache/worklife,worklife,66,Go to Maggie Smith News Page,https://economictimes.indiatimes.com/articleshow/113743204.cms,2026-07-01T03:29:40+00:00
ET Panache Worklife,https://economictimes.indiatimes.com/magazines/panache/worklife,worklife,67,Go to Sunita Williams Space Station Routine Page,https://economictimes.indiatimes.com/articleshow/113340209.cms,2026-07-01T03:29:40+00:00
ET Panache Worklife,https://economictimes.indiatimes.com/magazines/panache/worklife,worklife,68,Go to Cristiano Ronaldo Youtube Channel Page,https://economictimes.indiatimes.com/articleshow/112701776.cms,2026-07-01T03:29:40+00:00
ET Panache Worklife,https://economictimes.indiatimes.com/magazines/panache/worklife,worklife,69,Go to Who is Miles Routledge Page,https://economictimes.indiatimes.com/articleshow/112706059.cms,2026-07-01T03:29:40+00:00
ET Panache Worklife,https://economictimes.indiatimes.com/magazines/panache/worklife,worklife,70,Go to Isha Ambani Lehenga Page,https://economictimes.indiatimes.com/articleshow/111678035.cms,2026-07-01T03:29:40+00:00
ET Panache Worklife,https://economictimes.indiatimes.com/magazines/panache/worklife,worklife,71,"At 46, Ankur Warikoo reached 13% body fat. Here are the habits he swears by",https://economictimes.indiatimes.com/articleshow/132104665.cms,2026-07-01T03:29:40+00:00
ET Panache Worklife,https://economictimes.indiatimes.com/magazines/panache/worklife,worklife,72,South Korean trade watchdog alleges Google abused its position in Android app store,https://economictimes.indiatimes.com/articleshow/132104849.cms,2026-07-01T03:29:40+00:00
ET Panache Worklife,https://economictimes.indiatimes.com/magazines/panache/worklife,worklife,73,Kotak Mahindra Bank shares in focus on deal to buy Deutsche Bank’s retail business for Rs 282 crore,https://economictimes.indiatimes.com/articleshow/132104836.cms,2026-07-01T03:29:40+00:00
ET Panache Worklife,https://economictimes.indiatimes.com/magazines/panache/worklife,worklife,74,"KPIT Tech shares in focus as company expects Q1 revenue decline, sharp hit to margins. Crash ahead?",https://economictimes.indiatimes.com/articleshow/132105006.cms,2026-07-01T03:29:40+00:00
ET Panache Worklife,https://economictimes.indiatimes.com/magazines/panache/worklife,worklife,75,Trump reports over $1.4 billion in income from crypto ventures,https://economictimes.indiatimes.com/articleshow/132105018.cms,2026-07-01T03:29:40+00:00
ET Panache Worklife,https://economictimes.indiatimes.com/magazines/panache/worklife,worklife,76,"Japanese bond yields rise on yen weakness, fiscal worries",https://economictimes.indiatimes.com/articleshow/132105061.cms,2026-07-01T03:29:40+00:00
ET Panache Worklife,https://economictimes.indiatimes.com/magazines/panache/worklife,worklife,77,VB-G RAM G Act to come into force on July 1; revised wage rates notified,https://economictimes.indiatimes.com/articleshow/132105064.cms,2026-07-01T03:29:40+00:00
ET Panache Worklife,https://economictimes.indiatimes.com/magazines/panache/worklife,worklife,78,FIFA World Cup 2026: Haaland's late strike lifts Norway past Ivory Coast into WC Round of 16,https://economictimes.indiatimes.com/articleshow/132105075.cms,2026-07-01T03:29:40+00:00
ScienceDaily,https://www.sciencedaily.com/,science,1,The Milky Way’s Weird Gamma-ray Glow May Be Dark Matter After All,https://www.sciencedaily.com/releases/2026/06/260619101334.htm,2026-07-01T03:29:40+00:00
ScienceDaily,https://www.sciencedaily.com/,science,2,Melanoma's Secret to Cheating Death Has Finally Been Revealed,https://www.sciencedaily.com/releases/2026/06/260625014833.htm,2026-07-01T03:29:40+00:00
ScienceDaily,https://www.sciencedaily.com/,science,3,Teeth Smaller Than a Fingertip Reveal Our First Primate Ancestor,https://www.sciencedaily.com/releases/2026/06/260621031238.htm,2026-07-01T03:29:40+00:00
ScienceDaily,https://www.sciencedaily.com/,science,4,Scientists Discover a Completely Different Way to Fight Viruses,https://www.sciencedaily.com/releases/2026/06/260630020534.htm,2026-07-01T03:29:40+00:00
ScienceDaily,https://www.sciencedaily.com/,science,5,One Injection Reversed Osteoarthritis in Weeks,https://www.sciencedaily.com/releases/2026/06/260619101356.htm,2026-07-01T03:29:40+00:00
ScienceDaily,https://www.sciencedaily.com/,science,6,Scientists May Have Finally Found How Alzheimer's Spreads Through the Brain,https://www.sciencedaily.com/releases/2026/06/260630020521.htm,2026-07-01T03:29:40+00:00
ScienceDaily,https://www.sciencedaily.com/,science,7,Scientists Say Creatine May Help Fight Depression,https://www.sciencedaily.com/releases/2026/06/260630020231.htm,2026-07-01T03:29:40+00:00
ScienceDaily,https://www.sciencedaily.com/,science,8,Researchers Discover New Beetle Species Hiding Just Steps from Their Lab,https://www.sciencedaily.com/releases/2026/06/260619020519.htm,2026-07-01T03:29:40+00:00
ScienceDaily,https://www.sciencedaily.com/,science,9,A Massive Asteroid Slammed Into the North Sea and Triggered a 330-foot Tsunami,https://www.sciencedaily.com/releases/2026/06/260623011230.htm,2026-07-01T03:29:40+00:00
ScienceDaily,https://www.sciencedaily.com/,science,10,Why Scientists Fear We're Missing Evidence of Extraterrestrial Life,https://www.sciencedaily.com/releases/2026/06/260623083121.htm,2026-07-01T03:29:40+00:00
ScienceDaily,https://www.sciencedaily.com/,science,11,Millions of Exploding Stars Could Soon Reveal Dark Energy's Secrets,https://www.sciencedaily.com/releases/2026/06/260621060315.htm,2026-07-01T03:29:40+00:00
ScienceDaily,https://www.sciencedaily.com/,science,12,USC Scientists Just Unlocked an Endless Supply of Cancer-fighting Immune Cells,https://www.sciencedaily.com/releases/2026/06/260620100317.htm,2026-07-01T03:29:40+00:00
ScienceDaily,https://www.sciencedaily.com/,science,13,Millions Take Omega-3 Fish Oil for Brain Health but a New Study Found No Benefit,https://www.sciencedaily.com/releases/2026/06/260622014300.htm,2026-07-01T03:29:40+00:00
ScienceDaily,https://www.sciencedaily.com/,science,14,Common Pesticide Linked to More Than Double the Risk of Parkinson’s Disease,https://www.sciencedaily.com/releases/2026/06/260621111113.htm,2026-07-01T03:29:40+00:00
ScienceDaily,https://www.sciencedaily.com/,science,15,Scientists Discover What Triggers Belly Fat as We Age,https://www.sciencedaily.com/releases/2026/06/260624115133.htm,2026-07-01T03:29:40+00:00
ScienceDaily,https://www.sciencedaily.com/,science,16,Butter and Margarine Look Similar but Their Chemistry Changes Everything,https://www.sciencedaily.com/releases/2026/06/260618041504.htm,2026-07-01T03:29:40+00:00
ScienceDaily,https://www.sciencedaily.com/,science,17,A Rare Interstellar Visitor Triggered a SETI Search for Alien Technology,https://www.sciencedaily.com/releases/2026/06/260621060309.htm,2026-07-01T03:29:40+00:00
ScienceDaily,https://www.sciencedaily.com/,science,18,A Tiny Diamond Defect Could Reveal a Mysterious New Kind of Magnetism,https://www.sciencedaily.com/releases/2026/06/260621060304.htm,2026-07-01T03:29:40+00:00
ScienceDaily,https://www.sciencedaily.com/,science,19,NASA’s Cold Atom Lab Is Creating One of the Weirdest Forms of Matter in Space,https://www.sciencedaily.com/releases/2026/06/260622091507.htm,2026-07-01T03:29:40+00:00
ScienceDaily,https://www.sciencedaily.com/,science,20,Researchers Found a Wordle Strategy That Wins 99% of the Time,https://www.sciencedaily.com/releases/2026/06/260619020508.htm,2026-07-01T03:29:40+00:00
ScienceDaily,https://www.sciencedaily.com/,science,21,These Tiny Soil Microbes Could Rescue Crops from Salty Farmland,https://www.sciencedaily.com/releases/2026/06/260626124703.htm,2026-07-01T03:29:40+00:00
ScienceDaily,https://www.sciencedaily.com/,science,22,Hawaii Is Turning Ocean Plastic and Fishing Nets Into Roads,https://www.sciencedaily.com/releases/2026/06/260625014830.htm,2026-07-01T03:29:40+00:00
ScienceDaily,https://www.sciencedaily.com/,science,23,"From Pet to Pest, Goldfish Can Wreck Entire Ecosystems",https://www.sciencedaily.com/releases/2026/06/260622091524.htm,2026-07-01T03:29:40+00:00
ScienceDaily,https://www.sciencedaily.com/,science,24,A “ghost” Great White Shark Just Reignited a 160-Year Mediterranean Mystery,https://www.sciencedaily.com/releases/2026/06/260621052722.htm,2026-07-01T03:29:40+00:00
ScienceDaily,https://www.sciencedaily.com/,science,25,Researchers Discover Why Fructose Doesn't Satisfy Hunger Like Glucose,https://www.sciencedaily.com/releases/2026/06/260623083106.htm,2026-07-01T03:29:40+00:00
ScienceDaily,https://www.sciencedaily.com/,science,26,This Common Vitamin Deficiency Can Mimic Normal Aging,https://www.sciencedaily.com/releases/2026/06/260623083116.htm,2026-07-01T03:29:40+00:00
ScienceDaily,https://www.sciencedaily.com/,science,27,FDA-approved Drug May Finally Help Immunotherapy Defeat Rare Liver Cancer,https://www.sciencedaily.com/releases/2026/06/260623014014.htm,2026-07-01T03:29:40+00:00
ScienceDaily,https://www.sciencedaily.com/,science,28,Scientists Discover Ancient Brain Cells That Help Block Distractions,https://www.sciencedaily.com/releases/2026/06/260624025426.htm,2026-07-01T03:29:40+00:00
ScienceDaily,https://www.sciencedaily.com/,science,29,Scientists Discover Hidden “Footprints of Death” That May Help Viruses Spread,https://www.sciencedaily.com/releases/2026/06/260623014028.htm,2026-07-01T03:29:40+00:00
ScienceDaily,https://www.sciencedaily.com/,science,30,Scientists Finally Solved How H5N1 Bird Flu Hid in Dairy Cows,https://www.sciencedaily.com/releases/2026/06/260620100315.htm,2026-07-01T03:29:40+00:00
ScienceDaily,https://www.sciencedaily.com/,science,31,New Brain Study Reveals Speech Learning Works Differently Than We Thought,https://www.sciencedaily.com/releases/2026/06/260619020514.htm,2026-07-01T03:29:40+00:00
ScienceDaily,https://www.sciencedaily.com/,science,32,One of the World’s Most Popular Weedkillers May Be Fueling Deadly Superbugs,https://www.sciencedaily.com/releases/2026/06/260620100434.htm,2026-07-01T03:29:40+00:00
ScienceDaily,https://www.sciencedaily.com/,science,33,Butterfly That Barely Ages Could Help Unlock Longevity Secrets,https://www.sciencedaily.com/releases/2026/06/260622014302.htm,2026-07-01T03:29:40+00:00
ScienceDaily,https://www.sciencedaily.com/,science,34,Scientists Discover Neurons Must Break Their DNA to Build the Brain,https://www.sciencedaily.com/releases/2026/06/260620100422.htm,2026-07-01T03:29:40+00:00
ScienceDaily,https://www.sciencedaily.com/,science,35,This DNA Repair Gene Went Rogue and Exposed a Cancer Weakness,https://www.sciencedaily.com/releases/2026/06/260619101349.htm,2026-07-01T03:29:40+00:00
ScienceDaily,https://www.sciencedaily.com/,science,36,Scientists Reprogram Brain Immune Cells to Fight Alzheimer’s,https://www.sciencedaily.com/releases/2026/06/260619020506.htm,2026-07-01T03:29:40+00:00
ScienceDaily,https://www.sciencedaily.com/,science,37,Scientists Discover an Unexpected Way to Make Pancreatic Cancer Cells Self-Destruct,https://www.sciencedaily.com/releases/2026/06/260622091512.htm,2026-07-01T03:29:40+00:00
ScienceDaily,https://www.sciencedaily.com/,science,38,These Fat-Filled Brain Cells May Be Making Multiple Sclerosis Worse,https://www.sciencedaily.com/releases/2026/06/260621060307.htm,2026-07-01T03:29:40+00:00
ScienceDaily,https://www.sciencedaily.com/,science,39,Only One Workout Helped Older Adults Lose Fat Without Losing Muscle,https://www.sciencedaily.com/releases/2026/06/260622014305.htm,2026-07-01T03:29:40+00:00
ScienceDaily,https://www.sciencedaily.com/,science,40,Massive Study Links Teen Marijuana Use to Double the Risk of Serious Mental Illness,https://www.sciencedaily.com/releases/2026/06/260622091515.htm,2026-07-01T03:29:40+00:00
ScienceDaily,https://www.sciencedaily.com/,science,41,New Vitamin B12 Therapy Shows Promise Against Deadly Brain Cancer,https://www.sciencedaily.com/releases/2026/06/260622091518.htm,2026-07-01T03:29:40+00:00
ScienceDaily,https://www.sciencedaily.com/,science,42,They Knew the Pill Was Fake but Their Memory Still Improved,https://www.sciencedaily.com/releases/2026/06/260625060159.htm,2026-07-01T03:29:40+00:00
ScienceDaily,https://www.sciencedaily.com/,science,43,A Common Vitamin Could Help Fight One of the Deadliest Brain Cancers,https://www.sciencedaily.com/releases/2026/06/260622014313.htm,2026-07-01T03:29:40+00:00
ScienceDaily,https://www.sciencedaily.com/,science,44,Tubulin Prevents Toxic Brain Protein Clumps Linked to Alzheimer’s and Parkinson’s,https://www.sciencedaily.com/releases/2026/06/260620100432.htm,2026-07-01T03:29:40+00:00
ScienceDaily,https://www.sciencedaily.com/,science,45,Osteopenia Is Silently Weakening Bones in Millions of People,https://www.sciencedaily.com/releases/2026/06/260624025511.htm,2026-07-01T03:29:40+00:00
ScienceDaily,https://www.sciencedaily.com/,science,46,This Emerging Treatment Is Helping People Avoid Knee Replacement Surgery,https://www.sciencedaily.com/releases/2026/06/260622091502.htm,2026-07-01T03:29:40+00:00
ScienceDaily,https://www.sciencedaily.com/,science,47,Scientists Say Most People Need More Protein Than Current Guidelines Suggest,https://www.sciencedaily.com/releases/2026/06/260622091429.htm,2026-07-01T03:29:40+00:00
ScienceDaily,https://www.sciencedaily.com/,science,48,One Common Fat May Fuel Type 2 Diabetes While Another Helps Fight It,https://www.sciencedaily.com/releases/2026/06/260621060318.htm,2026-07-01T03:29:40+00:00
ScienceDaily,https://www.sciencedaily.com/,science,49,Alien Messages May Have Reached Earth Without Us Realizing It,https://www.sciencedaily.com/releases/2026/06/260615033851.htm,2026-07-01T03:29:40+00:00
ScienceDaily,https://www.sciencedaily.com/,science,50,This Strange Material Can Become Strong or Fall Apart in Seconds,https://www.sciencedaily.com/releases/2026/06/260615033849.htm,2026-07-01T03:29:40+00:00
ScienceDaily,https://www.sciencedaily.com/,science,51,Oxford Physicists Just Made Schrödinger’s Cat Even Stranger,https://www.sciencedaily.com/releases/2026/06/260614011848.htm,2026-07-01T03:29:40+00:00
ScienceDaily,https://www.sciencedaily.com/,science,52,These Tiny Holes Could Change How the World Cleans Water,https://www.sciencedaily.com/releases/2026/06/260612032049.htm,2026-07-01T03:29:40+00:00
ScienceDaily,https://www.sciencedaily.com/,science,53,Giant Underground Neutrino Detector Brings Scientists Closer to Cracking the Neutrino Puzzle,https://www.sciencedaily.com/releases/2026/06/260612032026.htm,2026-07-01T03:29:40+00:00
ScienceDaily,https://www.sciencedaily.com/,science,54,Scientists Built a Battery-free Device That Turns Sunlight Into Fuel,https://www.sciencedaily.com/releases/2026/06/260611024601.htm,2026-07-01T03:29:40+00:00
ScienceDaily,https://www.sciencedaily.com/,science,55,Scientists Discover a Strange Property in Rice and Turn It Into a Smart Material,https://www.sciencedaily.com/releases/2026/06/260611024621.htm,2026-07-01T03:29:40+00:00
ScienceDaily,https://www.sciencedaily.com/,science,56,AI Could Uncover New Physics Faster but There’s a Surprising Catch,https://www.sciencedaily.com/releases/2026/06/260611024557.htm,2026-07-01T03:29:40+00:00
ScienceDaily,https://www.sciencedaily.com/,science,57,Tiny X-ray Telescope Could Unlock the Moon's Hidden Chemistry,https://www.sciencedaily.com/releases/2026/06/260606075508.htm,2026-07-01T03:29:40+00:00
ScienceDaily,https://www.sciencedaily.com/,science,58,Scientists Found a Surprisingly Simple Way to Create Powerful Quantum States,https://www.sciencedaily.com/releases/2026/06/260606075510.htm,2026-07-01T03:29:40+00:00
ScienceDaily,https://www.sciencedaily.com/,science,59,AI-designed Universal Coronavirus Vaccine Passes First Human Trial,https://www.sciencedaily.com/releases/2026/06/260605023357.htm,2026-07-01T03:29:40+00:00
ScienceDaily,https://www.sciencedaily.com/,science,60,Hidden Supermassive Black Hole Pairs May Finally Have a Visible Signal,https://www.sciencedaily.com/releases/2026/06/260605023418.htm,2026-07-01T03:29:40+00:00
ScienceDaily,https://www.sciencedaily.com/,science,61,New Solid-State Material Converts Sunlight Into Higher-Energy UV Light,https://www.sciencedaily.com/releases/2026/06/260623083058.htm,2026-07-01T03:29:40+00:00
ScienceDaily,https://www.sciencedaily.com/,science,62,"New Superconducting X-Ray Detector Is Up to 1,000 Times More Sensitive",https://www.sciencedaily.com/releases/2026/06/260623083108.htm,2026-07-01T03:29:40+00:00
ScienceDaily,https://www.sciencedaily.com/,science,63,Chinese Sodium Battery Surprised Scientists by Matching Key Tesla Benchmarks,https://www.sciencedaily.com/releases/2026/06/260621060305.htm,2026-07-01T03:29:40+00:00
ScienceDaily,https://www.sciencedaily.com/,science,64,This Simple Twist Could Bring Quantum Computers Closer to Reality,https://www.sciencedaily.com/releases/2026/06/260620100312.htm,2026-07-01T03:29:40+00:00
ScienceDaily,https://www.sciencedaily.com/,science,65,SpaceX Wants to Build AI Data Centers in Space. Will It Work?,https://www.sciencedaily.com/releases/2026/06/260618041501.htm,2026-07-01T03:29:40+00:00
ScienceDaily,https://www.sciencedaily.com/,science,66,MIT’s New Spacecraft Engine Could Send Tiny Satellites to Mars,https://www.sciencedaily.com/releases/2026/06/260610003051.htm,2026-07-01T03:29:40+00:00
ScienceDaily,https://www.sciencedaily.com/,science,67,NASA Updates Worsening ISS Leak After Crew Safety Alert,https://www.sciencedaily.com/releases/2026/06/260608040006.htm,2026-07-01T03:29:40+00:00
ScienceDaily,https://www.sciencedaily.com/,science,68,NASA Just Proved Spacecraft Can Switch Between Multiple Satellite Networks,https://www.sciencedaily.com/releases/2026/06/260605023405.htm,2026-07-01T03:29:40+00:00
ScienceDaily,https://www.sciencedaily.com/,science,69,Superconductivity Breakthrough Could Unlock Ultra-Efficient Electronics,https://www.sciencedaily.com/releases/2026/06/260617032211.htm,2026-07-01T03:29:40+00:00
