source,source_url,category,rank,headline,link,collected_at_iso
ScienceDaily Society,https://www.sciencedaily.com/news/top/society/,science,23,Scientists Say Dante’s Inferno Described an Asteroid Impact 500 Years Before Modern Science,https://www.sciencedaily.com/releases/2026/05/260510234658.htm,2026-06-13T03:24:09+00:00
ScienceDaily Society,https://www.sciencedaily.com/news/top/society/,science,24,"Ice Age Humans in China Crafted Surprisingly Advanced Stone Tools 146,000 Years Ago",https://www.sciencedaily.com/releases/2026/05/260508003113.htm,2026-06-13T03:24:09+00:00
ScienceDaily Society,https://www.sciencedaily.com/news/top/society/,science,25,Ancient Chemistry Trick Unlocks New Type of Glass That Traps CO2 and Hydrogen,https://www.sciencedaily.com/releases/2026/05/260521072404.htm,2026-06-13T03:24:09+00:00
ScienceDaily Society,https://www.sciencedaily.com/news/top/society/,science,26,The Dark Side of Weight Loss Drugs: Ozempic's Surprising Hidden Cost,https://www.sciencedaily.com/releases/2026/05/260504154016.htm,2026-06-13T03:24:09+00:00
ScienceDaily Society,https://www.sciencedaily.com/news/top/society/,science,27,"Lost 1,200-Year-Old Manuscript Contains the First English Poem",https://www.sciencedaily.com/releases/2026/05/260515233337.htm,2026-06-13T03:24:09+00:00
ScienceDaily Society,https://www.sciencedaily.com/news/top/society/,science,28,Scientists Think They Finally Know Why Neanderthals Vanished,https://www.sciencedaily.com/releases/2026/04/260427050609.htm,2026-06-13T03:24:09+00:00
ScienceDaily Society,https://www.sciencedaily.com/news/top/society/,science,29,NASA Just Took a Huge Step Toward the Moon After Artemis II Success,https://www.sciencedaily.com/releases/2026/05/260504023837.htm,2026-06-13T03:24:09+00:00
ScienceDaily Society,https://www.sciencedaily.com/news/top/society/,science,30,Ancient DNA Reveals a Lost Population Near Paris Replaced by Strangers,https://www.sciencedaily.com/releases/2026/04/260421042800.htm,2026-06-13T03:24:09+00:00
ScienceDaily Society,https://www.sciencedaily.com/news/top/society/,science,31,Scientists Sculpt Einstein Onto a Crystal Using Only Light,https://www.sciencedaily.com/releases/2026/04/260421042755.htm,2026-06-13T03:24:09+00:00
ScienceDaily Society,https://www.sciencedaily.com/news/top/society/,science,32,MIT Scientists Just Found a Hidden Problem Slowing the Ozone Comeback,https://www.sciencedaily.com/releases/2026/04/260416071945.htm,2026-06-13T03:24:09+00:00
ScienceDaily Society,https://www.sciencedaily.com/news/top/society/,science,33,Deadly “red Sky” Solar Storm from 800 Years Ago Discovered in Ancient Trees,https://www.sciencedaily.com/releases/2026/05/260513221818.htm,2026-06-13T03:24:09+00:00
ScienceDaily Society,https://www.sciencedaily.com/news/top/society/,science,34,People Once Risked Everything Just to Keep Their Hats on,https://www.sciencedaily.com/releases/2026/05/260506225231.htm,2026-06-13T03:24:09+00:00
ScienceDaily Society,https://www.sciencedaily.com/news/top/society/,science,35,The World Is Getting Brighter at Night but Some Places Are Going Dark,https://www.sciencedaily.com/releases/2026/04/260409101057.htm,2026-06-13T03:24:09+00:00
ScienceDaily Society,https://www.sciencedaily.com/news/top/society/,science,36,"Ancient Bone Dice Reveal 12,000-Year History of Gambling in America",https://www.sciencedaily.com/releases/2026/04/260402042731.htm,2026-06-13T03:24:09+00:00
ScienceDaily Society,https://www.sciencedaily.com/news/top/society/,science,37,Scientists Shocked to Find Lab Gloves May Be Skewing Microplastics Data,https://www.sciencedaily.com/releases/2026/03/260329222938.htm,2026-06-13T03:24:09+00:00
ScienceDaily Society,https://www.sciencedaily.com/news/top/society/,science,38,Ancient DNA Reveals a Farming Shift That Pushed a Society to the Brink,https://www.sciencedaily.com/releases/2026/03/260321012642.htm,2026-06-13T03:24:09+00:00
ScienceDaily Society,https://www.sciencedaily.com/news/top/society/,science,39,Tiny Clump of Moss Helped Solve a Shocking Cemetery Crime,https://www.sciencedaily.com/releases/2026/03/260305223215.htm,2026-06-13T03:24:09+00:00
ScienceDaily Society,https://www.sciencedaily.com/news/top/society/,science,40,"Rare Graves Reveal a Lost World of Bronze Age Europe Hidden for 3,000 Years",https://www.sciencedaily.com/releases/2026/05/260518041445.htm,2026-06-13T03:24:09+00:00
ScienceDaily Society,https://www.sciencedaily.com/news/top/society/,science,41,The Hidden Technology That Could Unlock Commercial Fusion Power,https://www.sciencedaily.com/releases/2026/03/260303050622.htm,2026-06-13T03:24:09+00:00
ScienceDaily Society,https://www.sciencedaily.com/news/top/society/,science,42,Teens Sleep Longer and Perform Better When School Starts Later,https://www.sciencedaily.com/releases/2026/03/260311004725.htm,2026-06-13T03:24:09+00:00
ScienceDaily Society,https://www.sciencedaily.com/news/top/society/,science,43,Scientists Built the Hardest AI Test Ever and the Results Are Surprising,https://www.sciencedaily.com/releases/2026/03/260313002650.htm,2026-06-13T03:24:09+00:00
ScienceDaily Society,https://www.sciencedaily.com/news/top/society/,science,44,Ancient Farmers Accidentally Created Aggressive “warrior” Wheat,https://www.sciencedaily.com/releases/2026/04/260407193923.htm,2026-06-13T03:24:09+00:00
ScienceDaily Society,https://www.sciencedaily.com/news/top/society/,science,45,Archaeologists Uncover Brutal Iron Age Massacre of Women and Children,https://www.sciencedaily.com/releases/2026/03/260308201616.htm,2026-06-13T03:24:09+00:00
ScienceDaily Society,https://www.sciencedaily.com/news/top/society/,science,46,"40,000-Year-Old Signs Show Humans Were Recording Information Long Before Writing",https://www.sciencedaily.com/releases/2026/02/260225001301.htm,2026-06-13T03:24:09+00:00
ScienceDaily Society,https://www.sciencedaily.com/news/top/society/,science,47,Mysterious Greek Inscription May Reveal Lost Temple Beneath Syria’s Great Mosque,https://www.sciencedaily.com/releases/2026/04/260401071947.htm,2026-06-13T03:24:09+00:00
ScienceDaily Society,https://www.sciencedaily.com/news/top/society/,science,48,"Ancient DNA Solves 5,500 Year Old Burial Mystery in Sweden",https://www.sciencedaily.com/releases/2026/02/260218031559.htm,2026-06-13T03:24:09+00:00
ScienceDaily Society,https://www.sciencedaily.com/news/top/society/,science,49,Scientists Say We’ve Been Wrong About What Makes Sprinters Fast,https://www.sciencedaily.com/releases/2026/04/260407193911.htm,2026-06-13T03:24:09+00:00
ScienceDaily Society,https://www.sciencedaily.com/news/top/society/,science,50,"Couples Who Savor Happy Moments Together Have Stronger, Longer-Lasting Relationships",https://www.sciencedaily.com/releases/2026/02/260213223908.htm,2026-06-13T03:24:09+00:00
ScienceDaily Society,https://www.sciencedaily.com/news/top/society/,science,51,"Britain’s 11,000-Year-Old “oldest Northerner” Was a 3-Year-Old Girl, DNA Reveals",https://www.sciencedaily.com/releases/2026/05/260519224326.htm,2026-06-13T03:24:09+00:00
ScienceDaily Society,https://www.sciencedaily.com/news/top/society/,science,52,Monty Python Got It Wrong About Medieval Disease,https://www.sciencedaily.com/releases/2026/03/260313002645.htm,2026-06-13T03:24:09+00:00
ScienceDaily Society,https://www.sciencedaily.com/news/top/society/,science,53,Bird Droppings Helped Build One of Ancient Peru’s Most Powerful Kingdoms,https://www.sciencedaily.com/releases/2026/03/260306224219.htm,2026-06-13T03:24:09+00:00
ScienceDaily Society,https://www.sciencedaily.com/news/top/society/,science,54,Large Study Finds No Link Between mRNA COVID Vaccine in Pregnancy and Autism,https://www.sciencedaily.com/releases/2026/02/260215085001.htm,2026-06-13T03:24:09+00:00
ScienceDaily Society,https://www.sciencedaily.com/news/top/society/,science,55,Truckloads of Food Are Being Wasted Because Computers Won’t Approve Them,https://www.sciencedaily.com/releases/2026/04/260403224505.htm,2026-06-13T03:24:09+00:00
ScienceDaily Society,https://www.sciencedaily.com/news/top/society/,science,56,Scientists Used Brain Stimulation to Make People More Generous,https://www.sciencedaily.com/releases/2026/02/260213020407.htm,2026-06-13T03:24:09+00:00
ScienceDaily Society,https://www.sciencedaily.com/news/top/society/,science,57,Giving People Cash Didn’t Cause More Injuries or Deaths,https://www.sciencedaily.com/releases/2026/02/260212023028.htm,2026-06-13T03:24:09+00:00
ScienceDaily Society,https://www.sciencedaily.com/news/top/society/,science,58,Why Some Kids Struggle With Math Even When They Try Hard,https://www.sciencedaily.com/releases/2026/02/260213020416.htm,2026-06-13T03:24:09+00:00
ScienceDaily Society,https://www.sciencedaily.com/news/top/society/,science,59,Italy’s Winter Olympics Are Stunning from Space,https://www.sciencedaily.com/releases/2026/02/260209211229.htm,2026-06-13T03:24:09+00:00
ScienceDaily Society,https://www.sciencedaily.com/news/top/society/,science,60,This Weird Deep-Sea Creature Was Named by Thousands of People Online,https://www.sciencedaily.com/releases/2026/02/260207232242.htm,2026-06-13T03:24:09+00:00
ScienceDaily Society,https://www.sciencedaily.com/news/top/society/,science,61,The Surprising Reason You’re So Productive One Day and Not the Next,https://www.sciencedaily.com/releases/2026/04/260415043626.htm,2026-06-13T03:24:09+00:00
ScienceDaily Society,https://www.sciencedaily.com/news/top/society/,science,62,An Invisible Chemical Rain Is Falling Across the Planet,https://www.sciencedaily.com/releases/2026/02/260206020847.htm,2026-06-13T03:24:09+00:00
ScienceDaily Society,https://www.sciencedaily.com/news/top/society/,science,63,A Century of Hair Shows How Lead Exposure Collapsed,https://www.sciencedaily.com/releases/2026/02/260207092902.htm,2026-06-13T03:24:09+00:00
ScienceDaily Society,https://www.sciencedaily.com/news/top/society/,science,64,AI Swarms Could Hijack Democracy Without Anyone Noticing,https://www.sciencedaily.com/releases/2026/04/260420014748.htm,2026-06-13T03:24:09+00:00
ScienceDaily Society,https://www.sciencedaily.com/news/top/society/,science,65,"Ancient DNA Solves 12,000-Year-Old Mystery of Rare Genetic Growth Disorder",https://www.sciencedaily.com/releases/2026/02/260217005754.htm,2026-06-13T03:24:09+00:00
ScienceDaily Society,https://www.sciencedaily.com/news/top/society/,science,66,Ancient Tools in China Are Forcing Scientists to Rethink Early Humans,https://www.sciencedaily.com/releases/2026/01/260131082428.htm,2026-06-13T03:24:09+00:00
ScienceDaily Society,https://www.sciencedaily.com/news/top/society/,science,67,Scientists Discover the Oldest Wooden Tools Ever Used by Humans,https://www.sciencedaily.com/releases/2026/05/260523103939.htm,2026-06-13T03:24:09+00:00
ScienceDaily Society,https://www.sciencedaily.com/news/top/society/,science,68,Buried Roman Sanctuary Discovered Beneath Frankfurt Hints at Shocking Rituals,https://www.sciencedaily.com/releases/2026/04/260405003937.htm,2026-06-13T03:24:09+00:00
ScienceDaily Society,https://www.sciencedaily.com/news/top/society/,science,69,People Who Switched to Cannabis Drinks Cut Their Alcohol Use Nearly in Half,https://www.sciencedaily.com/releases/2026/02/260217005806.htm,2026-06-13T03:24:09+00:00
ScienceDaily Society,https://www.sciencedaily.com/news/top/society/,science,70,Middle Age Is Becoming a Breaking Point in the U.S.,https://www.sciencedaily.com/releases/2026/02/260201062457.htm,2026-06-13T03:24:09+00:00
ScienceDaily Society,https://www.sciencedaily.com/news/top/society/,science,71,Halley’s Comet May Be Named After the Wrong Person,https://www.sciencedaily.com/releases/2026/05/260512202329.htm,2026-06-13T03:24:09+00:00
ScienceDaily Society,https://www.sciencedaily.com/news/top/society/,science,72,Your Fireplace May Be Doing More Harm Than You Think,https://www.sciencedaily.com/releases/2026/01/260126075839.htm,2026-06-13T03:24:09+00:00
ScienceDaily Society,https://www.sciencedaily.com/news/top/society/,science,73,A Century-Old Stonehenge Mystery May Finally Be Solved,https://www.sciencedaily.com/releases/2026/01/260127010208.htm,2026-06-13T03:24:09+00:00
ScienceDaily Society,https://www.sciencedaily.com/news/top/society/,science,74,"A Lost Disease Emerges from 5,500-Year-Old Human Remains",https://www.sciencedaily.com/releases/2026/01/260125083349.htm,2026-06-13T03:24:09+00:00
ScienceDaily Society,https://www.sciencedaily.com/news/top/society/,science,75,"This 67,800-Year-Old Handprint Is the Oldest Art Ever Found",https://www.sciencedaily.com/releases/2026/03/260322020300.htm,2026-06-13T03:24:09+00:00
ScienceDaily Society,https://www.sciencedaily.com/news/top/society/,science,76,Ancient People Carried a Wild Potato Across the American Southwest,https://www.sciencedaily.com/releases/2026/01/260125081143.htm,2026-06-13T03:24:09+00:00
ScienceDaily Society,https://www.sciencedaily.com/news/top/society/,science,77,"Ancient Mass Grave Reveals How a Pandemic Wiped out a City 1,500 Years Ago",https://www.sciencedaily.com/releases/2026/04/260423031540.htm,2026-06-13T03:24:09+00:00
ScienceDaily Society,https://www.sciencedaily.com/news/top/society/,science,78,New Research Shows Emotional Expressions Work Differently in Autism,https://www.sciencedaily.com/releases/2026/01/260118233549.htm,2026-06-13T03:24:09+00:00
ScienceDaily Society,https://www.sciencedaily.com/news/top/society/,science,79,2700-Year-Old Teeth Reveal the Hidden Lives of Iron Age Italians,https://www.sciencedaily.com/releases/2026/03/260303145727.htm,2026-06-13T03:24:09+00:00
ScienceDaily Society,https://www.sciencedaily.com/news/top/society/,science,80,The Breakthrough That Makes Robot Faces Feel Less Creepy,https://www.sciencedaily.com/releases/2026/01/260116035308.htm,2026-06-13T03:24:09+00:00
ScienceDaily Society,https://www.sciencedaily.com/news/top/society/,science,81,"Think AI ""knows"" What It’s Doing? Scientists Say Think Again",https://www.sciencedaily.com/releases/2026/04/260417224505.htm,2026-06-13T03:24:09+00:00
ScienceDaily Society,https://www.sciencedaily.com/news/top/society/,science,82,This Quantum Computing Breakthrough May Not Be What It Seemed,https://www.sciencedaily.com/releases/2026/03/260328043600.htm,2026-06-13T03:24:09+00:00
ScienceDaily Society,https://www.sciencedaily.com/news/top/society/,science,83,"60,000 Years Ago Humans Were Already Using Poisoned Arrows",https://www.sciencedaily.com/releases/2026/02/260212025616.htm,2026-06-13T03:24:09+00:00
ScienceDaily Society,https://www.sciencedaily.com/news/top/society/,science,84,War Has Pushed Gaza’s Children to the Brink – “like the Living Dead”,https://www.sciencedaily.com/releases/2026/01/260111214447.htm,2026-06-13T03:24:09+00:00
ScienceDaily Society,https://www.sciencedaily.com/news/top/society/,science,85,The Financial Crisis That Quietly Stunted a Generation,https://www.sciencedaily.com/releases/2026/03/260314030521.htm,2026-06-13T03:24:09+00:00
ScienceDaily Society,https://www.sciencedaily.com/news/top/society/,science,86,Think You’re Bad at Languages? Experts Say These 5 Myths Are to Blame,https://www.sciencedaily.com/releases/2026/05/260521072412.htm,2026-06-13T03:24:09+00:00
ScienceDaily Society,https://www.sciencedaily.com/news/top/society/,science,87,What You Eat Could Decide the Planet’s Future,https://www.sciencedaily.com/releases/2025/12/251224032356.htm,2026-06-13T03:24:09+00:00
ScienceDaily Society,https://www.sciencedaily.com/news/top/society/,science,88,Why Consciousness Can’t Be Reduced to Code,https://www.sciencedaily.com/releases/2025/12/251224032351.htm,2026-06-13T03:24:09+00:00
ScienceDaily Society,https://www.sciencedaily.com/news/top/society/,science,89,AI Supercharges Scientific Output While Quality Slips,https://www.sciencedaily.com/releases/2025/12/251224032347.htm,2026-06-13T03:24:09+00:00
ScienceDaily Society,https://www.sciencedaily.com/news/top/society/,science,90,The Real Reason Incomes Rise and Why They Drop,https://www.sciencedaily.com/releases/2025/12/251219093312.htm,2026-06-13T03:24:09+00:00
ScienceDaily Society,https://www.sciencedaily.com/news/top/society/,science,91,Ancient Sewers Expose a Hidden Health Crisis in Roman Britain,https://www.sciencedaily.com/releases/2025/12/251221043221.htm,2026-06-13T03:24:09+00:00
ScienceDaily Society,https://www.sciencedaily.com/news/top/society/,science,92,Science Says We’ve Been Nurturing “gifted” Kids All Wrong,https://www.sciencedaily.com/releases/2025/12/251221043218.htm,2026-06-13T03:24:09+00:00
ScienceDaily Society,https://www.sciencedaily.com/news/top/society/,science,93,Deaths of Despair Were Rising Long Before Opioids,https://www.sciencedaily.com/releases/2025/12/251219093317.htm,2026-06-13T03:24:09+00:00
ScienceDaily Society,https://www.sciencedaily.com/news/top/society/,science,94,New DNA Analysis Rewrites the Story of the Beachy Head Woman,https://www.sciencedaily.com/releases/2026/01/260125083421.htm,2026-06-13T03:24:09+00:00
ScienceDaily Society,https://www.sciencedaily.com/news/top/society/,science,95,What If AI Becomes Conscious and We Never Know,https://www.sciencedaily.com/releases/2025/12/251221043223.htm,2026-06-13T03:24:09+00:00
ScienceDaily Society,https://www.sciencedaily.com/news/top/society/,science,96,Scientists Turn Carrot Waste Into Protein People Prefer,https://www.sciencedaily.com/releases/2025/12/251220104557.htm,2026-06-13T03:24:09+00:00
ScienceDaily Society,https://www.sciencedaily.com/news/top/society/,science,97,A Loud Minority Makes the Internet Look Far More Toxic Than It Is,https://www.sciencedaily.com/releases/2025/12/251216081933.htm,2026-06-13T03:24:09+00:00
ScienceDaily Society,https://www.sciencedaily.com/news/top/society/,science,98,"Ancient Fingerprint Found on 2,400-Year-Old Danish War Boat",https://www.sciencedaily.com/releases/2026/02/260215225551.htm,2026-06-13T03:24:09+00:00
ScienceDaily Society,https://www.sciencedaily.com/news/top/society/,science,99,Medieval Miracles: Dragon-Slaying Saints Once Healed the Land,https://www.sciencedaily.com/releases/2026/02/260201231255.htm,2026-06-13T03:24:09+00:00
ScienceDaily Society,https://www.sciencedaily.com/news/top/society/,science,100,TikTok’s Gout Advice Is Everywhere and Doctors Say It’s Often Wrong,https://www.sciencedaily.com/releases/2026/01/260108231330.htm,2026-06-13T03:24:09+00:00
ScienceDaily Society,https://www.sciencedaily.com/news/top/society/,science,101,Stanford Scientists Uncover Why mRNA COVID Vaccines Can Trigger Heart Inflammation,https://www.sciencedaily.com/releases/2025/12/251227082716.htm,2026-06-13T03:24:09+00:00
ScienceDaily Society,https://www.sciencedaily.com/news/top/society/,science,102,"This 8,000-Year-Old Art Shows Math Before Numbers Existed",https://www.sciencedaily.com/releases/2025/12/251216081937.htm,2026-06-13T03:24:09+00:00
ScienceDaily Society,https://www.sciencedaily.com/news/top/society/,science,103,Are They Really Listening? Watch Their Blinks,https://www.sciencedaily.com/releases/2025/12/251222043239.htm,2026-06-13T03:24:09+00:00
ScienceDaily Society,https://www.sciencedaily.com/news/top/society/,science,104,"A 4,000-Year-Old Sheep Reveals the Secret of an Ancient Plague",https://www.sciencedaily.com/releases/2026/03/260306224232.htm,2026-06-13T03:24:09+00:00
ScienceDaily Society,https://www.sciencedaily.com/news/top/society/,science,105,"Ancient Drought May Have Wiped out the Real-Life Hobbits 61,000 Years Ago",https://www.sciencedaily.com/releases/2026/02/260218031601.htm,2026-06-13T03:24:09+00:00
ScienceDaily Society,https://www.sciencedaily.com/news/top/society/,science,106,Kids’ Anxiety and Depression Dropped Fast After COVID School Reopenings,https://www.sciencedaily.com/releases/2025/12/251213042244.htm,2026-06-13T03:24:09+00:00
ScienceDaily Society,https://www.sciencedaily.com/news/top/society/,science,107,Rising Temperatures Are Slowing Early Childhood Development,https://www.sciencedaily.com/releases/2025/12/251209234247.htm,2026-06-13T03:24:09+00:00
ScienceDaily Society,https://www.sciencedaily.com/news/top/society/,science,108,This New Building Material Pulls Carbon out of the Air,https://www.sciencedaily.com/releases/2026/01/260121034148.htm,2026-06-13T03:24:09+00:00
ScienceDaily Society,https://www.sciencedaily.com/news/top/society/,science,109,"Roman Mosaic in Britain Reveals a 2,000 Year Old Trojan War Secret",https://www.sciencedaily.com/releases/2026/02/260212234220.htm,2026-06-13T03:24:09+00:00
ScienceDaily Society,https://www.sciencedaily.com/news/top/society/,science,110,Scientists Uncover a Volcanic Trigger Behind the Black Death,https://www.sciencedaily.com/releases/2025/12/251208014623.htm,2026-06-13T03:24:09+00:00
ScienceDaily Society,https://www.sciencedaily.com/news/top/society/,science,111,"Humans Reached Australia 60,000 Years Ago, New DNA Study Reveals",https://www.sciencedaily.com/releases/2026/04/260408225938.htm,2026-06-13T03:24:09+00:00
ScienceDaily Society,https://www.sciencedaily.com/news/top/society/,science,112,A Backwards Bible Map That Changed the World,https://www.sciencedaily.com/releases/2025/11/251129044502.htm,2026-06-13T03:24:09+00:00
ScienceDaily Society,https://www.sciencedaily.com/news/top/society/,science,113,Scientists Discover AI Can Make Humans More Creative,https://www.sciencedaily.com/releases/2026/03/260315004355.htm,2026-06-13T03:24:09+00:00
ScienceDaily Society,https://www.sciencedaily.com/news/top/society/,science,114,Scientists Finally Uncovered Why the Indus Valley Civilization Collapsed,https://www.sciencedaily.com/releases/2025/12/251214100930.htm,2026-06-13T03:24:09+00:00
ScienceDaily Society,https://www.sciencedaily.com/news/top/society/,science,115,New 3D Scan Reveals a Hidden Network of Moai Carvers on Easter Island,https://www.sciencedaily.com/releases/2025/11/251130050717.htm,2026-06-13T03:24:09+00:00
ScienceDaily Society,https://www.sciencedaily.com/news/top/society/,science,116,A Strange Ancient Foot Reveals a Hidden Human Cousin,https://www.sciencedaily.com/releases/2025/11/251128050512.htm,2026-06-13T03:24:09+00:00
ScienceDaily Society,https://www.sciencedaily.com/news/top/society/,science,117,How Personalized Algorithms Trick Your Brain Into Wrong Answers,https://www.sciencedaily.com/releases/2025/11/251125081912.htm,2026-06-13T03:24:09+00:00
ScienceDaily Society,https://www.sciencedaily.com/news/top/society/,science,118,Scientists Reveal Why Human Language Isn’t Like Computer Code,https://www.sciencedaily.com/releases/2026/02/260219040811.htm,2026-06-13T03:24:09+00:00
ScienceDaily Society,https://www.sciencedaily.com/news/top/society/,science,119,750-Year-Old Indian Poems Reveal a Landscape Scientists Got Wrong,https://www.sciencedaily.com/releases/2026/01/260131084622.htm,2026-06-13T03:24:09+00:00
ScienceDaily Society,https://www.sciencedaily.com/news/top/society/,science,120,Ancient Wolves Could Only Have Reached This Island by Boat,https://www.sciencedaily.com/releases/2025/12/251227004151.htm,2026-06-13T03:24:09+00:00
ScienceDaily Society,https://www.sciencedaily.com/news/top/society/,science,121,Europe Launches Bold Plan to Harness Twisting Beams of Light,https://www.sciencedaily.com/releases/2025/11/251124094319.htm,2026-06-13T03:24:09+00:00
ScienceDaily Society,https://www.sciencedaily.com/news/top/society/,science,122,Humans Are Built for Nature Not Modern Life,https://www.sciencedaily.com/releases/2025/12/251207031335.htm,2026-06-13T03:24:09+00:00
ScienceDaily Society,https://www.sciencedaily.com/news/top/society/,science,123,A New Filter for Cleaner Water,https://www.sciencedaily.com/releases/2026/06/260612032049.htm,2026-06-13T03:24:09+00:00
ScienceDaily Society,https://www.sciencedaily.com/news/top/society/,science,124,JUNO Closes In on the Neutrino Mystery,https://www.sciencedaily.com/releases/2026/06/260612032026.htm,2026-06-13T03:24:09+00:00
ScienceDaily Society,https://www.sciencedaily.com/news/top/society/,science,125,Lost Notebooks Solve Fossil Mystery,https://www.sciencedaily.com/releases/2026/06/260612032038.htm,2026-06-13T03:24:09+00:00
ScienceDaily Society,https://www.sciencedaily.com/news/top/society/,science,126,Artificial Photosynthesis Without Batteries,https://www.sciencedaily.com/releases/2026/06/260611024601.htm,2026-06-13T03:24:09+00:00
ScienceDaily Society,https://www.sciencedaily.com/news/top/society/,science,127,Rice Inspires a New Smart Material,https://www.sciencedaily.com/releases/2026/06/260611024621.htm,2026-06-13T03:24:09+00:00
ScienceDaily Society,https://www.sciencedaily.com/news/top/society/,science,128,NASA Reveals Artemis III Crew,https://www.sciencedaily.com/releases/2026/06/260611024606.htm,2026-06-13T03:24:09+00:00
ScienceDaily Society,https://www.sciencedaily.com/news/top/society/,science,129,The Strange Twilight of an Alien Planet,https://www.sciencedaily.com/releases/2026/06/260611024559.htm,2026-06-13T03:24:09+00:00
Healthline,https://www.healthline.com/,health,1,How Well Do You Sleep?,https://www.healthline.com/health/healthy-sleep/quiz-how-well-do-you-sleep,2026-06-13T03:24:09+00:00
Healthline,https://www.healthline.com/,health,2,Are You a Workaholic?,https://www.healthline.com/health/mental-health/quiz-are-you-a-workaholic,2026-06-13T03:24:09+00:00
Healthline,https://www.healthline.com/,health,3,Medicare 2026 Changes,https://www.healthline.com/health-news/medicare-open-enrollment-2026-key-changes,2026-06-13T03:24:09+00:00
Healthline,https://www.healthline.com/,health,4,Can 6-6-6 Walking Workout Help You Lose Weight?,https://www.healthline.com/health-news/666-walking-trend-weight-loss,2026-06-13T03:24:09+00:00
Healthline,https://www.healthline.com/,health,5,This Couple Lost 118 Pounds Together Without Medication,https://www.healthline.com/health-news/married-couple-loses-119-pounds-together-without-meds,2026-06-13T03:24:09+00:00
