source,source_url,category,rank,headline,link,collected_at_iso
ET Panache Worklife,https://economictimes.indiatimes.com/magazines/panache/worklife,worklife,31,Panchayat Season 3 OTT Release,https://economictimes.indiatimes.com/articleshow/110140474.cms,2026-06-13T03:24:09+00:00
ET Panache Worklife,https://economictimes.indiatimes.com/magazines/panache/worklife,worklife,32,Cannes 2024 Live Streaming,https://economictimes.indiatimes.com/articleshow/110116799.cms,2026-06-13T03:24:09+00:00
ET Panache Worklife,https://economictimes.indiatimes.com/magazines/panache/worklife,worklife,33,Pavitra Jayaram Death,https://economictimes.indiatimes.com/articleshow/110069299.cms,2026-06-13T03:24:09+00:00
ET Panache Worklife,https://economictimes.indiatimes.com/magazines/panache/worklife,worklife,34,Rituraj Singh Death,https://economictimes.indiatimes.com/articleshow/107842242.cms,2026-06-13T03:24:09+00:00
ET Panache Worklife,https://economictimes.indiatimes.com/magazines/panache/worklife,worklife,35,"Gene Shalit dies at 100: Who is the iconic ‘Today’ show critic who brought wit, puns and personality to American television",https://economictimes.indiatimes.com/articleshow/131696585.cms,2026-06-13T03:24:09+00:00
ET Panache Worklife,https://economictimes.indiatimes.com/magazines/panache/worklife,worklife,36,Folarin Balogun played for another international team before choosing Team USA - why he made the switch,https://economictimes.indiatimes.com/articleshow/131696538.cms,2026-06-13T03:24:09+00:00
ET Panache Worklife,https://economictimes.indiatimes.com/magazines/panache/worklife,worklife,37,"SpaceX: Five key moments, from first launch to Starship megarocket",https://economictimes.indiatimes.com/articleshow/131696581.cms,2026-06-13T03:24:09+00:00
ET Panache Worklife,https://economictimes.indiatimes.com/magazines/panache/worklife,worklife,38,"Kolkata government building fire destroys 4,000 EVMs; minister suspects foul play",https://economictimes.indiatimes.com/articleshow/131696624.cms,2026-06-13T03:24:09+00:00
ET Panache Worklife,https://economictimes.indiatimes.com/magazines/panache/worklife,worklife,39,China 'strongly dissatisfied' with Pentagon move against top Chinese tech firms,https://economictimes.indiatimes.com/articleshow/131696578.cms,2026-06-13T03:24:09+00:00
ET Panache Worklife,https://economictimes.indiatimes.com/magazines/panache/worklife,worklife,40,Microsoft has considered spinning off Xbox: Report,https://economictimes.indiatimes.com/articleshow/131696607.cms,2026-06-13T03:24:09+00:00
ET Panache Worklife,https://economictimes.indiatimes.com/magazines/panache/worklife,worklife,41,FIFA World Cup 2026 Viral Video: Watch how Paraguay's Damián Bobadilla gifted own goal to USA in their tournament opener,https://economictimes.indiatimes.com/articleshow/131696568.cms,2026-06-13T03:24:09+00:00
ET Panache Worklife,https://economictimes.indiatimes.com/magazines/panache/worklife,worklife,42,"if(typeof objAd !=""undefined""){ objAd.loadAds(); } Why market rallied today? Sensex zooms 1,700 points, Nifty closes above 23,600. 4 key factors behind Rs 10 lakh crore gains",https://economictimes.indiatimes.com/articleshow/131673189.cms,2026-06-13T03:24:09+00:00
ET Panache Worklife,https://economictimes.indiatimes.com/magazines/panache/worklife,worklife,43,Air India plans to downsize with owner Tata balking at losses,https://economictimes.indiatimes.com/articleshow/131681729.cms,2026-06-13T03:24:09+00:00
ET Panache Worklife,https://economictimes.indiatimes.com/magazines/panache/worklife,worklife,44,"if(typeof objAd !=""undefined""){ objAd.loadAds(); } Jewish Proverb of the Day: “A woman of sixty, like a girl of six, runs at the sound of… — Life lessons on perception, experience, joy, celebration and why age is just a number",https://economictimes.indiatimes.com/articleshow/131682972.cms,2026-06-13T03:24:09+00:00
ET Panache Worklife,https://economictimes.indiatimes.com/magazines/panache/worklife,worklife,45,"if(typeof objAd !=""undefined""){ objAd.loadAds(); } Kerala Lottery Result Today Suvarna Keralam SK-56 (12-06-2026): Rs 1 crore, Rs 30 lakh & Rs 5 lakh prize-winning numbers. Full list here",https://economictimes.indiatimes.com/articleshow/131679058.cms,2026-06-13T03:24:09+00:00
ET Panache Worklife,https://economictimes.indiatimes.com/magazines/panache/worklife,worklife,46,"if(typeof objAd !=""undefined""){ objAd.loadAds(); } Nifty in control of FIIs? The unlucky 13 bluechips facing the hardest institutional selloff",https://economictimes.indiatimes.com/articleshow/131673919.cms,2026-06-13T03:24:09+00:00
ET Panache Worklife,https://economictimes.indiatimes.com/magazines/panache/worklife,worklife,47,"'Europeans sell weapons, which are used to attack India': Jaishankar raises arms exports issue",https://economictimes.indiatimes.com/articleshow/131676094.cms,2026-06-13T03:24:09+00:00
ET Panache Worklife,https://economictimes.indiatimes.com/magazines/panache/worklife,worklife,48,"if(typeof objAd !=""undefined""){ objAd.loadAds(); } Govt restricts bulk industrial petrol, diesel purchases through petrol pumps",https://economictimes.indiatimes.com/articleshow/131671441.cms,2026-06-13T03:24:09+00:00
ET Panache Worklife,https://economictimes.indiatimes.com/magazines/panache/worklife,worklife,49,"if(typeof objAd !=""undefined""){ objAd.loadAds(); } Fresh fruits, creamy buffalo milk, no preservatives: This 55-year-old Mumbai shop sells handmade ice creams with over 50 flavours. How two brothers kept a family legacy alive through innovation and tradition",https://economictimes.indiatimes.com/articleshow/131677043.cms,2026-06-13T03:24:09+00:00
ET Panache Worklife,https://economictimes.indiatimes.com/magazines/panache/worklife,worklife,50,QR code in red envelope leads to “invite-only” Instagram page: What we know so far,https://economictimes.indiatimes.com/articleshow/121338235.cms,2026-06-13T03:24:09+00:00
ET Panache Worklife,https://economictimes.indiatimes.com/magazines/panache/worklife,worklife,51,"if(typeof objAd !=""undefined""){ objAd.loadAds(); } Vedanta demerger: Which demerged stock should you buy after their market debut on June 15?",https://economictimes.indiatimes.com/articleshow/131674612.cms,2026-06-13T03:24:09+00:00
ET Panache Worklife,https://economictimes.indiatimes.com/magazines/panache/worklife,worklife,52,"if(typeof objAd !=""undefined""){ objAd.loadAds(); } Gold rate today (June 12, 2026): Check 24k, 22k and 18k gold jewellery rates from IBJA, Malabar Gold and Diamonds, Joyalukkas & Tanishq in Delhi, Mumbai and other cities",https://economictimes.indiatimes.com/articleshow/131679319.cms,2026-06-13T03:24:09+00:00
ET Panache Worklife,https://economictimes.indiatimes.com/magazines/panache/worklife,worklife,53,‘Totally unacceptable’: Trump condemns Iran 'drone attack on Indian ships,https://economictimes.indiatimes.com/articleshow/131686562.cms,2026-06-13T03:24:09+00:00
ET Panache Worklife,https://economictimes.indiatimes.com/magazines/panache/worklife,worklife,54,"if(typeof objAd !=""undefined""){ objAd.loadAds(); } Is India's economic growth real? Raghuram Rajan says something is off",https://economictimes.indiatimes.com/articleshow/131676593.cms,2026-06-13T03:24:09+00:00
ET Panache Worklife,https://economictimes.indiatimes.com/magazines/panache/worklife,worklife,55,"Go to Horoscope Today, 13 June 2026 Page",https://economictimes.indiatimes.com/articleshow/131688976.cms,2026-06-13T03:24:09+00:00
ET Panache Worklife,https://economictimes.indiatimes.com/magazines/panache/worklife,worklife,56,Go to is Facebook Instagram messenger Down Page,https://economictimes.indiatimes.com/articleshow/131687112.cms,2026-06-13T03:24:09+00:00
ET Panache Worklife,https://economictimes.indiatimes.com/magazines/panache/worklife,worklife,57,Go to Jaspal Rana Death Page,https://economictimes.indiatimes.com/articleshow/131673785.cms,2026-06-13T03:24:09+00:00
ET Panache Worklife,https://economictimes.indiatimes.com/magazines/panache/worklife,worklife,58,"Go to Horoscope Tomorrow, 13th June 2026 Page",https://economictimes.indiatimes.com/articleshow/131675422.cms,2026-06-13T03:24:09+00:00
ET Panache Worklife,https://economictimes.indiatimes.com/magazines/panache/worklife,worklife,59,Go to Mutual fund SIP inflow data Page,https://economictimes.indiatimes.com/articleshow/131625476.cms,2026-06-13T03:24:09+00:00
ET Panache Worklife,https://economictimes.indiatimes.com/magazines/panache/worklife,worklife,60,Go to FIFA World Cup 2026 Schedule Page,https://economictimes.indiatimes.com/articleshow/131612402.cms,2026-06-13T03:24:09+00:00
ET Panache Worklife,https://economictimes.indiatimes.com/magazines/panache/worklife,worklife,61,Go to Rajesh Exports Share Price Page,https://economictimes.indiatimes.com/articleshow/131521134.cms,2026-06-13T03:24:09+00:00
ET Panache Worklife,https://economictimes.indiatimes.com/magazines/panache/worklife,worklife,62,Go to Mumbai CNG Price Hike Page,https://economictimes.indiatimes.com/articleshow/131403004.cms,2026-06-13T03:24:09+00:00
ET Panache Worklife,https://economictimes.indiatimes.com/magazines/panache/worklife,worklife,63,Go to LSS USS Result 2026 Page,https://economictimes.indiatimes.com/articleshow/131290892.cms,2026-06-13T03:24:09+00:00
ET Panache Worklife,https://economictimes.indiatimes.com/magazines/panache/worklife,worklife,64,Go to Pakistan bomb blast on army train Page,https://economictimes.indiatimes.com/articleshow/131289469.cms,2026-06-13T03:24:09+00:00
ET Panache Worklife,https://economictimes.indiatimes.com/magazines/panache/worklife,worklife,65,Go to Who is rapper Santy Sharma Page,https://economictimes.indiatimes.com/articleshow/131288489.cms,2026-06-13T03:24:09+00:00
ET Panache Worklife,https://economictimes.indiatimes.com/magazines/panache/worklife,worklife,66,Go to White House Shooting: Who was Nasire Best? Page,https://economictimes.indiatimes.com/articleshow/131288029.cms,2026-06-13T03:24:09+00:00
ET Panache Worklife,https://economictimes.indiatimes.com/magazines/panache/worklife,worklife,67,Go to CBSE reevaluation 2026 Page,https://economictimes.indiatimes.com/articleshow/131261813.cms,2026-06-13T03:24:09+00:00
ET Panache Worklife,https://economictimes.indiatimes.com/magazines/panache/worklife,worklife,68,Go to Maggie Smith News Page,https://economictimes.indiatimes.com/articleshow/113743204.cms,2026-06-13T03:24:09+00:00
ET Panache Worklife,https://economictimes.indiatimes.com/magazines/panache/worklife,worklife,69,Go to Sunita Williams Space Station Routine Page,https://economictimes.indiatimes.com/articleshow/113340209.cms,2026-06-13T03:24:09+00:00
ET Panache Worklife,https://economictimes.indiatimes.com/magazines/panache/worklife,worklife,70,Go to Cristiano Ronaldo Youtube Channel Page,https://economictimes.indiatimes.com/articleshow/112701776.cms,2026-06-13T03:24:09+00:00
ET Panache Worklife,https://economictimes.indiatimes.com/magazines/panache/worklife,worklife,71,Go to Who is Miles Routledge Page,https://economictimes.indiatimes.com/articleshow/112706059.cms,2026-06-13T03:24:09+00:00
ET Panache Worklife,https://economictimes.indiatimes.com/magazines/panache/worklife,worklife,72,Go to Isha Ambani Lehenga Page,https://economictimes.indiatimes.com/articleshow/111678035.cms,2026-06-13T03:24:09+00:00
ET Panache Worklife,https://economictimes.indiatimes.com/magazines/panache/worklife,worklife,73,US military's plan for ground operation to seize Iran's Uranium was paused by Trump: Report,https://economictimes.indiatimes.com/articleshow/131696530.cms,2026-06-13T03:24:09+00:00
ET Panache Worklife,https://economictimes.indiatimes.com/magazines/panache/worklife,worklife,74,Bengaluru man worked with Goldman Sachs. Four years later goes to its iconic New York office to pitch his AI company: 'All because I took one call',https://economictimes.indiatimes.com/articleshow/131696452.cms,2026-06-13T03:24:09+00:00
ET Panache Worklife,https://economictimes.indiatimes.com/magazines/panache/worklife,worklife,75,Trump says US military strike killed leader of Venezuela's Tren de Aragua gang,https://economictimes.indiatimes.com/articleshow/131696529.cms,2026-06-13T03:24:09+00:00
ET Panache Worklife,https://economictimes.indiatimes.com/magazines/panache/worklife,worklife,76,"Five new K-dramas to watch this week on OTT starring Lee Jae Wook, Kim Mu-yeol, Lim Ji-yeon: Teach You A Lesson to Doctor on the Edge to My Royal Nemesis",https://economictimes.indiatimes.com/articleshow/131696232.cms,2026-06-13T03:24:09+00:00
ET Panache Worklife,https://economictimes.indiatimes.com/magazines/panache/worklife,worklife,77,"Iran calls Trump's claims 'baseless', alleges US attacked vessels killing three Indian seafarers",https://economictimes.indiatimes.com/articleshow/131696648.cms,2026-06-13T03:24:09+00:00
ET Panache Worklife,https://economictimes.indiatimes.com/magazines/panache/worklife,worklife,78,"Proverb of the day: 'The woman who does not covet the possessions of her husband is...' Life lessons on marriage, love, relationships, emotional attachment and human nature",https://economictimes.indiatimes.com/articleshow/131696470.cms,2026-06-13T03:24:09+00:00
ET Panache Worklife,https://economictimes.indiatimes.com/magazines/panache/worklife,worklife,79,FIFA World Cup 2026: Will Neymar play in Brazil's opener against Morocco?,https://economictimes.indiatimes.com/articleshow/131696907.cms,2026-06-13T03:24:09+00:00
ET Panache Worklife,https://economictimes.indiatimes.com/magazines/panache/worklife,worklife,80,BJP to contest all 117 seats independently in 2027 Punjab assembly polls,https://economictimes.indiatimes.com/articleshow/131696931.cms,2026-06-13T03:24:09+00:00
ScienceDaily,https://www.sciencedaily.com/,science,1,Alaska’s Glaciers Have a Startling Response to Rising Temperatures,https://www.sciencedaily.com/releases/2026/06/260612032047.htm,2026-06-13T03:24:09+00:00
ScienceDaily,https://www.sciencedaily.com/,science,2,These Tiny Holes Could Change How the World Cleans Water,https://www.sciencedaily.com/releases/2026/06/260612032049.htm,2026-06-13T03:24:09+00:00
ScienceDaily,https://www.sciencedaily.com/,science,3,Can Fasting Fight Gum Disease? Scientists Find Surprising Link,https://www.sciencedaily.com/releases/2026/06/260612032032.htm,2026-06-13T03:24:09+00:00
ScienceDaily,https://www.sciencedaily.com/,science,4,Scientists Discover a Surprising Cancer Link to Alzheimer’s Disease,https://www.sciencedaily.com/releases/2026/06/260612032044.htm,2026-06-13T03:24:09+00:00
ScienceDaily,https://www.sciencedaily.com/,science,5,Stanford Scientists Regrow Lost Cartilage and Reverse Arthritis in Major Breakthrough,https://www.sciencedaily.com/releases/2026/06/260612021604.htm,2026-06-13T03:24:09+00:00
ScienceDaily,https://www.sciencedaily.com/,science,6,Giant Underground Neutrino Detector Brings Scientists Closer to Cracking the Neutrino Puzzle,https://www.sciencedaily.com/releases/2026/06/260612032026.htm,2026-06-13T03:24:09+00:00
ScienceDaily,https://www.sciencedaily.com/,science,7,Brain-inspired Chip Runs Near Absolute Zero and Could Transform Quantum Computing,https://www.sciencedaily.com/releases/2026/06/260612032024.htm,2026-06-13T03:24:09+00:00
ScienceDaily,https://www.sciencedaily.com/,science,8,The Missing Notebooks That Solved a 55-million-year-old Fossil Mystery,https://www.sciencedaily.com/releases/2026/06/260612032038.htm,2026-06-13T03:24:09+00:00
ScienceDaily,https://www.sciencedaily.com/,science,9,"A Legendary Golden Fabric Lost for 2,000 Years Has Returned",https://www.sciencedaily.com/releases/2026/06/260612021000.htm,2026-06-13T03:24:09+00:00
ScienceDaily,https://www.sciencedaily.com/,science,10,One-way Quantum Synchronization Could Make Quantum Computers More Reliable,https://www.sciencedaily.com/releases/2026/06/260611024619.htm,2026-06-13T03:24:09+00:00
ScienceDaily,https://www.sciencedaily.com/,science,11,Ancient DNA Shared with Neanderthals May Explain Human Language,https://www.sciencedaily.com/releases/2026/06/260611024612.htm,2026-06-13T03:24:09+00:00
ScienceDaily,https://www.sciencedaily.com/,science,12,Scientists Found the Strength Training Sweet Spot for a Longer Life,https://www.sciencedaily.com/releases/2026/06/260611024609.htm,2026-06-13T03:24:09+00:00
ScienceDaily,https://www.sciencedaily.com/,science,13,Popular Joint Supplement Glucosamine Linked to Faster Alzheimer’s Progression,https://www.sciencedaily.com/releases/2026/06/260610003044.htm,2026-06-13T03:24:09+00:00
ScienceDaily,https://www.sciencedaily.com/,science,14,Scientists Found a New Alzheimer’s Trigger and a Drug That Stops It,https://www.sciencedaily.com/releases/2026/06/260608035959.htm,2026-06-13T03:24:09+00:00
ScienceDaily,https://www.sciencedaily.com/,science,15,Ozempic and Similar Weight-Loss Drugs Linked to 30% Lower Breast Cancer Risk,https://www.sciencedaily.com/releases/2026/06/260605023400.htm,2026-06-13T03:24:09+00:00
ScienceDaily,https://www.sciencedaily.com/,science,16,AI-Designed Universal Coronavirus Vaccine Passes First Human Trial,https://www.sciencedaily.com/releases/2026/06/260605023357.htm,2026-06-13T03:24:09+00:00
ScienceDaily,https://www.sciencedaily.com/,science,17,Scientists Built a Battery-Free Device That Turns Sunlight Into Fuel,https://www.sciencedaily.com/releases/2026/06/260611024601.htm,2026-06-13T03:24:09+00:00
ScienceDaily,https://www.sciencedaily.com/,science,18,Scientists Discover a Strange Property in Rice and Turn It Into a Smart Material,https://www.sciencedaily.com/releases/2026/06/260611024621.htm,2026-06-13T03:24:09+00:00
ScienceDaily,https://www.sciencedaily.com/,science,19,AI Could Uncover New Physics Faster but There’s a Surprising Catch,https://www.sciencedaily.com/releases/2026/06/260611024557.htm,2026-06-13T03:24:09+00:00
ScienceDaily,https://www.sciencedaily.com/,science,20,Tiny X-Ray Telescope Could Unlock the Moon's Hidden Chemistry,https://www.sciencedaily.com/releases/2026/06/260606075508.htm,2026-06-13T03:24:09+00:00
ScienceDaily,https://www.sciencedaily.com/,science,21,"The 1,100-Year-Old Mystery of Montana’s Lost Bison Hunting Site Finally Solved",https://www.sciencedaily.com/releases/2026/06/260610003056.htm,2026-06-13T03:24:09+00:00
ScienceDaily,https://www.sciencedaily.com/,science,22,Scientists Propose a Radical New Theory for How Life Began on Earth,https://www.sciencedaily.com/releases/2026/06/260610003054.htm,2026-06-13T03:24:09+00:00
ScienceDaily,https://www.sciencedaily.com/,science,23,Giant Fire Tornadoes Could Clean Up Oil Spills Faster With Less Pollution,https://www.sciencedaily.com/releases/2026/06/260605023420.htm,2026-06-13T03:24:09+00:00
ScienceDaily,https://www.sciencedaily.com/,science,24,Scientists Confirm a Deep Earthquake That Shouldn't Exist,https://www.sciencedaily.com/releases/2026/06/260602021636.htm,2026-06-13T03:24:09+00:00
ScienceDaily,https://www.sciencedaily.com/,science,25,The Biggest Collagen Study yet Reveals What Actually Works,https://www.sciencedaily.com/releases/2026/06/260604044302.htm,2026-06-13T03:24:09+00:00
ScienceDaily,https://www.sciencedaily.com/,science,26,Scientists Finally Crack an “Undruggable” Pancreatic Cancer Target and Nearly Double Survival,https://www.sciencedaily.com/releases/2026/06/260604044247.htm,2026-06-13T03:24:09+00:00
ScienceDaily,https://www.sciencedaily.com/,science,27,Scientists Discover the Master Clock That Controls Biological Growth and Development,https://www.sciencedaily.com/releases/2026/06/260604044236.htm,2026-06-13T03:24:09+00:00
ScienceDaily,https://www.sciencedaily.com/,science,28,Cancer’s Favorite Escape Trick May Actually Make It Easier to Kill,https://www.sciencedaily.com/releases/2026/06/260603023911.htm,2026-06-13T03:24:09+00:00
ScienceDaily,https://www.sciencedaily.com/,science,29,This New Diabetes Pill Burns Fat Without the Downsides of Ozempic,https://www.sciencedaily.com/releases/2026/06/260603015541.htm,2026-06-13T03:24:09+00:00
ScienceDaily,https://www.sciencedaily.com/,science,30,Scientists Reverse Anxiety by Fixing a Tiny Brain Circuit,https://www.sciencedaily.com/releases/2026/06/260603015356.htm,2026-06-13T03:24:09+00:00
ScienceDaily,https://www.sciencedaily.com/,science,31,Scientists Discovered Something Surprising About French Fries and Diabetes,https://www.sciencedaily.com/releases/2026/06/260603015218.htm,2026-06-13T03:24:09+00:00
ScienceDaily,https://www.sciencedaily.com/,science,32,Brain Scans Reveal Two Distinct Types of Autism,https://www.sciencedaily.com/releases/2026/06/260602021634.htm,2026-06-13T03:24:09+00:00
ScienceDaily,https://www.sciencedaily.com/,science,33,A Single Protein May Be Holding Back CAR T Cancer Therapy,https://www.sciencedaily.com/releases/2026/06/260602021641.htm,2026-06-13T03:24:09+00:00
ScienceDaily,https://www.sciencedaily.com/,science,34,The Forgotten Organ That Could Predict How Long You Live,https://www.sciencedaily.com/releases/2026/06/260601025352.htm,2026-06-13T03:24:09+00:00
ScienceDaily,https://www.sciencedaily.com/,science,35,Intermittent Fasting Triggers Surprising Changes in the Brain,https://www.sciencedaily.com/releases/2026/05/260530004622.htm,2026-06-13T03:24:09+00:00
ScienceDaily,https://www.sciencedaily.com/,science,36,Hidden Driving Danger When Edible Cannabis and Alcohol Mix,https://www.sciencedaily.com/releases/2026/05/260529043656.htm,2026-06-13T03:24:09+00:00
ScienceDaily,https://www.sciencedaily.com/,science,37,The Deadly Tapeworm Spreading Across America Has Reached the Pacific Northwest,https://www.sciencedaily.com/releases/2026/06/260611024610.htm,2026-06-13T03:24:09+00:00
ScienceDaily,https://www.sciencedaily.com/,science,38,Scientists Discover a Hidden Cause of Aging Cells That Can Be Reversed,https://www.sciencedaily.com/releases/2026/06/260610003119.htm,2026-06-13T03:24:09+00:00
ScienceDaily,https://www.sciencedaily.com/,science,39,That Ringing in Your Ears Could Be an Early Warning Sign of Hearing Loss,https://www.sciencedaily.com/releases/2026/06/260610003116.htm,2026-06-13T03:24:09+00:00
ScienceDaily,https://www.sciencedaily.com/,science,40,Scientists Shut Down Cancer DNA Repair to Overcome Drug Resistance,https://www.sciencedaily.com/releases/2026/06/260610003052.htm,2026-06-13T03:24:09+00:00
ScienceDaily,https://www.sciencedaily.com/,science,41,A Classic Brain Test Exposed AI's Biggest Weakness,https://www.sciencedaily.com/releases/2026/06/260610003049.htm,2026-06-13T03:24:09+00:00
ScienceDaily,https://www.sciencedaily.com/,science,42,Cancer Patients Found a Simple Way to Stay Mentally Sharp During Chemotherapy,https://www.sciencedaily.com/releases/2026/06/260608040019.htm,2026-06-13T03:24:09+00:00
ScienceDaily,https://www.sciencedaily.com/,science,43,Ultra-Processed Foods May Be Stealing Your Focus Even If You Eat Healthy,https://www.sciencedaily.com/releases/2026/06/260608040017.htm,2026-06-13T03:24:09+00:00
ScienceDaily,https://www.sciencedaily.com/,science,44,Scientists Discover Gut Bacteria That May Help Protect Against Autism and ADHD,https://www.sciencedaily.com/releases/2026/06/260602021645.htm,2026-06-13T03:24:09+00:00
ScienceDaily,https://www.sciencedaily.com/,science,45,Sleep Apnea’s Hidden Heart Disease Trigger Found in the Gut,https://www.sciencedaily.com/releases/2026/06/260608040002.htm,2026-06-13T03:24:09+00:00
ScienceDaily,https://www.sciencedaily.com/,science,46,"Tea Can Improve Your Health and Longevity, but the Way You Drink It Matters",https://www.sciencedaily.com/releases/2026/06/260609025534.htm,2026-06-13T03:24:09+00:00
ScienceDaily,https://www.sciencedaily.com/,science,47,Ancient Chinese Medicine Could Transform Hair Loss Treatment,https://www.sciencedaily.com/releases/2026/06/260606015144.htm,2026-06-13T03:24:09+00:00
ScienceDaily,https://www.sciencedaily.com/,science,48,The Supplements Older Adults Actually Need and the Ones They Don't,https://www.sciencedaily.com/releases/2026/06/260605023408.htm,2026-06-13T03:24:09+00:00
ScienceDaily,https://www.sciencedaily.com/,science,49,Scientists Found a Surprisingly Simple Way to Create Powerful Quantum States,https://www.sciencedaily.com/releases/2026/06/260606075510.htm,2026-06-13T03:24:09+00:00
ScienceDaily,https://www.sciencedaily.com/,science,50,Hidden Supermassive Black Hole Pairs May Finally Have a Visible Signal,https://www.sciencedaily.com/releases/2026/06/260605023418.htm,2026-06-13T03:24:09+00:00
ScienceDaily,https://www.sciencedaily.com/,science,51,Scientists Discover a Hidden Quantum World Inside Cobalt,https://www.sciencedaily.com/releases/2026/06/260604044255.htm,2026-06-13T03:24:09+00:00
ScienceDaily,https://www.sciencedaily.com/,science,52,"After 20 Years, Scientists Finally Shrink a Powerful Laser Onto a Chip",https://www.sciencedaily.com/releases/2026/06/260604044240.htm,2026-06-13T03:24:09+00:00
ScienceDaily,https://www.sciencedaily.com/,science,53,This Strange New Phase of Matter Could Transform Quantum Technology,https://www.sciencedaily.com/releases/2026/05/260529043638.htm,2026-06-13T03:24:09+00:00
ScienceDaily,https://www.sciencedaily.com/,science,54,Twisted Graphene Reveals a Hidden Superconductivity Switch,https://www.sciencedaily.com/releases/2026/05/260528082511.htm,2026-06-13T03:24:09+00:00
ScienceDaily,https://www.sciencedaily.com/,science,55,Scientists Create Global Treasure Map Pointing to Hidden Rare Earth Deposits,https://www.sciencedaily.com/releases/2026/05/260525000450.htm,2026-06-13T03:24:09+00:00
ScienceDaily,https://www.sciencedaily.com/,science,56,Scientists Discover Atoms Suddenly Spinning Backward in Quantum Experiment,https://www.sciencedaily.com/releases/2026/05/260523103903.htm,2026-06-13T03:24:09+00:00
ScienceDaily,https://www.sciencedaily.com/,science,57,New AI Body Map Reveals Obesity’s Hidden Attack on Facial Nerves,https://www.sciencedaily.com/releases/2026/05/260522023308.htm,2026-06-13T03:24:09+00:00
