source,source_url,category,rank,headline,link,collected_at_iso
Healthline,https://www.healthline.com/,health,10,Best Vegan and Plant-Based Meal Delivery for 2025,https://www.healthline.com/nutrition/plant-based-meal-delivery,2026-07-09T17:52:00+00:00
Healthline,https://www.healthline.com/,health,11,Does Medicare Cover Pneumonia Shots?,https://www.healthline.com/health/medicare/does-medicare-cover-pneumonia-shots,2026-07-09T17:52:00+00:00
Healthline,https://www.healthline.com/,health,12,"Chromosomes, Genetics, and Your Health",https://www.healthline.com/health/chromosomes-and-genetics,2026-07-09T17:52:00+00:00
Healthline,https://www.healthline.com/,health,13,Best Multivitamins for Women,https://www.healthline.com/nutrition/multivitamins-womens-health,2026-07-09T17:52:00+00:00
Healthline,https://www.healthline.com/,health,14,Best Multivitamins for Men,https://www.healthline.com/nutrition/best-multivitamins-for-men,2026-07-09T17:52:00+00:00
Healthline,https://www.healthline.com/,health,15,Best Online Therapy Services,https://www.healthline.com/health/our-top-10-online-therapy-picks,2026-07-09T17:52:00+00:00
Healthline,https://www.healthline.com/,health,16,Online Therapy That Takes Insurance,https://www.healthline.com/health/mental-health/online-therapy-that-takes-insurance,2026-07-09T17:52:00+00:00
Healthline,https://www.healthline.com/,health,17,Buy Ozempic Online,https://www.healthline.com/nutrition/buy-ozempic-online,2026-07-09T17:52:00+00:00
Healthline,https://www.healthline.com/,health,18,Through an Artist's Eye,https://www.healthline.com/health/breast-cancer/metastatic-breast-cancer-artist-eye,2026-07-09T17:52:00+00:00
Healthline,https://www.healthline.com/,health,19,A Fitness Expert Reviews Cristiano Ronaldo’s Workout: How to Adapt It,https://www.healthline.com/health/fitness/cristiano-ronaldo-workout,2026-07-09T17:52:00+00:00
Healthline,https://www.healthline.com/,health,20,The Best Cooling Products Helping Me Weather 110-Degree Summers,https://www.healthline.com/health/best-cooling-products,2026-07-09T17:52:00+00:00
Healthline,https://www.healthline.com/,health,21,Can GLP-1s Slow Aging?,https://www.healthline.com/health/drugs/glp-1-anti-aging-and-longevity-benefits,2026-07-09T17:52:00+00:00
Healthline,https://www.healthline.com/,health,22,‘Explosive Diarrhea Parasite’ in 17 States: How to Reduce Your Risk,https://www.healthline.com/health-news/cdc-warns-explosive-diarrhea-parasite-protect-yourself,2026-07-09T17:52:00+00:00
Healthline Fitness,https://www.healthline.com/fitness,health,1,How Well Do You Sleep?,https://www.healthline.com/health/healthy-sleep/quiz-how-well-do-you-sleep,2026-07-09T17:52:00+00:00
Healthline Fitness,https://www.healthline.com/fitness,health,2,Are You a Workaholic?,https://www.healthline.com/health/mental-health/quiz-are-you-a-workaholic,2026-07-09T17:52:00+00:00
Healthline Fitness,https://www.healthline.com/fitness,health,3,5 Tips for a Healthy Lifestyle,https://www.healthline.com/health/fitness-nutrition/healthy-lifestyle-benefits,2026-07-09T17:52:00+00:00
Healthline Fitness,https://www.healthline.com/fitness,health,4,How to Disinfect Your House After the Flu,https://www.healthline.com/health/flu/how-to-disinfect-house-after-flu,2026-07-09T17:52:00+00:00
Healthline Fitness,https://www.healthline.com/fitness,health,5,Best Vegan and Plant-Based Meal Delivery for 2025,https://www.healthline.com/nutrition/plant-based-meal-delivery,2026-07-09T17:52:00+00:00
Healthline Fitness,https://www.healthline.com/fitness,health,6,Does Medicare Cover Pneumonia Shots?,https://www.healthline.com/health/medicare/does-medicare-cover-pneumonia-shots,2026-07-09T17:52:00+00:00
Healthline Fitness,https://www.healthline.com/fitness,health,7,"Chromosomes, Genetics, and Your Health",https://www.healthline.com/health/chromosomes-and-genetics,2026-07-09T17:52:00+00:00
Healthline Fitness,https://www.healthline.com/fitness,health,8,Best Multivitamins for Women,https://www.healthline.com/nutrition/multivitamins-womens-health,2026-07-09T17:52:00+00:00
Healthline Fitness,https://www.healthline.com/fitness,health,9,Best Multivitamins for Men,https://www.healthline.com/nutrition/best-multivitamins-for-men,2026-07-09T17:52:00+00:00
Healthline Fitness,https://www.healthline.com/fitness,health,10,Best Online Therapy Services,https://www.healthline.com/health/our-top-10-online-therapy-picks,2026-07-09T17:52:00+00:00
Healthline Fitness,https://www.healthline.com/fitness,health,11,Online Therapy That Takes Insurance,https://www.healthline.com/health/mental-health/online-therapy-that-takes-insurance,2026-07-09T17:52:00+00:00
Healthline Fitness,https://www.healthline.com/fitness,health,12,Buy Ozempic Online,https://www.healthline.com/nutrition/buy-ozempic-online,2026-07-09T17:52:00+00:00
Healthline Fitness,https://www.healthline.com/fitness,health,13,Through an Artist's Eye,https://www.healthline.com/health/breast-cancer/metastatic-breast-cancer-artist-eye,2026-07-09T17:52:00+00:00
Healthline Fitness,https://www.healthline.com/fitness,health,14,Welcome to Healthline Fitness: A Letter from the Editor,https://www.healthline.com/health/fitness/welcome-to-healthline-fitness,2026-07-09T17:52:00+00:00
Healthline Fitness,https://www.healthline.com/fitness,health,15,10 Exercises to Tone Every Inch of Your Body,https://www.healthline.com/health/fitness-exercise/10-best-exercises-everyday,2026-07-09T17:52:00+00:00
Healthline Fitness,https://www.healthline.com/fitness,health,16,The Best Core Exercises for All Fitness Levels,https://www.healthline.com/health/best-core-exercises,2026-07-09T17:52:00+00:00
Healthline Fitness,https://www.healthline.com/fitness,health,17,A Beginner’s Guide to Weight Training,https://www.healthline.com/health/how-to-start-lifting-weights,2026-07-09T17:52:00+00:00
Healthline Fitness,https://www.healthline.com/fitness,health,18,How Many Steps Do People Take Per Day on Average?,https://www.healthline.com/health/average-steps-per-day,2026-07-09T17:52:00+00:00
Healthline Fitness,https://www.healthline.com/fitness,health,19,The Benefits of Burpees and How to Do Them,https://www.healthline.com/health/how-to-do-a-burpee,2026-07-09T17:52:00+00:00
Healthline Fitness,https://www.healthline.com/fitness,health,20,Exercises That Burn the Most Calories and How to Get Started,https://www.healthline.com/health/what-exercise-burns-the-most-calories,2026-07-09T17:52:00+00:00
Healthline Fitness,https://www.healthline.com/fitness,health,21,What Muscle Groups Are Best to Work Out Together? Pairings and…,https://www.healthline.com/health/exercise-fitness/muscle-groups-to-workout-together,2026-07-09T17:52:00+00:00
Healthline Fitness,https://www.healthline.com/fitness,health,22,Which Is Better for Your Health: Walking or Running?,https://www.healthline.com/health/walking-vs-running,2026-07-09T17:52:00+00:00
Healthline Fitness,https://www.healthline.com/fitness,health,23,What Is a Runner’s Body? It’s More Than a Look,https://www.healthline.com/health/fitness/runners-body,2026-07-09T17:52:00+00:00
Healthline Fitness,https://www.healthline.com/fitness,health,24,Here’s the Lowdown on How Running Affects Your Knees,https://www.healthline.com/health/fitness/is-running-bad-for-your-knees,2026-07-09T17:52:00+00:00
Healthline Fitness,https://www.healthline.com/fitness,health,25,What Your VO₂ Max Means for Your Health and Benefits of Increasing it,https://www.healthline.com/health/vo2-max,2026-07-09T17:52:00+00:00
Healthline Fitness,https://www.healthline.com/fitness,health,26,The 9 Best Weight Benches,https://www.healthline.com/health/fitness/weight-bench,2026-07-09T17:52:00+00:00
Healthline Fitness,https://www.healthline.com/fitness,health,27,The 25 Best Home Gym Equipment Items,https://www.healthline.com/health/fitness/home-gym-equipment,2026-07-09T17:52:00+00:00
Healthline Fitness,https://www.healthline.com/fitness,health,28,The 5 Best Personal Training Apps,https://www.healthline.com/nutrition/,2026-07-09T17:52:00+00:00
Healthline Fitness,https://www.healthline.com/fitness,health,29,The 9 Best Peloton Bike Alternatives,https://www.healthline.com/nutrition/peloton-bike-alternatives,2026-07-09T17:52:00+00:00
Healthline Fitness,https://www.healthline.com/fitness,health,30,"How to Gain Muscle, No Matter Who You Are",https://www.healthline.com/health/fitness/how-to-gain-muscle,2026-07-09T17:52:00+00:00
Healthline Fitness,https://www.healthline.com/fitness,health,31,"How Much Muscle Mass Should I Have, and How Do I Measure It?",https://www.healthline.com/health/muscle-mass-percentage,2026-07-09T17:52:00+00:00
Healthline Fitness,https://www.healthline.com/fitness,health,32,"Mesomorph Body Type: What It Is, Diet, and More",https://www.healthline.com/health/mesomorph-body-type-diet,2026-07-09T17:52:00+00:00
Healthline Fitness,https://www.healthline.com/fitness,health,33,How to Improve Your Grip Strength,https://www.healthline.com/health/grip-strength,2026-07-09T17:52:00+00:00
Healthline Fitness,https://www.healthline.com/fitness,health,34,Here’s How to Use Yoga for Stress Reduction,https://www.healthline.com/health/fitness/yoga-for-stress,2026-07-09T17:52:00+00:00
Healthline Fitness,https://www.healthline.com/fitness,health,35,Can Yoga Help Aid Digestion? 9 Poses to Try,https://www.healthline.com/nutrition/yoga-posture-for-digestion,2026-07-09T17:52:00+00:00
Healthline Fitness,https://www.healthline.com/fitness,health,36,Pilates vs. Yoga: The Differences and What's Right for You,https://www.healthline.com/health/fitness-exercise/pilates-vs-yoga,2026-07-09T17:52:00+00:00
Healthline Fitness,https://www.healthline.com/fitness,health,37,Health Benefits of Pilates for Older Adults,https://www.healthline.com/health/fitness/pilates-for-seniors,2026-07-09T17:52:00+00:00
Healthline Fitness,https://www.healthline.com/fitness,health,38,13 Ways to Wake Up Faster in the Mornings,https://www.healthline.com/health/morning-fatigue-remedies,2026-07-09T17:52:00+00:00
Healthline Fitness,https://www.healthline.com/fitness,health,39,7 Lower Back Stretches to Reduce Pain and Improve Mobility,https://www.healthline.com/health/lower-back-stretches,2026-07-09T17:52:00+00:00
Healthline Fitness,https://www.healthline.com/fitness,health,40,What Causes Muscle Fatigue?,https://www.healthline.com/health/muscle-fatigue,2026-07-09T17:52:00+00:00
Healthline Fitness,https://www.healthline.com/fitness,health,41,14 Tips to Maximize Muscle Recovery,https://www.healthline.com/health/muscle-recovery,2026-07-09T17:52:00+00:00
Healthline Recent,https://www.healthline.com/directory/recent,health,1,How Well Do You Sleep?,https://www.healthline.com/health/healthy-sleep/quiz-how-well-do-you-sleep,2026-07-09T17:52:00+00:00
Healthline Recent,https://www.healthline.com/directory/recent,health,2,Are You a Workaholic?,https://www.healthline.com/health/mental-health/quiz-are-you-a-workaholic,2026-07-09T17:52:00+00:00
Healthline Recent,https://www.healthline.com/directory/recent,health,3,5 Tips for a Healthy Lifestyle,https://www.healthline.com/health/fitness-nutrition/healthy-lifestyle-benefits,2026-07-09T17:52:00+00:00
Healthline Recent,https://www.healthline.com/directory/recent,health,4,How to Disinfect Your House After the Flu,https://www.healthline.com/health/flu/how-to-disinfect-house-after-flu,2026-07-09T17:52:00+00:00
Healthline Recent,https://www.healthline.com/directory/recent,health,5,Best Vegan and Plant-Based Meal Delivery for 2025,https://www.healthline.com/nutrition/plant-based-meal-delivery,2026-07-09T17:52:00+00:00
Healthline Recent,https://www.healthline.com/directory/recent,health,6,Does Medicare Cover Pneumonia Shots?,https://www.healthline.com/health/medicare/does-medicare-cover-pneumonia-shots,2026-07-09T17:52:00+00:00
Healthline Recent,https://www.healthline.com/directory/recent,health,7,"Chromosomes, Genetics, and Your Health",https://www.healthline.com/health/chromosomes-and-genetics,2026-07-09T17:52:00+00:00
Healthline Recent,https://www.healthline.com/directory/recent,health,8,Best Multivitamins for Women,https://www.healthline.com/nutrition/multivitamins-womens-health,2026-07-09T17:52:00+00:00
Healthline Recent,https://www.healthline.com/directory/recent,health,9,Best Multivitamins for Men,https://www.healthline.com/nutrition/best-multivitamins-for-men,2026-07-09T17:52:00+00:00
Healthline Recent,https://www.healthline.com/directory/recent,health,10,Best Online Therapy Services,https://www.healthline.com/health/our-top-10-online-therapy-picks,2026-07-09T17:52:00+00:00
Healthline Recent,https://www.healthline.com/directory/recent,health,11,Online Therapy That Takes Insurance,https://www.healthline.com/health/mental-health/online-therapy-that-takes-insurance,2026-07-09T17:52:00+00:00
Healthline Recent,https://www.healthline.com/directory/recent,health,12,Buy Ozempic Online,https://www.healthline.com/nutrition/buy-ozempic-online,2026-07-09T17:52:00+00:00
Healthline Recent,https://www.healthline.com/directory/recent,health,13,Through an Artist's Eye,https://www.healthline.com/health/breast-cancer/metastatic-breast-cancer-artist-eye,2026-07-09T17:52:00+00:00
Healthline Recent,https://www.healthline.com/directory/recent,health,14,"These Digestive Health Habits Could Make Weight Loss Easier, Experts Say",https://www.healthline.com/health/digestive-health/digestive-health-habits-for-weight-loss,2026-07-09T17:52:00+00:00
Healthline Recent,https://www.healthline.com/directory/recent,health,15,What to do if your ADHD medication stops working,https://www.healthline.com/health/drugs/what-to-do-if-your-adhd-med-stops-working,2026-07-09T17:52:00+00:00
Healthline Recent,https://www.healthline.com/directory/recent,health,16,Can I Have Energy Drinks on a GLP-1?,https://www.healthline.com/health/drugs/energy-drinks-glp-1,2026-07-09T17:52:00+00:00
Healthline Recent,https://www.healthline.com/directory/recent,health,17,What Are the Benefits of the Mediterranean Diet in Pregnancy?,https://www.healthline.com/health/pregnancy/benefits-of-mediterranean-diet-in-pregnancy,2026-07-09T17:52:00+00:00
Healthline Recent,https://www.healthline.com/directory/recent,health,18,Can Menstrual Cycle Changes be a Symptom of PMOS?,https://www.healthline.com/health/womens-health/can-menstrual-cycle-changes-be-a-symptom-of-pcos-pmos,2026-07-09T17:52:00+00:00
Healthline Recent,https://www.healthline.com/directory/recent,health,19,Is There a Link Between Diabetes and Early Menopause?,https://www.healthline.com/health/menopause/diabetes-and-early-menopause,2026-07-09T17:52:00+00:00
Healthline Recent,https://www.healthline.com/directory/recent,health,20,A Fitness Expert Reviews Cristiano Ronaldo’s Workout: How to Adapt It for You,https://www.healthline.com/health/fitness/cristiano-ronaldo-workout,2026-07-09T17:52:00+00:00
Healthline Recent,https://www.healthline.com/directory/recent,health,21,Feline Dementia: Symptoms and Management,https://www.healthline.com/health/pet-health/feline-dementia-symptoms-and-management,2026-07-09T17:52:00+00:00
Healthline Recent,https://www.healthline.com/directory/recent,health,22,Is CBD Good for Dogs? An Expert Weighs In,https://www.healthline.com/health/pet-health/cbd-for-dogs,2026-07-09T17:52:00+00:00
Healthline Recent,https://www.healthline.com/directory/recent,health,23,I Tried Breathing Exercises for Anxiety Last Month: When Failure Invites Grace,https://www.healthline.com/health/anxiety/i-tried-these-breathing-exercises-for-anxiety,2026-07-09T17:52:00+00:00
Healthline Recent,https://www.healthline.com/directory/recent,health,24,How Long Does QuilliChew ER Last?,https://www.healthline.com/health/drugs/how-long-does-quillichew-er-last,2026-07-09T17:52:00+00:00
Healthline Recent,https://www.healthline.com/directory/recent,health,25,How to Stay Safe at Sports Events If You Have Food Allergies,https://www.healthline.com/health/allergies/food-allergies-at-sports-events,2026-07-09T17:52:00+00:00
Healthline Recent,https://www.healthline.com/directory/recent,health,26,Ask the Advocate: How Do I Manage the Social Impact of C. Diff?,https://www.healthline.com/health/explaining-c-diff-diagnosis,2026-07-09T17:52:00+00:00
Healthline Recent,https://www.healthline.com/directory/recent,health,27,What to Expect on a GLP-1: Personal Experiences,https://www.healthline.com/health/drugs/what-to-expect-on-glp-1-personal-experiences,2026-07-09T17:52:00+00:00
Healthline Recent,https://www.healthline.com/directory/recent,health,28,"The Best 30 Minute Workout Routine for Weight Loss and Muscle Gain, According to a Fitness Expert",https://www.healthline.com/health/fitness/gym-routine-for-fat-loss-and-muscle-gain,2026-07-09T17:52:00+00:00
Healthline Recent,https://www.healthline.com/directory/recent,health,29,Can GLP-1 Medications Slow Down Aging?,https://www.healthline.com/health/drugs/glp-1-anti-aging-and-longevity-benefits,2026-07-09T17:52:00+00:00
Healthline Recent,https://www.healthline.com/directory/recent,health,30,How Much Rapamycin Should I Take to Live Longer?,https://www.healthline.com/health/drugs/rapamycin-dosage-for-longevity-new-research,2026-07-09T17:52:00+00:00
Healthline Recent,https://www.healthline.com/directory/recent,health,31,How to Manage Your Emotions When Your Favorite Sports Team Loses,https://www.healthline.com/health/sports-fan-depression,2026-07-09T17:52:00+00:00
Healthline Recent,https://www.healthline.com/directory/recent,health,32,"Hims Weight Loss 2026: Cost, Pros and Cons, and More",https://www.healthline.com/health/hims-weight-loss,2026-07-09T17:52:00+00:00
Healthline Recent,https://www.healthline.com/directory/recent,health,33,Ask the Expert: How to Manage Nutrition Challenges in Metastatic Gastroesophageal Adenocarcinoma,https://www.healthline.com/health/cancer/gastroesophageal-adenocarcinoma-nutrition-expert,2026-07-09T17:52:00+00:00
Healthline Recent,https://www.healthline.com/directory/recent,health,34,Your Migraine Prevention All-Star Team,https://www.healthline.com/health/migraine/your-migraine-prevention-all-star-team,2026-07-09T17:52:00+00:00
Healthline Recent,https://www.healthline.com/directory/recent,health,35,Foundayo vs. Wegovy: How Do They Compare?,https://www.healthline.com/health/drugs/foundayo-vs-wegovy,2026-07-09T17:52:00+00:00
Healthline Recent,https://www.healthline.com/directory/recent,health,36,The Most Efficient Momcozy Products for On-The-Go Parents in 2026,https://www.healthline.com/health/momcozy,2026-07-09T17:52:00+00:00
Healthline Recent,https://www.healthline.com/directory/recent,health,37,Your FAQs Answered About When C. diff is an Emergency,https://www.healthline.com/health/when-is-c-diff-an-emergency,2026-07-09T17:52:00+00:00
Healthline Recent,https://www.healthline.com/directory/recent,health,38,What to Know About Gut Recovery After a C. diff Infection,https://www.healthline.com/health/c-diff-gut-recovery,2026-07-09T17:52:00+00:00
Healthline Recent,https://www.healthline.com/directory/recent,health,39,Can Stress Cause Fatigue?,https://www.healthline.com/health/can-stress-cause-fatigue,2026-07-09T17:52:00+00:00
Healthline Recent,https://www.healthline.com/directory/recent,health,40,Does Dehydration Cause Fatigue? Symptoms and How to Feel Better Fast,https://www.healthline.com/health/does-dehydration-cause-fatigue,2026-07-09T17:52:00+00:00
Healthline Recent,https://www.healthline.com/directory/recent,health,41,Does High Blood Sugar Make You Tired?,https://www.healthline.com/health/does-high-blood-sugar-make-you-tired,2026-07-09T17:52:00+00:00
Healthline Recent,https://www.healthline.com/directory/recent,health,42,"How Exercise Can Help Boost Energy, Mood, and Self-Esteem",https://www.healthline.com/health/exercise-and-energy,2026-07-09T17:52:00+00:00
Healthline Recent,https://www.healthline.com/directory/recent,health,43,How Long Does Lynparza Stay In Your System?,https://www.healthline.com/health/drugs/how-long-lynparza-stays-in-your-system,2026-07-09T17:52:00+00:00
Healthline Recent,https://www.healthline.com/directory/recent,health,44,Senolytic Drugs for Longevity: How They Work and Why They Matter,https://www.healthline.com/health/drugs/senolytics-drugs,2026-07-09T17:52:00+00:00
Healthline Recent,https://www.healthline.com/directory/recent,health,45,Managing Anxiety When You Identify as LGBTQIA+,https://www.healthline.com/health/mental-health/lgbtq-anxiety,2026-07-09T17:52:00+00:00
Healthline Recent,https://www.healthline.com/directory/recent,health,46,How to Advocate for Yourself During Metastatic Gastroesophageal Adenocarcinoma Treatment,https://www.healthline.com/health/cancer/gastroesophageal-adenocarcinoma-self-advocacy,2026-07-09T17:52:00+00:00
Healthline Recent,https://www.healthline.com/directory/recent,health,47,NAD+ IV Drips: Are They Safe?,https://www.healthline.com/health/drugs/are-nad-iv-drips-safe,2026-07-09T17:52:00+00:00
Healthline Recent,https://www.healthline.com/directory/recent,health,48,Where Does Evenity Get Injected?,https://www.healthline.com/health/drugs/evenity-injection-sites,2026-07-09T17:52:00+00:00
Healthline Recent,https://www.healthline.com/directory/recent,health,49,Test Your Knowledge: Calling Foul on Migraine Myths Quiz,https://www.healthline.com/health/migraine/test-your-knowledge-calling-foul-on-migraine-myths-quiz,2026-07-09T17:52:00+00:00
Healthline Recent,https://www.healthline.com/directory/recent,health,50,How Chronic Illness Changed My Relationship With Productivity,https://www.healthline.com/health/chronic-illness-and-productivity,2026-07-09T17:52:00+00:00
Healthline Recent,https://www.healthline.com/directory/recent,health,51,Introducing the 14-Day Energy Boost Challenge,https://www.healthline.com/health/energy-boost-challenge,2026-07-09T17:52:00+00:00
Healthline Recent,https://www.healthline.com/directory/recent,health,52,You Don’t Have to Be a Soccer Pro to Reap the Health Benefits,https://www.healthline.com/health/fitness/health-benefits-of-soccer,2026-07-09T17:52:00+00:00
Healthline Recent,https://www.healthline.com/directory/recent,health,53,Download: 14-Day Energy Boost Calendar,https://www.healthline.com/health/download-14-day-energy-boost-calendar,2026-07-09T17:52:00+00:00
Healthline Recent,https://www.healthline.com/directory/recent,health,54,Does Wegovy Lower Blood Pressure?,https://www.healthline.com/health/drugs/wegovy-blood-pressure,2026-07-09T17:52:00+00:00
Healthline Recent,https://www.healthline.com/directory/recent,health,55,What Is Cystic Fibrosis?,https://www.healthline.com/health/cystic-fibrosis,2026-07-09T17:52:00+00:00
Healthline Recent,https://www.healthline.com/directory/recent,health,56,"Inluriyo for Breast Cancer: Uses, Side Effects, and Cost",https://www.healthline.com/health/drugs/inluriyo,2026-07-09T17:52:00+00:00
Healthline Recent,https://www.healthline.com/directory/recent,health,57,How Is Forteo Administered?,https://www.healthline.com/health/drugs/how-is-forteo-administered,2026-07-09T17:52:00+00:00
Healthline Recent,https://www.healthline.com/directory/recent,health,58,Exdensur 101: Everything You Need to Know,https://www.healthline.com/health/drugs/exdensur,2026-07-09T17:52:00+00:00
Healthline Recent,https://www.healthline.com/directory/recent,health,59,6 Laundry Habits That Could Be Irritating Your Skin,https://www.healthline.com/health/laundry-habits-that-could-be-irritating-your-skin,2026-07-09T17:52:00+00:00
Healthline Recent,https://www.healthline.com/directory/recent,health,60,Mounjaro: Is Fatigue a Side Effect?,https://www.healthline.com/health/drugs/mounjaro-fatigue,2026-07-09T17:52:00+00:00
Healthline Recent,https://www.healthline.com/directory/recent,health,61,Quiz: How Skin-Friendly Are Your Everyday Habits?,https://www.healthline.com/health/quiz-how-skin-friendly-are-your-everyday-habits,2026-07-09T17:52:00+00:00
Healthline Recent,https://www.healthline.com/directory/recent,health,62,Ask the Expert: How to Care for Changing Mature Skin,https://www.healthline.com/health/ask-the-expert-how-to-care-for-changing-mature-skin,2026-07-09T17:52:00+00:00
Healthline Recent,https://www.healthline.com/directory/recent,health,63,Why Your Laundry Routine Matters More For Skin Health Than You Think,https://www.healthline.com/health/why-your-laundry-routine-matters-more-for-skin-health-than-you-think,2026-07-09T17:52:00+00:00
Healthline Recent,https://www.healthline.com/directory/recent,health,64,Designing Your Expert Playbook: Chronic Migraine Treatment,https://www.healthline.com/health/migraine/designing-your-expert-playbook-chronic-migraine-treatment,2026-07-09T17:52:00+00:00
Healthline Recent,https://www.healthline.com/directory/recent,health,65,Building Your Team: How to Assemble Your Chronic Migraine Care Team,https://www.healthline.com/health/migraine/building-your-team-how-to-assemble-your-chronic-migraine-care-team,2026-07-09T17:52:00+00:00
Healthline Recent,https://www.healthline.com/directory/recent,health,66,"No Shame in Your Game: Stigma Around ""Sitting out"" Due to Chronic Migraine",https://www.healthline.com/health/migraine/no-shame-in-your-game-stigma-around-sitting-out-due-to-chronic-migraine,2026-07-09T17:52:00+00:00
Healthline Recent,https://www.healthline.com/directory/recent,health,67,Zepbound and Insomnia: Why it Happens and What to Do,https://www.healthline.com/health/drugs/does-zepbound-cause-insomnia,2026-07-09T17:52:00+00:00
Healthline Recent,https://www.healthline.com/directory/recent,health,68,Managing Motor Fluctuations: A Deep Dive Into the Onapgo Infusion System,https://www.healthline.com/health/drugs/onapgo,2026-07-09T17:52:00+00:00
Healthline Recent,https://www.healthline.com/directory/recent,health,69,Is Boy Kibble Best Left for Dogs and Not People?,https://www.healthline.com/health/boy-kibble-hacks-and-alternatives,2026-07-09T17:52:00+00:00
