source,source_url,category,rank,headline,link,collected_at_iso
Healthline Recent,https://www.healthline.com/directory/recent,health,185,iHerb's California Gold Nutrition LactoBif Probiotics: Our 2026 Review,https://www.healthline.com/health/california-gold-nutrition-probiotics,2026-07-09T17:52:00+00:00
Healthline Recent,https://www.healthline.com/directory/recent,health,186,8 Best Digestive Enzymes: Evidence-Based Shopping Guide,https://www.healthline.com/health/best-digestive-enzymes,2026-07-09T17:52:00+00:00
Healthline Recent,https://www.healthline.com/directory/recent,health,187,Navigating Depression and Anxiety Medication for Children,https://www.healthline.com/health/drugs/children-depression-anxiety-medication,2026-07-09T17:52:00+00:00
Healthline Recent,https://www.healthline.com/directory/recent,health,188,Social Media and the Effects on Teens,https://www.healthline.com/health/social-media-effects-on-teens,2026-07-09T17:52:00+00:00
Healthline Recent,https://www.healthline.com/directory/recent,health,189,Should I Feed My Cat Wet or Dry Food?,https://www.healthline.com/health/pet-health/should-i-feed-my-cat-wet-or-dry-food,2026-07-09T17:52:00+00:00
Healthline Recent,https://www.healthline.com/directory/recent,health,190,Why Drinking Less Coffee Was Not as Scary As I’d Thought,https://www.healthline.com/health/drinking-less-coffee-tips,2026-07-09T17:52:00+00:00
Healthline Recent,https://www.healthline.com/directory/recent,health,191,"Healthline Reads: Q&amp;A with Daisy Fancourt, Author of 'Art Cure'",https://www.healthline.com/health/healthline-reads-daisy-fancourt-art-cure,2026-07-09T17:52:00+00:00
Healthline Recent,https://www.healthline.com/directory/recent,health,192,5 Best Clear Protein Powders in 2026: Dietitian Approved,https://www.healthline.com/health/best-clear-protein-powder,2026-07-09T17:52:00+00:00
Healthline Recent,https://www.healthline.com/directory/recent,health,193,"Best NMN Supplements in 2026: Anti-Aging, Endurance, and Function",https://www.healthline.com/health/best-nmn-supplements,2026-07-09T17:52:00+00:00
Healthline Recent,https://www.healthline.com/directory/recent,health,194,Is It Safe To Buy Pet Medication Online?,https://www.healthline.com/health/drugs/getting-pet-medication-online,2026-07-09T17:52:00+00:00
Healthline Recent,https://www.healthline.com/directory/recent,health,195,Does Running Make Your Waist Bigger? The Truth Behind the “Runner’s Waist” Myth,https://www.healthline.com/health/runners-waist,2026-07-09T17:52:00+00:00
Healthline Recent,https://www.healthline.com/directory/recent,health,196,Your FAQs Answered About Aortic Stenosis,https://www.healthline.com/health/faqs-about-aortic-stenosis-answered,2026-07-09T17:52:00+00:00
Healthline Recent,https://www.healthline.com/directory/recent,health,197,What Is Aortic Stenosis and Should I Be Tested? Expert Answers,https://www.healthline.com/health/aortic-stenosis-should-i-be-tested-expert-answers,2026-07-09T17:52:00+00:00
Healthline Recent,https://www.healthline.com/directory/recent,health,198,Ask the Expert: What to Do After an Aortic Stenosis Diagnosis,https://www.healthline.com/health/what-to-do-after-aortic-stenosis-diagnosis,2026-07-09T17:52:00+00:00
Healthline Recent,https://www.healthline.com/directory/recent,health,199,What Does ‘Regulating Your Nervous System’ Actually Mean? A Doctor Breaks It Down,https://www.healthline.com/health/mental-health/expert-explains-nervous-system-regulation,2026-07-09T17:52:00+00:00
Healthline Recent,https://www.healthline.com/directory/recent,health,200,"How Your Fitness Routine Should Change with Age, According to Fitness Expert",https://www.healthline.com/health/fitness-and-exercise/how-your-fitness-routine-should-change-with-age,2026-07-09T17:52:00+00:00
Healthline Recent,https://www.healthline.com/directory/recent,health,201,Is a Raw Food Diet Safe for Dogs?,https://www.healthline.com/health/pet-health/is-a-raw-food-diet-safe-for-dogs,2026-07-09T17:52:00+00:00
Healthline Recent,https://www.healthline.com/directory/recent,health,202,California Gold Nutrition Creatine Monohydrate by iHerb: All About the Popular Supplement,https://www.healthline.com/health/california-gold-creatine,2026-07-09T17:52:00+00:00
Healthline Recent,https://www.healthline.com/directory/recent,health,203,The Best Supplements to Support GLP-1 Medications,https://www.healthline.com/health/best-supplements-to-support-glp-1s,2026-07-09T17:52:00+00:00
Healthline Recent,https://www.healthline.com/directory/recent,health,204,"Chicken Salad Lettuce Wraps with Grapes, Avocado, and Almonds",https://www.healthline.com/health/chicken-salad-lettuce-wraps-with-grapes-avocado-and-almonds,2026-07-09T17:52:00+00:00
Healthline Recent,https://www.healthline.com/directory/recent,health,205,Everything You Need to Know About Non-Small Cell Lung Cancer (NSCLC),https://www.healthline.com/health/lung-cancer-non-small-cell,2026-07-09T17:52:00+00:00
Healthline Recent,https://www.healthline.com/directory/recent,health,206,How To Manage Diabetes in Dogs,https://www.healthline.com/health/pet-health/diabetes-in-dogs,2026-07-09T17:52:00+00:00
Healthline Recent,https://www.healthline.com/directory/recent,health,207,A Guide to Treating and Preventing Heartworm Disease in Dogs,https://www.healthline.com/health/pet-health/heartworm-disease-in-dogs,2026-07-09T17:52:00+00:00
Healthline Recent,https://www.healthline.com/directory/recent,health,208,Ozempic and PCOS: Myths vs. Facts,https://www.healthline.com/health/drugs/ozempic-and-pcos,2026-07-09T17:52:00+00:00
Healthline Recent,https://www.healthline.com/directory/recent,health,209,"Alprazolam for Dogs: A Complete Guide to Usage, Dosage, and Safety",https://www.healthline.com/health/drugs/alprazolam-for-dogs,2026-07-09T17:52:00+00:00
Healthline Recent,https://www.healthline.com/directory/recent,health,210,Stress Hack: Vagus Nerve Stimulators Are Worth The Hype,https://www.healthline.com/health/at-home-vagus-nerve-stimulator-review,2026-07-09T17:52:00+00:00
Healthline Recent,https://www.healthline.com/directory/recent,health,211,What Are Symptoms of Recurrent Pericarditis?,https://www.healthline.com/health/what-are-symptoms-of-recurrent-pericarditis,2026-07-09T17:52:00+00:00
Healthline Recent,https://www.healthline.com/directory/recent,health,212,What Is Recurrent Pericarditis?,https://www.healthline.com/health/what-is-recurrent-pericarditis,2026-07-09T17:52:00+00:00
Healthline Nutrition,https://www.healthline.com/nutrition,health,1,How Well Do You Sleep?,https://www.healthline.com/health/healthy-sleep/quiz-how-well-do-you-sleep,2026-07-09T17:52:00+00:00
Healthline Nutrition,https://www.healthline.com/nutrition,health,2,Are You a Workaholic?,https://www.healthline.com/health/mental-health/quiz-are-you-a-workaholic,2026-07-09T17:52:00+00:00
Healthline Nutrition,https://www.healthline.com/nutrition,health,3,5 Tips for a Healthy Lifestyle,https://www.healthline.com/health/fitness-nutrition/healthy-lifestyle-benefits,2026-07-09T17:52:00+00:00
Healthline Nutrition,https://www.healthline.com/nutrition,health,4,How to Disinfect Your House After the Flu,https://www.healthline.com/health/flu/how-to-disinfect-house-after-flu,2026-07-09T17:52:00+00:00
Healthline Nutrition,https://www.healthline.com/nutrition,health,5,Best Vegan and Plant-Based Meal Delivery for 2025,https://www.healthline.com/nutrition/plant-based-meal-delivery,2026-07-09T17:52:00+00:00
Healthline Nutrition,https://www.healthline.com/nutrition,health,6,Does Medicare Cover Pneumonia Shots?,https://www.healthline.com/health/medicare/does-medicare-cover-pneumonia-shots,2026-07-09T17:52:00+00:00
Healthline Nutrition,https://www.healthline.com/nutrition,health,7,"Chromosomes, Genetics, and Your Health",https://www.healthline.com/health/chromosomes-and-genetics,2026-07-09T17:52:00+00:00
Healthline Nutrition,https://www.healthline.com/nutrition,health,8,Best Multivitamins for Women,https://www.healthline.com/nutrition/multivitamins-womens-health,2026-07-09T17:52:00+00:00
Healthline Nutrition,https://www.healthline.com/nutrition,health,9,Best Multivitamins for Men,https://www.healthline.com/nutrition/best-multivitamins-for-men,2026-07-09T17:52:00+00:00
Healthline Nutrition,https://www.healthline.com/nutrition,health,10,Best Online Therapy Services,https://www.healthline.com/health/our-top-10-online-therapy-picks,2026-07-09T17:52:00+00:00
Healthline Nutrition,https://www.healthline.com/nutrition,health,11,Online Therapy That Takes Insurance,https://www.healthline.com/health/mental-health/online-therapy-that-takes-insurance,2026-07-09T17:52:00+00:00
Healthline Nutrition,https://www.healthline.com/nutrition,health,12,Buy Ozempic Online,https://www.healthline.com/nutrition/buy-ozempic-online,2026-07-09T17:52:00+00:00
Healthline Nutrition,https://www.healthline.com/nutrition,health,13,Through an Artist's Eye,https://www.healthline.com/health/breast-cancer/metastatic-breast-cancer-artist-eye,2026-07-09T17:52:00+00:00
Healthline Nutrition,https://www.healthline.com/nutrition,health,14,Feel Good Food,https://www.healthline.com/nutrition/feel-good-food,2026-07-09T17:52:00+00:00
Healthline Nutrition,https://www.healthline.com/nutrition,health,15,Vitamins & Supplements,https://www.healthline.com/nutrition/vitamins-and-supplements,2026-07-09T17:52:00+00:00
Healthline Nutrition,https://www.healthline.com/nutrition,health,16,Eat It or Leave It? A Comprehensive Ingredient Dictionary to Simplify Your Shopping Trip,https://www.healthline.com/nutrition/eat-it-or-leave-it-a-comprehensive-ingredient-dictionary-to-simplify-your-shopping-trip,2026-07-09T17:52:00+00:00
Healthline Nutrition,https://www.healthline.com/nutrition,health,17,Healthy Eating Refresh: Letter from the Editor,https://www.healthline.com/nutrition/healthy-eating-refresh-letter-from-the-editor,2026-07-09T17:52:00+00:00
Healthline Nutrition,https://www.healthline.com/nutrition,health,18,Get Your Vitamin P: Why Pleasure Matters When It Comes to What You Eat,https://www.healthline.com/nutrition/get-your-vitamin-p-why-pleasure-matters-when-it-comes-to-what-you-eat,2026-07-09T17:52:00+00:00
Healthline Nutrition,https://www.healthline.com/nutrition,health,19,10 Ways to Lower Your Grocery Bill as Prices Increase,https://www.healthline.com/nutrition/lower-grocery-bill-inflation,2026-07-09T17:52:00+00:00
Healthline Nutrition,https://www.healthline.com/nutrition,health,20,15 Staple Foods to Make Healthy Eating Easy All Week Long,https://www.healthline.com/nutrition/staple-foods-to-make-healthy-eating-easy-all-week-long,2026-07-09T17:52:00+00:00
Healthline Nutrition,https://www.healthline.com/nutrition,health,21,The Definitive Guide to Healthy Eating in Real Life,https://www.healthline.com/nutrition/how-to-eat-healthy-guide,2026-07-09T17:52:00+00:00
Healthline Nutrition,https://www.healthline.com/nutrition,health,22,How to Stock Your Pantry for Quick & Easy Meals in Minutes,https://www.healthline.com/nutrition/how-to-stock-your-pantry-for-quick-easy-meals-in-minutes,2026-07-09T17:52:00+00:00
Healthline Nutrition,https://www.healthline.com/nutrition,health,23,"Plant-based Protein: The Best, the Worst, and Everything In Between",https://www.healthline.com/nutrition/plant-based-protein-the-best-the-worst-and-everything-in-between,2026-07-09T17:52:00+00:00
Healthline Nutrition,https://www.healthline.com/nutrition,health,24,The Definitive Guide to Healthy Grocery Shopping,https://www.healthline.com/nutrition/healthy-grocery-shopping-guide,2026-07-09T17:52:00+00:00
Healthline Nutrition,https://www.healthline.com/nutrition,health,25,Try it or Toss it? The Supplements You Need and the Ones You Can Skip,https://www.healthline.com/nutrition/try-it-or-toss-it-the-supplements-you-need-and-the-ones-you-can-skip,2026-07-09T17:52:00+00:00
Healthline Nutrition,https://www.healthline.com/nutrition,health,26,"How to Find Wisdom in Food Cravings, Plus 7 Ways to Make Peace With…",https://www.healthline.com/nutrition/finding-the-wisdom-in-food-cravings-plus-tk-techniques-to-make-peace-with-them,2026-07-09T17:52:00+00:00
Healthline Nutrition,https://www.healthline.com/nutrition,health,27,How to Ditch Diet Culture and Learn to Trust Your Body’s Cues,https://www.healthline.com/nutrition/what-is-food-freedom-getting-started-weight-loss-and-tips,2026-07-09T17:52:00+00:00
Healthline Nutrition,https://www.healthline.com/nutrition,health,28,"Dear Fat, Black Girls Who Were Not Spared from Diet Culture—I…",https://www.healthline.com/health/diet-culture-affects-fat-black-women,2026-07-09T17:52:00+00:00
Healthline Nutrition,https://www.healthline.com/nutrition,health,29,The Dangers of Diet Culture: 10 Women Share How Toxic It Is,https://www.healthline.com/health/mental-health/diet-culture,2026-07-09T17:52:00+00:00
Healthline Nutrition,https://www.healthline.com/nutrition,health,30,12 High Carb Foods That Are Incredibly Healthy,https://www.healthline.com/nutrition/12-healthy-high-carb-foods,2026-07-09T17:52:00+00:00
Healthline Nutrition,https://www.healthline.com/nutrition,health,31,"9 Tips for Joyful, Balanced Eating from Divya's Ayurvedic Kitchen",https://www.healthline.com/nutrition/tips-for-finding-balance-and-joy-through-food-from-divyas-ayurvedic-kitchen,2026-07-09T17:52:00+00:00
Healthline Nutrition,https://www.healthline.com/nutrition,health,32,"Vegan Teen Chef Tabay Atkins on Healthy, Heart-Based Eating",https://www.healthline.com/nutrition/vegan-teen-chef-tabay-atkins-on-healthy-heart-based-eating,2026-07-09T17:52:00+00:00
Healthline Nutrition,https://www.healthline.com/nutrition,health,33,How to Be an Ethical Omnivore,https://www.healthline.com/nutrition/ethical-omnivore,2026-07-09T17:52:00+00:00
Healthline Nutrition,https://www.healthline.com/nutrition,health,34,Is BMI a Fair Health Metric for Black Women?,https://www.healthline.com/nutrition/bmi-for-black-women,2026-07-09T17:52:00+00:00
Healthline Nutrition,https://www.healthline.com/nutrition,health,35,How Long Does It Take to Lose Weight?,https://www.healthline.com/nutrition/how-long-does-it-take-to-lose-weight,2026-07-09T17:52:00+00:00
Healthline Nutrition,https://www.healthline.com/nutrition,health,36,Omega-3 Supplement Guide,https://www.healthline.com/nutrition/omega-3-supplement-guide,2026-07-09T17:52:00+00:00
Healthline Nutrition,https://www.healthline.com/nutrition,health,37,The 15 Best Supplements to Boost Your Immune System Right Now,https://www.healthline.com/nutrition/immune-boosting-supplements,2026-07-09T17:52:00+00:00
Healthline Nutrition,https://www.healthline.com/nutrition,health,38,8 Best Vitamin D Supplements for Optimal Absorption: Reviewed by…,https://www.healthline.com/nutrition/best-vitamin-d-supplements,2026-07-09T17:52:00+00:00
Healthline Nutrition,https://www.healthline.com/nutrition,health,39,Can Vitamin D Lower Your Risk of COVID-19?,https://www.healthline.com/nutrition/vitamin-d-coronavirus,2026-07-09T17:52:00+00:00
Healthline Nutrition,https://www.healthline.com/nutrition,health,40,"5 Best Fish Oil Supplements to Boost Your Omega-3s in 2026, According…",https://www.healthline.com/nutrition/best-fish-oil-supplement,2026-07-09T17:52:00+00:00
Healthline Nutrition,https://www.healthline.com/nutrition,health,41,"3 Best Personalized Vitamins in 2026, According to Dietitians",https://www.healthline.com/nutrition/personalized-vitamins,2026-07-09T17:52:00+00:00
Healthline Nutrition,https://www.healthline.com/nutrition,health,42,The 17 Best Foods for High Blood Pressure,https://www.healthline.com/nutrition/foods-high-blood-pressure,2026-07-09T17:52:00+00:00
Healthline Nutrition,https://www.healthline.com/nutrition,health,43,The 13 Most Anti-Inflammatory Foods You Can Eat,https://www.healthline.com/nutrition/13-anti-inflammatory-foods,2026-07-09T17:52:00+00:00
Healthline Nutrition,https://www.healthline.com/nutrition,health,44,"Hashimoto Diet: Overview, Foods, Supplements, and Tips",https://www.healthline.com/nutrition/hashimoto-diet,2026-07-09T17:52:00+00:00
Healthline Nutrition,https://www.healthline.com/nutrition,health,45,18 of the Best Non-Perishables for People with Diabetes,https://www.healthline.com/nutrition/non-perishables-for-people-with-diabetes,2026-07-09T17:52:00+00:00
Healthline Nutrition,https://www.healthline.com/nutrition,health,46,Foods and Beverages to Avoid with Arthritis,https://www.healthline.com/nutrition/foods-to-avoid-arthritis,2026-07-09T17:52:00+00:00
Healthline Nutrition,https://www.healthline.com/nutrition,health,47,How to Follow a Vestibular Migraine Diet,https://www.healthline.com/nutrition/vestibular-migraine-diet,2026-07-09T17:52:00+00:00
Healthline Nutrition,https://www.healthline.com/nutrition,health,48,Reflecting on the Intersection of Veganism and Blackness During Black…,https://www.healthline.com/nutrition/reflecting-on-the-intersection-of-veganism-and-blackness-2,2026-07-09T17:52:00+00:00
Healthline Nutrition,https://www.healthline.com/nutrition,health,49,How to Build a Balanced Caribbean Meal,https://www.healthline.com/nutrition/balanced-caribbean-meal,2026-07-09T17:52:00+00:00
Healthline Nutrition,https://www.healthline.com/nutrition,health,50,I’m a Black Dietitian — Here’s What I Want You to Know About Food and…,https://www.healthline.com/health/food-nutrition/black-dietician-food-and-racism,2026-07-09T17:52:00+00:00
Healthline Nutrition,https://www.healthline.com/nutrition,health,51,Welcome to Healthline Nutrition: A Letter from the Editor,https://www.healthline.com/nutrition/welcome-to-nutrition-editor-letter,2026-07-09T17:52:00+00:00
Healthline Nutrition,https://www.healthline.com/nutrition,health,52,I’m a Dietitian with Hashimoto’s Disease — Here’s My Story,https://www.healthline.com/nutrition/im-a-dietitian-living-with-hashimotos-disease,2026-07-09T17:52:00+00:00
Healthline Nutrition,https://www.healthline.com/nutrition,health,53,What’s the Difference Between a Dietitian and a Nutritionist?,https://www.healthline.com/nutrition/dietitian-vs-nutritionist,2026-07-09T17:52:00+00:00
Healthline Nutrition,https://www.healthline.com/nutrition,health,54,Cultural Competence in Nutrition and Dietetics: What We Need to Know,https://www.healthline.com/nutrition/cultural-competence-in-dietetics,2026-07-09T17:52:00+00:00
Healthline Nutrition,https://www.healthline.com/nutrition,health,55,5 Types of Eco-Friendly Food Packaging (and 3 to Avoid),https://www.healthline.com/nutrition/eco-friendly-food-packaging,2026-07-09T17:52:00+00:00
Healthline Nutrition,https://www.healthline.com/nutrition,health,56,How to Start Composting at Home,https://www.healthline.com/nutrition/composting-beginners-guide,2026-07-09T17:52:00+00:00
Healthline Nutrition,https://www.healthline.com/nutrition,health,57,"Beginner’s Guide to A Whole-Foods, Plant-Based Diet",https://www.healthline.com/nutrition/plant-based-diet-guide,2026-07-09T17:52:00+00:00
Healthline Nutrition,https://www.healthline.com/nutrition,health,58,Can You Follow an Eco-Friendly Diet and Still Eat Meat?,https://www.healthline.com/nutrition/eco-friendly-meat-eating,2026-07-09T17:52:00+00:00
Healthline Nutrition,https://www.healthline.com/nutrition,health,59,Palm Oil’s Environmental Impact: Can It Be Grown Sustainably?,https://www.healthline.com/nutrition/palm-oil-deforestation,2026-07-09T17:52:00+00:00
Healthline Nutrition,https://www.healthline.com/nutrition,health,60,Nutrition in Daily Life: A Trinbagonian Dietitian's Journey,https://www.healthline.com/nutrition/nutrition-in-daily-life,2026-07-09T17:52:00+00:00
TOI Life & Style,https://timesofindia.indiatimes.com/life-style,lifestyle,1,What is the source of income for Harry and Meghan and what's their net worth in 2026?,https://timesofindia.indiatimes.com/articleshow/132278866.cms,2026-07-09T17:52:00+00:00
TOI Life & Style,https://timesofindia.indiatimes.com/life-style,lifestyle,2,World War II veteran celebrates 105th birthday—and shares the longevity habits behind her remarkable life,https://timesofindia.indiatimes.com/articleshow/132261210.cms,2026-07-09T17:52:00+00:00
TOI Life & Style,https://timesofindia.indiatimes.com/life-style,lifestyle,3,"Katrina Kaif is away from social media for over a month, and it is silently giving us major lessons on how to be a mom away from social media",https://timesofindia.indiatimes.com/articleshow/132259384.cms,2026-07-09T17:52:00+00:00
TOI Life & Style,https://timesofindia.indiatimes.com/life-style,lifestyle,4,"Inspiring quote of the day by Lionel Messi: “You can overcome something, if and only if...""",https://timesofindia.indiatimes.com/articleshow/132256755.cms,2026-07-09T17:52:00+00:00
TOI Life & Style,https://timesofindia.indiatimes.com/life-style,lifestyle,5,"Woman's appendix removed, but she only had food poisoning",https://timesofindia.indiatimes.com/articleshow/131905221.cms,2026-07-09T17:52:00+00:00
TOI Life & Style,https://timesofindia.indiatimes.com/life-style,lifestyle,6,Krispy Kreme issues urgent recall of World Cup doughnuts,https://timesofindia.indiatimes.com/articleshow/131904045.cms,2026-07-09T17:52:00+00:00
TOI Life & Style,https://timesofindia.indiatimes.com/life-style,lifestyle,7,British mother of three sheds 14st without exercise,https://timesofindia.indiatimes.com/articleshow/131890667.cms,2026-07-09T17:52:00+00:00
TOI Life & Style,https://timesofindia.indiatimes.com/life-style,lifestyle,8,This pre-bed snack could be ruining your sleep,https://timesofindia.indiatimes.com/articleshow/131886782.cms,2026-07-09T17:52:00+00:00
TOI Life & Style,https://timesofindia.indiatimes.com/life-style,lifestyle,9,Zendaya looks straight out of Greek mythology in a dramatic white Louis Vuitton gown for The Odyssey Paris premiere,https://timesofindia.indiatimes.com/articleshow/132280276.cms,2026-07-09T17:52:00+00:00
TOI Life & Style,https://timesofindia.indiatimes.com/life-style,lifestyle,10,"Anna Wintour, Fan Bingbing attend as Manish Malhotra makes a historic Paris Couture debut with 'Maa'",https://timesofindia.indiatimes.com/articleshow/132276461.cms,2026-07-09T17:52:00+00:00
TOI Life & Style,https://timesofindia.indiatimes.com/life-style,lifestyle,11,Dehradun designer calls out Sabyasachi for copying her 2017 designs,https://timesofindia.indiatimes.com/articleshow/132265976.cms,2026-07-09T17:52:00+00:00
TOI Life & Style,https://timesofindia.indiatimes.com/life-style,lifestyle,12,"Scientists create smartwatch-like plant wearables that let farmers monitor crops in real time, detecting drought, disease and nutrient problems days before plants show visible signs of stress",https://timesofindia.indiatimes.com/articleshow/132294893.cms,2026-07-09T17:52:00+00:00
TOI Life & Style,https://timesofindia.indiatimes.com/life-style,lifestyle,13,"One Walmart heiress owns a $300 million superyacht, while her billionaire sister owns a Texas ranch 13 times the size of Washington DC, where helicopters herd cattle",https://timesofindia.indiatimes.com/articleshow/132291307.cms,2026-07-09T17:52:00+00:00
TOI Life & Style,https://timesofindia.indiatimes.com/life-style,lifestyle,14,"He manages a $1.4 trillion empire and wears a $140 Swiss watch. Now Stephen Schwarzman has a $400 million superyacht with a glass-bottom pool, helipad and fold-down balconies",https://timesofindia.indiatimes.com/articleshow/132289821.cms,2026-07-09T17:52:00+00:00
TOI Life & Style,https://timesofindia.indiatimes.com/life-style,lifestyle,15,This content creator says you don't need to quit your 9-to-5 to travel the world - here's how,https://timesofindia.indiatimes.com/articleshow/132290762.cms,2026-07-09T17:52:00+00:00
TOI Life & Style,https://timesofindia.indiatimes.com/life-style,lifestyle,16,"Cab driver says, ‘I'm not your servant’ after passenger lights cigarette mid-ride; internet is split",https://timesofindia.indiatimes.com/articleshow/132288504.cms,2026-07-09T17:52:00+00:00
TOI Life & Style,https://timesofindia.indiatimes.com/life-style,lifestyle,17,"What guests left behind at this ₹1.05 crore Airbnb has the internet asking, ‘Where does basic courtesy end?’",https://timesofindia.indiatimes.com/articleshow/132285840.cms,2026-07-09T17:52:00+00:00
TOI Life & Style,https://timesofindia.indiatimes.com/life-style,lifestyle,18,Monsoon demands extra attention for children: The after-school routine every parent should follow,https://timesofindia.indiatimes.com/articleshow/132287724.cms,2026-07-09T17:52:00+00:00
TOI Life & Style,https://timesofindia.indiatimes.com/life-style,lifestyle,19,What is IGCSE? How it is different from CBSE and ICSE; factors parents should consider before choosing it for their child,https://timesofindia.indiatimes.com/articleshow/132285921.cms,2026-07-09T17:52:00+00:00
TOI Life & Style,https://timesofindia.indiatimes.com/life-style,lifestyle,20,The schools Silicon Valley parents are choosing for their children have less to do with technology: Experts explain why it matters for the future,https://timesofindia.indiatimes.com/articleshow/132280135.cms,2026-07-09T17:52:00+00:00
TOI Life & Style,https://timesofindia.indiatimes.com/life-style,lifestyle,21,10 Gen Alpha words every parent should know in 2026,https://timesofindia.indiatimes.com/articleshow/132277517.cms,2026-07-09T17:52:00+00:00
TOI Life & Style,https://timesofindia.indiatimes.com/life-style,lifestyle,22,What the Dalai Lama says is the hidden engine behind every success story (most of us overlook it in the rush of life),https://timesofindia.indiatimes.com/articleshow/132280586.cms,2026-07-09T17:52:00+00:00
TOI Life & Style,https://timesofindia.indiatimes.com/life-style,lifestyle,23,"Quote of the day by Sadhguru: ""Don't do anything which you will be ashamed tomorrow""; What the yogi and mystic advises on making conscious choices that we do not regret in future",https://timesofindia.indiatimes.com/articleshow/132275622.cms,2026-07-09T17:52:00+00:00
