source,source_url,category,rank,headline,link,collected_at_iso
TOI Life & Style,https://timesofindia.indiatimes.com/life-style,lifestyle,15,A dad’s visit to the women’s washroom with his little daughters turned controversial after another man called the police: Who do you think was right?,https://timesofindia.indiatimes.com/articleshow/132090274.cms,2026-07-01T03:29:40+00:00
TOI Life & Style,https://timesofindia.indiatimes.com/life-style,lifestyle,16,"Quote of the day by Sri Sri Ravi Shankar: “Sometimes people ask why bad things happen to good people. You are good today, but you don’t know what you did yesterday”; What Gurudev advises on learning during hard times",https://timesofindia.indiatimes.com/articleshow/132105113.cms,2026-07-01T03:29:40+00:00
TOI Life & Style,https://timesofindia.indiatimes.com/life-style,lifestyle,17,"Rath Yatra 2026: Why do Lord Jagannath and his siblings fall ill for 15 days during 'Anasara' before he gives divine darshan to his devotees? All about the period when the deities are 'healing,' just like human beings",https://timesofindia.indiatimes.com/articleshow/132085948.cms,2026-07-01T03:29:40+00:00
TOI Life & Style,https://timesofindia.indiatimes.com/life-style,lifestyle,18,"Quote of the day by BK Shivani: “People feel we are wrong, people talk ill about us, people create obstacles in our path. Share your perspective, but you do not need to prove yourself. Truth does not need to be proven; truth has the power to reveal itself”",https://timesofindia.indiatimes.com/articleshow/132082839.cms,2026-07-01T03:29:40+00:00
TOI Life & Style,https://timesofindia.indiatimes.com/life-style,lifestyle,19,Quote of the day by Neem Karoli Baba: “Attachment is the strongest block to realisation”; What Maharaj ji says about being too 'attached' to life's detours,https://timesofindia.indiatimes.com/articleshow/132062736.cms,2026-07-01T03:29:40+00:00
TOI Life & Style,https://timesofindia.indiatimes.com/life-style,lifestyle,20,Dr Vikas Satwik,https://timesofindia.indiatimes.com/articleshow/132096166.cms,2026-07-01T03:29:40+00:00
TOI Life & Style,https://timesofindia.indiatimes.com/life-style,lifestyle,21,Plants That Attract Snakes,https://timesofindia.indiatimes.com/articleshow/132030224.cms,2026-07-01T03:29:40+00:00
TOI Life & Style,https://timesofindia.indiatimes.com/life-style,lifestyle,22,Google Office Life,https://timesofindia.indiatimes.com/articleshow/132094286.cms,2026-07-01T03:29:40+00:00
TOI Life & Style,https://timesofindia.indiatimes.com/life-style,lifestyle,23,Kiran Mazumdar Shaw,https://timesofindia.indiatimes.com/articleshow/132047470.cms,2026-07-01T03:29:40+00:00
TOI Life & Style,https://timesofindia.indiatimes.com/life-style,lifestyle,24,"If doctors wrote prescriptions for themselves, here's what would be on them",https://timesofindia.indiatimes.com/articleshow/132087805.cms,2026-07-01T03:29:40+00:00
TOI Life & Style,https://timesofindia.indiatimes.com/life-style,lifestyle,25,The great kitchen reset: Why a growing number of Indians are reassessing daily food habits to stay healthier for longer,https://timesofindia.indiatimes.com/articleshow/132101345.cms,2026-07-01T03:29:40+00:00
TOI Life & Style,https://timesofindia.indiatimes.com/life-style,lifestyle,26,"She replaced regular meals with concentrated vegetable juices to lose weight; Three months later, she developed acute kidney injury",https://timesofindia.indiatimes.com/articleshow/132097306.cms,2026-07-01T03:29:40+00:00
TOI Life & Style,https://timesofindia.indiatimes.com/life-style,lifestyle,27,"Meet Aarya, Indian-origin toddler set to become the youngest...",https://timesofindia.indiatimes.com/articleshow/132046230.cms,2026-07-01T03:29:40+00:00
TOI Life & Style,https://timesofindia.indiatimes.com/life-style,lifestyle,28,Psychology says people who clean immediately after guests le...,https://timesofindia.indiatimes.com/articleshow/131934920.cms,2026-07-01T03:29:40+00:00
TOI Life & Style,https://timesofindia.indiatimes.com/life-style,lifestyle,29,"Quote of the day by Sadhguru: “In any arena of life, no one ...",https://timesofindia.indiatimes.com/articleshow/132045030.cms,2026-07-01T03:29:40+00:00
TOI Life & Style,https://timesofindia.indiatimes.com/life-style,lifestyle,30,Psychology says people who over-thank for small favors may n...,https://timesofindia.indiatimes.com/articleshow/131965416.cms,2026-07-01T03:29:40+00:00
TOI Life & Style,https://timesofindia.indiatimes.com/life-style,lifestyle,31,Psychology suggests that parents who keep offering help to t...,https://timesofindia.indiatimes.com/articleshow/131903667.cms,2026-07-01T03:29:40+00:00
TOI Life & Style,https://timesofindia.indiatimes.com/life-style,lifestyle,32,Psychology says people who thank others excessively for smal...,https://timesofindia.indiatimes.com/articleshow/131874070.cms,2026-07-01T03:29:40+00:00
TOI Life & Style,https://timesofindia.indiatimes.com/life-style,lifestyle,33,Quote of the day by J.K. Rowling: “If you want to know what ...,https://timesofindia.indiatimes.com/articleshow/131866424.cms,2026-07-01T03:29:40+00:00
TOI Life & Style,https://timesofindia.indiatimes.com/life-style,lifestyle,34,Spanish proverb of the day: “A man does what he can; a woman...,https://timesofindia.indiatimes.com/articleshow/131490216.cms,2026-07-01T03:29:40+00:00
TOI Life & Style,https://timesofindia.indiatimes.com/life-style,lifestyle,35,Colonial Williamsburg: Explore the birthplace of the American Revolution as the U.S. celebrates it's 250th anniversary this year,https://timesofindia.indiatimes.com/articleshow/132098181.cms,2026-07-01T03:29:40+00:00
TOI Life & Style,https://timesofindia.indiatimes.com/life-style,lifestyle,36,"""Where is Siya Spot?"" How Dark Tourism is changing visits to Lohagad Fort",https://timesofindia.indiatimes.com/articleshow/132090505.cms,2026-07-01T03:29:40+00:00
TOI Life & Style,https://timesofindia.indiatimes.com/life-style,lifestyle,37,"This unique church in Europe is decorated with the bones of up to 70,000 people; here's how curious travellers can visit",https://timesofindia.indiatimes.com/articleshow/132088507.cms,2026-07-01T03:29:40+00:00
TOI Life & Style,https://timesofindia.indiatimes.com/life-style,lifestyle,38,"US court blocks $100,000 H-1B Fee: What it means for Indian travellers, students and professionals",https://timesofindia.indiatimes.com/articleshow/132087062.cms,2026-07-01T03:29:40+00:00
TOI Life & Style,https://timesofindia.indiatimes.com/life-style,lifestyle,39,Looking good is no longer enough: Why beauty is quietly becoming the new wellness movement in India,https://timesofindia.indiatimes.com/articleshow/132097242.cms,2026-07-01T03:29:40+00:00
TOI Life & Style,https://timesofindia.indiatimes.com/life-style,lifestyle,40,"What is the Italian way of washing hair? A slow beauty ritual for stronger, longer, and shinier locks",https://timesofindia.indiatimes.com/articleshow/132090361.cms,2026-07-01T03:29:40+00:00
TOI Life & Style,https://timesofindia.indiatimes.com/life-style,lifestyle,41,"Quote of the day from Meg Cabot's Princess in Training: ""The fact is, I love him. He's the boy I…""",https://timesofindia.indiatimes.com/articleshow/132099819.cms,2026-07-01T03:29:40+00:00
TOI Life & Style,https://timesofindia.indiatimes.com/life-style,lifestyle,42,"Quote of the Day by Leo Tolstoy, ""The two most happy warriors in a man's life that help him win every battle are...""",https://timesofindia.indiatimes.com/articleshow/132099275.cms,2026-07-01T03:29:40+00:00
TOI Life & Style,https://timesofindia.indiatimes.com/life-style,lifestyle,43,Word of the day: Livery,https://timesofindia.indiatimes.com/articleshow/132097492.cms,2026-07-01T03:29:40+00:00
TOI Life & Style,https://timesofindia.indiatimes.com/life-style,lifestyle,44,"Quote of the Day by Charles Darwin, “Man has an instinctive tendency to speak, as we see in the babble of our...""",https://timesofindia.indiatimes.com/articleshow/132075214.cms,2026-07-01T03:29:40+00:00
TOI Life & Style,https://timesofindia.indiatimes.com/life-style,lifestyle,45,How to choose a house name that ages well: 6 Timeless tips every homeowner should know,https://timesofindia.indiatimes.com/articleshow/132083866.cms,2026-07-01T03:29:40+00:00
TOI Life & Style,https://timesofindia.indiatimes.com/life-style,lifestyle,46,Neymar Jr's penthouse in Dubai looks straight out of a futuristic car game plot: Art inspirations to take away,https://timesofindia.indiatimes.com/articleshow/132089593.cms,2026-07-01T03:29:40+00:00
TOI Life & Style,https://timesofindia.indiatimes.com/life-style,lifestyle,47,Quote of the day by Edvard Munch: “The camera will never compete with the brush and palette until such time as photography can be taken to Heaven or Hell.”,https://timesofindia.indiatimes.com/articleshow/132084222.cms,2026-07-01T03:29:40+00:00
TOI Life & Style,https://timesofindia.indiatimes.com/life-style,lifestyle,48,Thota Vaikuntam: A grocery shop owner's son from a village who became one of India's most celebrated artists; his paintings are hung from National Gallery of Modern Art in New Delhi to Peabody Essex Museum in Massachusetts,https://timesofindia.indiatimes.com/articleshow/132073304.cms,2026-07-01T03:29:40+00:00
TOI Life & Style,https://timesofindia.indiatimes.com/life-style,lifestyle,49,Akshay Kumar and Twinkle Khanna's home is all things quirky with a mix of elegance: Art inspirations to take away,https://timesofindia.indiatimes.com/articleshow/132071527.cms,2026-07-01T03:29:40+00:00
TOI Life & Style,https://timesofindia.indiatimes.com/life-style,lifestyle,50,Psychology says people who volunteer to organize every plan aren’t just responsible: Research suggests structure helps them feel more connected,https://timesofindia.indiatimes.com/articleshow/132090920.cms,2026-07-01T03:29:40+00:00
TOI Life & Style,https://timesofindia.indiatimes.com/life-style,lifestyle,51,Psychology says adults who keep the television on in the background aren’t always avoiding silence: Research suggests predictable sound can make a room feel psychologically safer,https://timesofindia.indiatimes.com/articleshow/132091014.cms,2026-07-01T03:29:40+00:00
TOI Life & Style,https://timesofindia.indiatimes.com/life-style,lifestyle,52,Psychology says the people who seem calmest in a crisis aren’t untouched by emotion: Research suggests they regulate it first and process it later,https://timesofindia.indiatimes.com/articleshow/132090926.cms,2026-07-01T03:29:40+00:00
TOI Life & Style,https://timesofindia.indiatimes.com/life-style,lifestyle,53,This famous brand to cut artificial colourings from all products by end-2026: What does it mean for consumers,https://timesofindia.indiatimes.com/articleshow/132100037.cms,2026-07-01T03:29:40+00:00
TOI Life & Style,https://timesofindia.indiatimes.com/life-style,lifestyle,54,Smart Kitchen Hacks: How to clean and install a chimney for better performance,https://timesofindia.indiatimes.com/articleshow/132093799.cms,2026-07-01T03:29:40+00:00
TOI Life & Style,https://timesofindia.indiatimes.com/life-style,lifestyle,55,Why Indians love tea so much and how tea drinking is gradually becoming a part of mindfulness rituals,https://timesofindia.indiatimes.com/articleshow/132091723.cms,2026-07-01T03:29:40+00:00
TOI Life & Style,https://timesofindia.indiatimes.com/life-style,lifestyle,56,Lock Upp: Sunita's shocking claim on Govinda cheating in marriage,https://timesofindia.indiatimes.com/articleshow/132101331.cms,2026-07-01T03:29:40+00:00
TOI Life & Style,https://timesofindia.indiatimes.com/life-style,lifestyle,57,Lock Upp 2: Shreya Kalra claims Akanksha Chamola is bise*ual,https://timesofindia.indiatimes.com/articleshow/132101020.cms,2026-07-01T03:29:40+00:00
TOI Life & Style,https://timesofindia.indiatimes.com/life-style,lifestyle,58,Kangana Returns As Janta Ki Awaaz: joins Lock Upp for first termination,https://timesofindia.indiatimes.com/articleshow/132096599.cms,2026-07-01T03:29:40+00:00
TOI Life & Style,https://timesofindia.indiatimes.com/life-style,lifestyle,59,"Gaurav reacts to wife Akanksha's divorce announcement;'Pyaar abhi bhi""",https://timesofindia.indiatimes.com/articleshow/132095126.cms,2026-07-01T03:29:40+00:00
TOI Life & Style,https://timesofindia.indiatimes.com/life-style,lifestyle,60,How Two New Variants NB.1.8.1 and LF.7 Are Different from Previous Ones,https://timesofindia.indiatimes.com/articleshow/121406615.cms,2026-07-01T03:29:40+00:00
TOI Life & Style,https://timesofindia.indiatimes.com/life-style,lifestyle,61,Two unique symptoms of new Covid variant JN.1,https://timesofindia.indiatimes.com/articleshow/121425354.cms,2026-07-01T03:29:40+00:00
TOI Life & Style,https://timesofindia.indiatimes.com/life-style,lifestyle,62,"Covid cases rising in Singapore, India: What's JN.1 variant driving the surge",https://timesofindia.indiatimes.com/articleshow/121312766.cms,2026-07-01T03:29:40+00:00
TOI Life & Style,https://timesofindia.indiatimes.com/life-style,lifestyle,63,Vijaya Mehta Death News,https://timesofindia.indiatimes.com/articleshow/132099324.cms,2026-07-01T03:29:40+00:00
TOI Life & Style,https://timesofindia.indiatimes.com/life-style,lifestyle,64,Saif Ali Khan,https://timesofindia.indiatimes.com/articleshow/132095877.cms,2026-07-01T03:29:40+00:00
TOI Life & Style,https://timesofindia.indiatimes.com/life-style,lifestyle,65,WhatsApp Update News,https://timesofindia.indiatimes.com/articleshow/132084733.cms,2026-07-01T03:29:40+00:00
TOI Life & Style,https://timesofindia.indiatimes.com/life-style,lifestyle,66,Monsoon Health Tips,https://timesofindia.indiatimes.com/articleshow/132085613.cms,2026-07-01T03:29:40+00:00
TOI Life & Style,https://timesofindia.indiatimes.com/life-style,lifestyle,67,Paul Flack Death News,https://timesofindia.indiatimes.com/articleshow/132095455.cms,2026-07-01T03:29:40+00:00
TOI Life & Style,https://timesofindia.indiatimes.com/life-style,lifestyle,68,Cocktail 2 Box Office Collection,https://timesofindia.indiatimes.com/articleshow/132089075.cms,2026-07-01T03:29:40+00:00
TOI Life & Style,https://timesofindia.indiatimes.com/life-style,lifestyle,69,Britain Defence Plan,https://timesofindia.indiatimes.com/articleshow/132084398.cms,2026-07-01T03:29:40+00:00
TOI Life & Style,https://timesofindia.indiatimes.com/life-style,lifestyle,70,General Dhiraj Seth,https://timesofindia.indiatimes.com/articleshow/132084292.cms,2026-07-01T03:29:40+00:00
TOI Life & Style,https://timesofindia.indiatimes.com/life-style,lifestyle,71,Nasa Black Hole Photograph,https://timesofindia.indiatimes.com/articleshow/132078023.cms,2026-07-01T03:29:40+00:00
TOI Life & Style,https://timesofindia.indiatimes.com/life-style,lifestyle,72,Einsteins Flight Program,https://timesofindia.indiatimes.com/articleshow/132071068.cms,2026-07-01T03:29:40+00:00
TOI Life & Style,https://timesofindia.indiatimes.com/life-style,lifestyle,73,Nuclear Heat Hydrogen Plant,https://timesofindia.indiatimes.com/articleshow/132089192.cms,2026-07-01T03:29:40+00:00
TOI Life & Style,https://timesofindia.indiatimes.com/life-style,lifestyle,74,Ancient Roman Concrete,https://timesofindia.indiatimes.com/articleshow/132090755.cms,2026-07-01T03:29:40+00:00
TOI Life & Style,https://timesofindia.indiatimes.com/life-style,lifestyle,75,Captions For Instagram Posts,https://timesofindia.indiatimes.com/articleshow/130895681.cms,2026-07-01T03:29:40+00:00
TOI Life & Style,https://timesofindia.indiatimes.com/life-style,lifestyle,76,Hazaribag man drowns while fishing in lake,https://timesofindia.indiatimes.com/articleshow/130060093.cms,2026-07-01T03:29:40+00:00
TOI Life & Style,https://timesofindia.indiatimes.com/life-style,lifestyle,77,"""Behen Darr Gayi!"": Fans relive ‘Bhagam Bhag’ era after watching Akshay Kumar's 'Bhooth Bangla' trailer",https://timesofindia.indiatimes.com/articleshow/130060027.cms,2026-07-01T03:29:40+00:00
TOI Life & Style,https://timesofindia.indiatimes.com/life-style,lifestyle,78,MBOSE HSLC result 2026 to release tomorrow: Check details here,https://timesofindia.indiatimes.com/articleshow/130059814.cms,2026-07-01T03:29:40+00:00
TOI Life & Style,https://timesofindia.indiatimes.com/life-style,lifestyle,79,"Iran war risk: JPMorgan CEO Jamie Dimon warns of oil shocks, sticky inflation and higher interest rates",https://timesofindia.indiatimes.com/articleshow/130059993.cms,2026-07-01T03:29:40+00:00
TOI Life & Style,https://timesofindia.indiatimes.com/life-style,lifestyle,80,Make your clutch last longer with these easy driving tips,https://timesofindia.indiatimes.com/articleshow/130052232.cms,2026-07-01T03:29:40+00:00
TOI Life & Style,https://timesofindia.indiatimes.com/life-style,lifestyle,81,“Three-against-one situation”: El Rubius opens up on being “targeted” in MrBeast’s viral $1M challenge,https://timesofindia.indiatimes.com/articleshow/130054402.cms,2026-07-01T03:29:40+00:00
TOI Life & Style,https://timesofindia.indiatimes.com/life-style,lifestyle,82,Bihar BTSC lab assistant notification released for 1091 posts at btsc.bihar.gov.in; apply here,https://timesofindia.indiatimes.com/articleshow/130059322.cms,2026-07-01T03:29:40+00:00
TOI Life & Style,https://timesofindia.indiatimes.com/life-style,lifestyle,83,IPL craze costs techie Rs 1.46 lakh in fake RCB vs CSK ticket scam,https://timesofindia.indiatimes.com/articleshow/130059549.cms,2026-07-01T03:29:40+00:00
TOI Life & Style,https://timesofindia.indiatimes.com/life-style,lifestyle,84,Raising “robot-proof” kids: Why creativity and curiosity matter more than ever,https://timesofindia.indiatimes.com/articleshow/130057342.cms,2026-07-01T03:29:40+00:00
TOI Life & Style,https://timesofindia.indiatimes.com/life-style,lifestyle,85,Inside ‘Satguru Sharan’: Exploring Saif Ali Khan and Kareena Kapoor Khan’s Rs 100 crore Bandra home,https://timesofindia.indiatimes.com/articleshow/130059584.cms,2026-07-01T03:29:40+00:00
TOI Life & Style,https://timesofindia.indiatimes.com/life-style,lifestyle,86,How selling Alaska in 1867 was a costly mistake for Russia,https://timesofindia.indiatimes.com/articleshow/130057081.cms,2026-07-01T03:29:40+00:00
TOI Life & Style,https://timesofindia.indiatimes.com/life-style,lifestyle,87,'Hera Pheri 3 is coming': Paresh Rawal dismisses delay reports and reveals he will 'start shooting soon',https://timesofindia.indiatimes.com/articleshow/130059421.cms,2026-07-01T03:29:40+00:00
TOI Life & Style,https://timesofindia.indiatimes.com/life-style,lifestyle,88,"US-Iran War: A daring rescue Hollywood blockbuster is on its way. Till then, pick your favourite from these 10 films on bringing someone home against all odds",https://timesofindia.indiatimes.com/articleshow/130059208.cms,2026-07-01T03:29:40+00:00
TOI Life & Style,https://timesofindia.indiatimes.com/life-style,lifestyle,89,"Kolkata team unveils fan mural at Rash Behari Avenue, celebrating city’s first love",https://timesofindia.indiatimes.com/articleshow/130059554.cms,2026-07-01T03:29:40+00:00
TOI Life & Style,https://timesofindia.indiatimes.com/life-style,lifestyle,90,How US spread a lie to rescue a pilot of a jet shot down in Iran,https://timesofindia.indiatimes.com/articleshow/130058641.cms,2026-07-01T03:29:40+00:00
TOI Life & Style,https://timesofindia.indiatimes.com/life-style,lifestyle,91,"Netflix unveils ‘VOID’, an AI model that can change a movie plot",https://timesofindia.indiatimes.com/articleshow/130058880.cms,2026-07-01T03:29:40+00:00
TOI Life & Style,https://timesofindia.indiatimes.com/life-style,lifestyle,92,"AI data centers are causing 'stress' not just to tech companies, but also private insurers",https://timesofindia.indiatimes.com/articleshow/130058967.cms,2026-07-01T03:29:40+00:00
TOI Life & Style,https://timesofindia.indiatimes.com/life-style,lifestyle,93,"""Trans women are....."": Clavicular’s viral moment with trans women sparks fresh conversation on internet culture",https://timesofindia.indiatimes.com/articleshow/130053479.cms,2026-07-01T03:29:40+00:00
India Today Lifestyle,https://www.indiatoday.in/lifestyle,lifestyle,1,"Not just 'South ki Imli', kokum is now flavouring ramen, cocktails and coffee",https://www.indiatoday.in/lifestyle/food/story/forget-south-ki-imli-kokum-is-now-flavouring-ramen-cocktails-and-coffee-2937185-2026-06-30,2026-07-01T03:29:40+00:00
India Today Lifestyle,https://www.indiatoday.in/lifestyle,lifestyle,2,The Kill Bill inspiration behind Naomi Osaka's show-stopping Wimbledon look,https://www.indiatoday.in/lifestyle/fashion/story/the-kill-bill-inspiration-behind-naomi-osakas-show-stopping-wimbledon-look-2937277-2026-06-30,2026-07-01T03:29:40+00:00
India Today Lifestyle,https://www.indiatoday.in/lifestyle,lifestyle,3,Did the viral June Theory work for you? It's ok if it didn't,https://www.indiatoday.in/lifestyle/what-s-hot/story/june-theory-explained-viral-dating-trend-social-media-2937326-2026-06-30,2026-07-01T03:29:40+00:00
India Today Lifestyle,https://www.indiatoday.in/lifestyle,lifestyle,4,Has Delhi's Sarojini Nagar lost its charm or did it just get better?,https://www.indiatoday.in/lifestyle/fashion/story/sarojini-nagar-market-anti-encroachment-drive-widens-lanes-vendors-move-indoors-2932260-2026-06-29,2026-07-01T03:29:40+00:00
India Today Lifestyle,https://www.indiatoday.in/lifestyle,lifestyle,5,We visited 10 Delhi neighbourhoods after SC's 'right to walk' ruling. Here's what we found,https://www.indiatoday.in/lifestyle/society/story/we-visited-10-delhi-neighbourhoods-after-scs-right-to-walk-ruling-heres-what-we-found-2934938-2026-06-27,2026-07-01T03:29:40+00:00
India Today Lifestyle,https://www.indiatoday.in/lifestyle,lifestyle,6,"Why the Brazil rope jump is a death trap, even with a rope attached",https://www.indiatoday.in/lifestyle/what-s-hot/story/why-the-brazil-rope-jump-is-a-death-trap-even-with-a-rope-attached-2926827-2026-06-15,2026-07-01T03:29:40+00:00
India Today Lifestyle,https://www.indiatoday.in/lifestyle,lifestyle,7,Are water bars the next big Indian luxury wedding trend?,https://www.indiatoday.in/lifestyle/what-s-hot/story/are-water-bars-the-next-big-luxury-wedding-trend-2925765-2026-06-14,2026-07-01T03:29:40+00:00
India Today Lifestyle,https://www.indiatoday.in/lifestyle,lifestyle,8,Squishy dumplings are having their viral Labubu moment. But here's the catch,https://www.indiatoday.in/lifestyle/what-s-hot/story/squishy-dumplings-viral-labubu-safety-warning-counterfeit-toys-chemical-risks-india-2924404-2026-06-11,2026-07-01T03:29:40+00:00
India Today Lifestyle,https://www.indiatoday.in/lifestyle,lifestyle,9,Love Shahid Kapoor's Cocktail 2 body? His nutritionist reveals the secret,https://www.indiatoday.in/lifestyle/wellness/story/cocktail-2-shahid-kapoor-diet-nicole-kedia-protein-rich-vegetarian-meal-plan-2924616-2026-06-12,2026-07-01T03:29:40+00:00
India Today Lifestyle,https://www.indiatoday.in/lifestyle,lifestyle,10,"Influencers claim nicotine is not the villain. So, did we get it wrong all this time?",https://www.indiatoday.in/lifestyle/wellness/story/influencers-claim-nicotine-cigarettes-not-the-villain-so-did-we-get-it-wrong-all-this-time-2923519-2026-06-08,2026-07-01T03:29:40+00:00
India Today Lifestyle,https://www.indiatoday.in/lifestyle,lifestyle,11,A mukbang influencer's Mounjaro journey reveals the cost of eating for Internet,https://www.indiatoday.in/lifestyle/wellness/story/a-mukbang-influencers-mounjaro-journey-reveals-the-cost-of-eating-for-internet-maddyeats-youtube-instagram-2922707-2026-06-06,2026-07-01T03:29:40+00:00
India Today Lifestyle,https://www.indiatoday.in/lifestyle,lifestyle,12,Off Campus and Heated Rivalry have sparked a 'hockey butt' conversation,https://www.indiatoday.in/lifestyle/wellness/story/hockey-butt-explained-off-campus-heated-rivalry-strong-glutes-benefits-2919242-2026-06-02,2026-07-01T03:29:40+00:00
India Today Lifestyle,https://www.indiatoday.in/lifestyle,lifestyle,13,Can sleeping like an astronaut improve your sleep?,https://www.indiatoday.in/lifestyle/wellness/story/can-sleeping-like-an-astronaut-improve-your-sleep-2917736-2026-05-27,2026-07-01T03:29:40+00:00
India Today Lifestyle,https://www.indiatoday.in/lifestyle,lifestyle,14,This company is hiring a Chief Breakup Officer. The salary is Rs 2.8 lakh,https://www.indiatoday.in/lifestyle/relationship/story/this-company-is-hiring-a-chief-breakup-officer-job-salary-rs-28-lakh-2934818-2026-06-26,2026-07-01T03:29:40+00:00
India Today Lifestyle,https://www.indiatoday.in/lifestyle,lifestyle,15,93 per cent of Indian daters are ready for 3 am FIFA date nights: New survey,https://www.indiatoday.in/lifestyle/relationship/story/fifa-world-cup-2026-dating-survey-indian-singles-open-to-3-am-dates-rival-team-romance-2934032-2026-06-25,2026-07-01T03:29:40+00:00
India Today Lifestyle,https://www.indiatoday.in/lifestyle,lifestyle,16,How my father turned a Led Zeppelin song into a lifelong love affair with music,https://www.indiatoday.in/lifestyle/relationship/story/how-my-father-turned-a-led-zeppelin-song-into-a-lifelong-love-affair-with-music-2930855-2026-06-21,2026-07-01T03:29:40+00:00
India Today Lifestyle,https://www.indiatoday.in/lifestyle,lifestyle,17,Kancheepuram retains top spot in India's infidelity rankings,https://www.indiatoday.in/lifestyle/relationship/story/kanchipuram-tops-ashley-madison-sign-ups-india-again-discreet-dating-rises-2929691-2026-06-19,2026-07-01T03:29:40+00:00
India Today Lifestyle,https://www.indiatoday.in/lifestyle,lifestyle,18,You wouldn't believe the shocking reason so many people are choosing to solo-maxx,https://www.indiatoday.in/lifestyle/relationship/story/what-is-solo-maxxing-new-trend-to-be-single-dating-burnout-2924928-2026-06-15,2026-07-01T03:29:40+00:00
