source,source_url,category,rank,headline,link,collected_at_iso
Healthline Recent,https://www.healthline.com/directory/recent,health,182,How Can a Registered Dietitian Help with Gout? Expert Answers,https://www.healthline.com/health/gout/registered-dietitian-ask-expert,2026-06-13T03:24:09+00:00
Healthline Recent,https://www.healthline.com/directory/recent,health,183,Staying Hydrated While Taking GLP-1s,https://www.healthline.com/health/drugs/staying-hydrated-while-taking-glp-1s,2026-06-13T03:24:09+00:00
Healthline Recent,https://www.healthline.com/directory/recent,health,184,Steps for Managing Diarrhea with Zepbound,https://www.healthline.com/health/drugs/zepbound-diarrhea-treatment,2026-06-13T03:24:09+00:00
Healthline Recent,https://www.healthline.com/directory/recent,health,185,Foundayo: Everything You Need to Know About This Weight Loss Pill,https://www.healthline.com/health/drugs/foundayo,2026-06-13T03:24:09+00:00
Healthline Recent,https://www.healthline.com/directory/recent,health,186,Inlexzo for BCG-Unresponsive Bladder Cancer: A Treatment Guide,https://www.healthline.com/health/drugs/inlexzo,2026-06-13T03:24:09+00:00
Healthline Recent,https://www.healthline.com/directory/recent,health,187,Switching From Ozempic to Mounjaro: What to Know,https://www.healthline.com/health/drugs/switching-from-ozempic-to-mounjaro,2026-06-13T03:24:09+00:00
Healthline Recent,https://www.healthline.com/directory/recent,health,188,How Is Catamenial Epilepsy Treated?,https://www.healthline.com/health/epilepsy/catamenial-epilepsy-treatment,2026-06-13T03:24:09+00:00
Healthline Recent,https://www.healthline.com/directory/recent,health,189,What Is a Seizure Response Dog and How Can They Help with Epilepsy?,https://www.healthline.com/health/epilepsy/seizure-response-dog,2026-06-13T03:24:09+00:00
Healthline Recent,https://www.healthline.com/directory/recent,health,190,Mental Health Spotlight: How to Cope with the Fear of Seizures,https://www.healthline.com/health/epilepsy/fear-of-seizures,2026-06-13T03:24:09+00:00
Healthline Recent,https://www.healthline.com/directory/recent,health,191,How to Safely Declutter Your Drug Cabinet and Why You Should,https://www.healthline.com/health/drugs/safely-declutter-drug-cabinet-and-why,2026-06-13T03:24:09+00:00
Healthline Recent,https://www.healthline.com/directory/recent,health,192,Tips for managing nausea with Zepbound,https://www.healthline.com/health/drugs/zepbound-nausea-relief,2026-06-13T03:24:09+00:00
Healthline Recent,https://www.healthline.com/directory/recent,health,193,What Foods Should I Avoid When Taking Wegovy?,https://www.healthline.com/health/drugs/foods-to-avoid-when-taking-wegovy,2026-06-13T03:24:09+00:00
Healthline Recent,https://www.healthline.com/directory/recent,health,194,Introducing the 14-Day Stress Reset,https://www.healthline.com/health/stress/14-day-stress-reset,2026-06-13T03:24:09+00:00
Healthline Recent,https://www.healthline.com/directory/recent,health,195,Can GLP-1s Cause Low Blood Sugar?,https://www.healthline.com/health/drugs/can-glp-1-cause-low-blood-sugar,2026-06-13T03:24:09+00:00
Healthline Recent,https://www.healthline.com/directory/recent,health,196,Do GLP-1 Patches Work?,https://www.healthline.com/health/drugs/do-glp-1-patches-work,2026-06-13T03:24:09+00:00
Healthline Recent,https://www.healthline.com/directory/recent,health,197,Can Celibacy Affect Mental Health?,https://www.healthline.com/health/relationships/celibacy-and-mental-health,2026-06-13T03:24:09+00:00
Healthline Recent,https://www.healthline.com/directory/recent,health,198,"Repatha Pushtronex vs SureClick: Dosing, Use, and Key Differences (2026 Guide)",https://www.healthline.com/health/drugs/repatha-pushtronex-vs-sureclick,2026-06-13T03:24:09+00:00
Healthline Recent,https://www.healthline.com/directory/recent,health,199,Understanding Nubeqa Costs and How to Save Money,https://www.healthline.com/health/prostate-cancer/nubeqa-cost,2026-06-13T03:24:09+00:00
Healthline Recent,https://www.healthline.com/directory/recent,health,200,Where Do I Inject Zepbound?,https://www.healthline.com/health/drugs/where-to-inject-zepbound,2026-06-13T03:24:09+00:00
Healthline Recent,https://www.healthline.com/directory/recent,health,201,"Alphanate Overview: Side Effects, Uses, Dosage, and More",https://www.healthline.com/health/drugs/alphanate,2026-06-13T03:24:09+00:00
Healthline Recent,https://www.healthline.com/directory/recent,health,202,How to Increase Protein While Taking GLP-1 Medications,https://www.healthline.com/health/drugs/protein-on-glp-1,2026-06-13T03:24:09+00:00
Healthline Recent,https://www.healthline.com/directory/recent,health,203,Zenpep Side Effects: What You Need to Know,https://www.healthline.com/health/drugs/zenpep-side-effects,2026-06-13T03:24:09+00:00
Healthline Recent,https://www.healthline.com/directory/recent,health,204,Understanding Icotyde (Icotrokinra): A Guide to the First Oral IL-23 Therapy,https://www.healthline.com/health/drugs/icotyde,2026-06-13T03:24:09+00:00
Healthline Recent,https://www.healthline.com/directory/recent,health,205,Download: 14-Day Stress Reset Calendar,https://www.healthline.com/health/stress/14-day-stress-reset-calendar,2026-06-13T03:24:09+00:00
Healthline Recent,https://www.healthline.com/directory/recent,health,206,What Is HER2-Positive Breast Cancer? Understanding Your Outlook,https://www.healthline.com/health/breast-cancer/her2-positive-survival-rates-statistics,2026-06-13T03:24:09+00:00
Healthline Recent,https://www.healthline.com/directory/recent,health,207,10 of the Best Health and Wellness Books We’ve Ever Read,https://www.healthline.com/health/best-health-wellness-books-weve-read,2026-06-13T03:24:09+00:00
Healthline Recent,https://www.healthline.com/directory/recent,health,208,"A Guide to Humate-P: Uses, Benefits, and Expectations",https://www.healthline.com/health/drugs/humate-p,2026-06-13T03:24:09+00:00
Healthline Recent,https://www.healthline.com/directory/recent,health,209,What Should I Know About The Tecvayli-Darzalex Faspro Combination?,https://www.healthline.com/health/drugs/tecvayli-and-darzalex-faspro,2026-06-13T03:24:09+00:00
Healthline Recent,https://www.healthline.com/directory/recent,health,210,Does Ozempic Cause Hair Loss and Why?,https://www.healthline.com/health/drugs/does-ozempic-cause-hair-loss,2026-06-13T03:24:09+00:00
Healthline Recent,https://www.healthline.com/directory/recent,health,211,What Is Avolition in Depression?,https://www.healthline.com/health/mdd/what-is-avolition-in-depression,2026-06-13T03:24:09+00:00
Healthline Recent,https://www.healthline.com/directory/recent,health,212,How to Know If Your Depression Treatments Need to Change,https://www.healthline.com/health/mdd/signs-to-change-depression-treatment,2026-06-13T03:24:09+00:00
Healthline Recent,https://www.healthline.com/directory/recent,health,213,Can Music Therapy Help with Depression?,https://www.healthline.com/health/mdd/can-music-therapy-help-depression,2026-06-13T03:24:09+00:00
Healthline Nutrition,https://www.healthline.com/nutrition,health,1,How Well Do You Sleep?,https://www.healthline.com/health/healthy-sleep/quiz-how-well-do-you-sleep,2026-06-13T03:24:09+00:00
Healthline Nutrition,https://www.healthline.com/nutrition,health,2,Are You a Workaholic?,https://www.healthline.com/health/mental-health/quiz-are-you-a-workaholic,2026-06-13T03:24:09+00:00
Healthline Nutrition,https://www.healthline.com/nutrition,health,3,5 Tips for a Healthy Lifestyle,https://www.healthline.com/health/fitness-nutrition/healthy-lifestyle-benefits,2026-06-13T03:24:09+00:00
Healthline Nutrition,https://www.healthline.com/nutrition,health,4,How to Disinfect Your House After the Flu,https://www.healthline.com/health/flu/how-to-disinfect-house-after-flu,2026-06-13T03:24:09+00:00
Healthline Nutrition,https://www.healthline.com/nutrition,health,5,Best Vegan and Plant-Based Meal Delivery for 2025,https://www.healthline.com/nutrition/plant-based-meal-delivery,2026-06-13T03:24:09+00:00
Healthline Nutrition,https://www.healthline.com/nutrition,health,6,Does Medicare Cover Pneumonia Shots?,https://www.healthline.com/health/medicare/does-medicare-cover-pneumonia-shots,2026-06-13T03:24:09+00:00
Healthline Nutrition,https://www.healthline.com/nutrition,health,7,"Chromosomes, Genetics, and Your Health",https://www.healthline.com/health/chromosomes-and-genetics,2026-06-13T03:24:09+00:00
Healthline Nutrition,https://www.healthline.com/nutrition,health,8,Best Multivitamins for Women,https://www.healthline.com/nutrition/multivitamins-womens-health,2026-06-13T03:24:09+00:00
Healthline Nutrition,https://www.healthline.com/nutrition,health,9,Best Multivitamins for Men,https://www.healthline.com/nutrition/best-multivitamins-for-men,2026-06-13T03:24:09+00:00
Healthline Nutrition,https://www.healthline.com/nutrition,health,10,Best Online Therapy Services,https://www.healthline.com/health/our-top-10-online-therapy-picks,2026-06-13T03:24:09+00:00
Healthline Nutrition,https://www.healthline.com/nutrition,health,11,Online Therapy That Takes Insurance,https://www.healthline.com/health/mental-health/online-therapy-that-takes-insurance,2026-06-13T03:24:09+00:00
Healthline Nutrition,https://www.healthline.com/nutrition,health,12,Buy Ozempic Online,https://www.healthline.com/nutrition/buy-ozempic-online,2026-06-13T03:24:09+00:00
Healthline Nutrition,https://www.healthline.com/nutrition,health,13,Through an Artist's Eye,https://www.healthline.com/health/breast-cancer/metastatic-breast-cancer-artist-eye,2026-06-13T03:24:09+00:00
Healthline Nutrition,https://www.healthline.com/nutrition,health,14,Feel Good Food,https://www.healthline.com/nutrition/feel-good-food,2026-06-13T03:24:09+00:00
Healthline Nutrition,https://www.healthline.com/nutrition,health,15,Vitamins & Supplements,https://www.healthline.com/nutrition/vitamins-and-supplements,2026-06-13T03:24:09+00:00
Healthline Nutrition,https://www.healthline.com/nutrition,health,16,Eat It or Leave It? A Comprehensive Ingredient Dictionary to Simplify Your Shopping Trip,https://www.healthline.com/nutrition/eat-it-or-leave-it-a-comprehensive-ingredient-dictionary-to-simplify-your-shopping-trip,2026-06-13T03:24:09+00:00
Healthline Nutrition,https://www.healthline.com/nutrition,health,17,Healthy Eating Refresh: Letter from the Editor,https://www.healthline.com/nutrition/healthy-eating-refresh-letter-from-the-editor,2026-06-13T03:24:09+00:00
Healthline Nutrition,https://www.healthline.com/nutrition,health,18,Get Your Vitamin P: Why Pleasure Matters When It Comes to What You Eat,https://www.healthline.com/nutrition/get-your-vitamin-p-why-pleasure-matters-when-it-comes-to-what-you-eat,2026-06-13T03:24:09+00:00
Healthline Nutrition,https://www.healthline.com/nutrition,health,19,10 Ways to Lower Your Grocery Bill as Prices Increase,https://www.healthline.com/nutrition/lower-grocery-bill-inflation,2026-06-13T03:24:09+00:00
Healthline Nutrition,https://www.healthline.com/nutrition,health,20,15 Staple Foods to Make Healthy Eating Easy All Week Long,https://www.healthline.com/nutrition/staple-foods-to-make-healthy-eating-easy-all-week-long,2026-06-13T03:24:09+00:00
Healthline Nutrition,https://www.healthline.com/nutrition,health,21,The Definitive Guide to Healthy Eating in Real Life,https://www.healthline.com/nutrition/how-to-eat-healthy-guide,2026-06-13T03:24:09+00:00
Healthline Nutrition,https://www.healthline.com/nutrition,health,22,How to Stock Your Pantry for Quick & Easy Meals in Minutes,https://www.healthline.com/nutrition/how-to-stock-your-pantry-for-quick-easy-meals-in-minutes,2026-06-13T03:24:09+00:00
Healthline Nutrition,https://www.healthline.com/nutrition,health,23,"Plant-based Protein: The Best, the Worst, and Everything In Between",https://www.healthline.com/nutrition/plant-based-protein-the-best-the-worst-and-everything-in-between,2026-06-13T03:24:09+00:00
Healthline Nutrition,https://www.healthline.com/nutrition,health,24,The Definitive Guide to Healthy Grocery Shopping,https://www.healthline.com/nutrition/healthy-grocery-shopping-guide,2026-06-13T03:24:09+00:00
Healthline Nutrition,https://www.healthline.com/nutrition,health,25,Try it or Toss it? The Supplements You Need and the Ones You Can Skip,https://www.healthline.com/nutrition/try-it-or-toss-it-the-supplements-you-need-and-the-ones-you-can-skip,2026-06-13T03:24:09+00:00
Healthline Nutrition,https://www.healthline.com/nutrition,health,26,"How to Find Wisdom in Food Cravings, Plus 7 Ways to Make Peace With…",https://www.healthline.com/nutrition/finding-the-wisdom-in-food-cravings-plus-tk-techniques-to-make-peace-with-them,2026-06-13T03:24:09+00:00
Healthline Nutrition,https://www.healthline.com/nutrition,health,27,How to Ditch Diet Culture and Learn to Trust Your Body’s Cues,https://www.healthline.com/nutrition/what-is-food-freedom-getting-started-weight-loss-and-tips,2026-06-13T03:24:09+00:00
Healthline Nutrition,https://www.healthline.com/nutrition,health,28,"Dear Fat, Black Girls Who Were Not Spared from Diet Culture—I…",https://www.healthline.com/health/diet-culture-affects-fat-black-women,2026-06-13T03:24:09+00:00
Healthline Nutrition,https://www.healthline.com/nutrition,health,29,The Dangers of Diet Culture: 10 Women Share How Toxic It Is,https://www.healthline.com/health/mental-health/diet-culture,2026-06-13T03:24:09+00:00
Healthline Nutrition,https://www.healthline.com/nutrition,health,30,12 High Carb Foods That Are Incredibly Healthy,https://www.healthline.com/nutrition/12-healthy-high-carb-foods,2026-06-13T03:24:09+00:00
Healthline Nutrition,https://www.healthline.com/nutrition,health,31,"9 Tips for Joyful, Balanced Eating from Divya's Ayurvedic Kitchen",https://www.healthline.com/nutrition/tips-for-finding-balance-and-joy-through-food-from-divyas-ayurvedic-kitchen,2026-06-13T03:24:09+00:00
Healthline Nutrition,https://www.healthline.com/nutrition,health,32,"Vegan Teen Chef Tabay Atkins on Healthy, Heart-Based Eating",https://www.healthline.com/nutrition/vegan-teen-chef-tabay-atkins-on-healthy-heart-based-eating,2026-06-13T03:24:09+00:00
Healthline Nutrition,https://www.healthline.com/nutrition,health,33,How to Be an Ethical Omnivore,https://www.healthline.com/nutrition/ethical-omnivore,2026-06-13T03:24:09+00:00
Healthline Nutrition,https://www.healthline.com/nutrition,health,34,Is BMI a Fair Health Metric for Black Women?,https://www.healthline.com/nutrition/bmi-for-black-women,2026-06-13T03:24:09+00:00
Healthline Nutrition,https://www.healthline.com/nutrition,health,35,How Long Does It Take to Lose Weight?,https://www.healthline.com/nutrition/how-long-does-it-take-to-lose-weight,2026-06-13T03:24:09+00:00
Healthline Nutrition,https://www.healthline.com/nutrition,health,36,Omega-3 Supplement Guide,https://www.healthline.com/nutrition/omega-3-supplement-guide,2026-06-13T03:24:09+00:00
Healthline Nutrition,https://www.healthline.com/nutrition,health,37,The 15 Best Supplements to Boost Your Immune System Right Now,https://www.healthline.com/nutrition/immune-boosting-supplements,2026-06-13T03:24:09+00:00
Healthline Nutrition,https://www.healthline.com/nutrition,health,38,8 Best Vitamin D Supplements for Optimal Absorption: Reviewed by…,https://www.healthline.com/nutrition/best-vitamin-d-supplements,2026-06-13T03:24:09+00:00
Healthline Nutrition,https://www.healthline.com/nutrition,health,39,Can Vitamin D Lower Your Risk of COVID-19?,https://www.healthline.com/nutrition/vitamin-d-coronavirus,2026-06-13T03:24:09+00:00
Healthline Nutrition,https://www.healthline.com/nutrition,health,40,"5 Best Fish Oil Supplements to Boost Your Omega-3s in 2026, According…",https://www.healthline.com/nutrition/best-fish-oil-supplement,2026-06-13T03:24:09+00:00
Healthline Nutrition,https://www.healthline.com/nutrition,health,41,"3 Best Personalized Vitamins in 2026, According to Dietitians",https://www.healthline.com/nutrition/personalized-vitamins,2026-06-13T03:24:09+00:00
Healthline Nutrition,https://www.healthline.com/nutrition,health,42,The 17 Best Foods for High Blood Pressure,https://www.healthline.com/nutrition/foods-high-blood-pressure,2026-06-13T03:24:09+00:00
Healthline Nutrition,https://www.healthline.com/nutrition,health,43,The 13 Most Anti-Inflammatory Foods You Can Eat,https://www.healthline.com/nutrition/13-anti-inflammatory-foods,2026-06-13T03:24:09+00:00
Healthline Nutrition,https://www.healthline.com/nutrition,health,44,"Hashimoto Diet: Overview, Foods, Supplements, and Tips",https://www.healthline.com/nutrition/hashimoto-diet,2026-06-13T03:24:09+00:00
Healthline Nutrition,https://www.healthline.com/nutrition,health,45,18 of the Best Non-Perishables for People with Diabetes,https://www.healthline.com/nutrition/non-perishables-for-people-with-diabetes,2026-06-13T03:24:09+00:00
Healthline Nutrition,https://www.healthline.com/nutrition,health,46,Foods and Beverages to Avoid with Arthritis,https://www.healthline.com/nutrition/foods-to-avoid-arthritis,2026-06-13T03:24:09+00:00
Healthline Nutrition,https://www.healthline.com/nutrition,health,47,How to Follow a Vestibular Migraine Diet,https://www.healthline.com/nutrition/vestibular-migraine-diet,2026-06-13T03:24:09+00:00
Healthline Nutrition,https://www.healthline.com/nutrition,health,48,Reflecting on the Intersection of Veganism and Blackness During Black…,https://www.healthline.com/nutrition/reflecting-on-the-intersection-of-veganism-and-blackness-2,2026-06-13T03:24:09+00:00
Healthline Nutrition,https://www.healthline.com/nutrition,health,49,How to Build a Balanced Caribbean Meal,https://www.healthline.com/nutrition/balanced-caribbean-meal,2026-06-13T03:24:09+00:00
Healthline Nutrition,https://www.healthline.com/nutrition,health,50,I’m a Black Dietitian — Here’s What I Want You to Know About Food and…,https://www.healthline.com/health/food-nutrition/black-dietician-food-and-racism,2026-06-13T03:24:09+00:00
Healthline Nutrition,https://www.healthline.com/nutrition,health,51,Welcome to Healthline Nutrition: A Letter from the Editor,https://www.healthline.com/nutrition/welcome-to-nutrition-editor-letter,2026-06-13T03:24:09+00:00
Healthline Nutrition,https://www.healthline.com/nutrition,health,52,I’m a Dietitian with Hashimoto’s Disease — Here’s My Story,https://www.healthline.com/nutrition/im-a-dietitian-living-with-hashimotos-disease,2026-06-13T03:24:09+00:00
Healthline Nutrition,https://www.healthline.com/nutrition,health,53,What’s the Difference Between a Dietitian and a Nutritionist?,https://www.healthline.com/nutrition/dietitian-vs-nutritionist,2026-06-13T03:24:09+00:00
Healthline Nutrition,https://www.healthline.com/nutrition,health,54,Cultural Competence in Nutrition and Dietetics: What We Need to Know,https://www.healthline.com/nutrition/cultural-competence-in-dietetics,2026-06-13T03:24:09+00:00
Healthline Nutrition,https://www.healthline.com/nutrition,health,55,5 Types of Eco-Friendly Food Packaging (and 3 to Avoid),https://www.healthline.com/nutrition/eco-friendly-food-packaging,2026-06-13T03:24:09+00:00
Healthline Nutrition,https://www.healthline.com/nutrition,health,56,How to Start Composting at Home,https://www.healthline.com/nutrition/composting-beginners-guide,2026-06-13T03:24:09+00:00
Healthline Nutrition,https://www.healthline.com/nutrition,health,57,I'm Raising My Kids on a Plant-Based Diet for Their Future,https://www.healthline.com/nutrition/raising-kids-vegetarian,2026-06-13T03:24:09+00:00
Healthline Nutrition,https://www.healthline.com/nutrition,health,58,Can You Follow an Eco-Friendly Diet and Still Eat Meat?,https://www.healthline.com/nutrition/eco-friendly-meat-eating,2026-06-13T03:24:09+00:00
Healthline Nutrition,https://www.healthline.com/nutrition,health,59,Palm Oil’s Environmental Impact: Can It Be Grown Sustainably?,https://www.healthline.com/nutrition/palm-oil-deforestation,2026-06-13T03:24:09+00:00
Healthline Nutrition,https://www.healthline.com/nutrition,health,60,Nutrition in Daily Life: A Trinbagonian Dietitian's Journey,https://www.healthline.com/nutrition/nutrition-in-daily-life,2026-06-13T03:24:09+00:00
TOI Life & Style,https://timesofindia.indiatimes.com/life-style,lifestyle,1,Personality test: The person you avoid sitting next to reveals your deepest fear,https://timesofindia.indiatimes.com/articleshow/131689153.cms,2026-06-13T03:24:09+00:00
TOI Life & Style,https://timesofindia.indiatimes.com/life-style,lifestyle,2,"'Get multiple wives': Men react with shocking comments to Supreme Court's valuation of ₹30,000 monthly income for homemakers",https://timesofindia.indiatimes.com/articleshow/131689373.cms,2026-06-13T03:24:09+00:00
TOI Life & Style,https://timesofindia.indiatimes.com/life-style,lifestyle,3,Optical illusion personality test: Woman or trees? What you see first reveals if you are creative or sensitive,https://timesofindia.indiatimes.com/articleshow/131684448.cms,2026-06-13T03:24:09+00:00
TOI Life & Style,https://timesofindia.indiatimes.com/life-style,lifestyle,4,Harmanpreet Kaur’s diet is surprisingly relatable!,https://timesofindia.indiatimes.com/articleshow/131687294.cms,2026-06-13T03:24:09+00:00
TOI Life & Style,https://timesofindia.indiatimes.com/life-style,lifestyle,5,UK launches Meningitis B vaccine rollout for youngsters,https://timesofindia.indiatimes.com/articleshow/131681578.cms,2026-06-13T03:24:09+00:00
TOI Life & Style,https://timesofindia.indiatimes.com/life-style,lifestyle,6,Meat cravings during pregnancy? Doctor explains,https://timesofindia.indiatimes.com/articleshow/131654681.cms,2026-06-13T03:24:09+00:00
TOI Life & Style,https://timesofindia.indiatimes.com/life-style,lifestyle,7,Parents sue OHSU for $17M over botched surgery,https://timesofindia.indiatimes.com/articleshow/131609100.cms,2026-06-13T03:24:09+00:00
TOI Life & Style,https://timesofindia.indiatimes.com/life-style,lifestyle,8,5 designer bags dominating Sonam Kapoor’s wardrobe,https://timesofindia.indiatimes.com/articleshow/131682696.cms,2026-06-13T03:24:09+00:00
TOI Life & Style,https://timesofindia.indiatimes.com/life-style,lifestyle,9,Why are NRI stores abroad selling ‘outdated’ Indian ethnic wear?,https://timesofindia.indiatimes.com/articleshow/131681656.cms,2026-06-13T03:24:09+00:00
TOI Life & Style,https://timesofindia.indiatimes.com/life-style,lifestyle,10,Kriti Sanon and Rashmika Mandanna serve opposite style energies,https://timesofindia.indiatimes.com/articleshow/131677829.cms,2026-06-13T03:24:09+00:00
TOI Life & Style,https://timesofindia.indiatimes.com/life-style,lifestyle,11,Why are co-ord sets trending in 2026?,https://timesofindia.indiatimes.com/articleshow/131657760.cms,2026-06-13T03:24:09+00:00
TOI Life & Style,https://timesofindia.indiatimes.com/life-style,lifestyle,12,"Amid Pranit More row, old video of Dr Sejal Pawar calling KEM faculty ‘toxic’ , batchmates 'ugly' sparks fresh outrage",https://timesofindia.indiatimes.com/articleshow/131696575.cms,2026-06-13T03:24:09+00:00
TOI Life & Style,https://timesofindia.indiatimes.com/life-style,lifestyle,13,Honeycomb Blast Choc Bar recalled over hidden milk ingredient,https://timesofindia.indiatimes.com/articleshow/131696120.cms,2026-06-13T03:24:09+00:00
TOI Life & Style,https://timesofindia.indiatimes.com/life-style,lifestyle,14,"Laid off at 29 with ₹5 crore net worth, man asks Reddit: ‘Should I be satisfied or heartbroken?’",https://timesofindia.indiatimes.com/articleshow/131692310.cms,2026-06-13T03:24:09+00:00
TOI Life & Style,https://timesofindia.indiatimes.com/life-style,lifestyle,15,"Meet Vik Bajaj: Indian-origin scientist helping Jeff Bezos build Prometheus, world’s most highly valued AI startup",https://timesofindia.indiatimes.com/articleshow/131692212.cms,2026-06-13T03:24:09+00:00
TOI Life & Style,https://timesofindia.indiatimes.com/life-style,lifestyle,16,"After Pranit More’s ‘Rs370 Ki Biryani’, comedian Madhur Virli’s brutal 'cuddle' joke has the internet enraged",https://timesofindia.indiatimes.com/articleshow/131691900.cms,2026-06-13T03:24:09+00:00
TOI Life & Style,https://timesofindia.indiatimes.com/life-style,lifestyle,17,'I don't wear a watch': Nvidia CEO Jensen Huang reveals the best career advice he ever received,https://timesofindia.indiatimes.com/articleshow/131690098.cms,2026-06-13T03:24:09+00:00
TOI Life & Style,https://timesofindia.indiatimes.com/life-style,lifestyle,18,"Quote of the day for children by Ralph Waldo Emerson: “What lies behind us and what lies before us are tiny matters compared to what...""",https://timesofindia.indiatimes.com/articleshow/131683121.cms,2026-06-13T03:24:09+00:00
TOI Life & Style,https://timesofindia.indiatimes.com/life-style,lifestyle,19,"Jigar Naik set to become this Odisha village's first IITian; before that, his mother had to win a much harder battle",https://timesofindia.indiatimes.com/articleshow/131676224.cms,2026-06-13T03:24:09+00:00
TOI Life & Style,https://timesofindia.indiatimes.com/life-style,lifestyle,20,5 beautiful signs your guardian angel may be trying to reach you,https://timesofindia.indiatimes.com/articleshow/131678111.cms,2026-06-13T03:24:09+00:00
TOI Life & Style,https://timesofindia.indiatimes.com/life-style,lifestyle,21,"Quote of the day by Sadhguru: ""Love is self-annihilation. It happens when you fall, not in calculation or convenience.""",https://timesofindia.indiatimes.com/articleshow/131648459.cms,2026-06-13T03:24:09+00:00
TOI Life & Style,https://timesofindia.indiatimes.com/life-style,lifestyle,22,"Quote of the day by Neem Karoli Baba: “Forgiveness is the greatest weapon, because a saint so armed is unperturbable… he can give up anger immediately.”",https://timesofindia.indiatimes.com/articleshow/131624425.cms,2026-06-13T03:24:09+00:00
