source,source_url,category,rank,headline,link,collected_at_iso
ET Panache Health,https://economictimes.indiatimes.com/magazines/panache/health,health,1,FMT eases pain. Ask an ex-boxer!,https://economictimes.indiatimes.com/articleshow/49323452.cms,2026-07-01T03:29:40+00:00
ET Panache Health,https://economictimes.indiatimes.com/magazines/panache/health,health,2,"At 46, Ankur Warikoo reached 13% body fat. Here are the habits he swears by",https://economictimes.indiatimes.com/articleshow/132104665.cms,2026-07-01T03:29:40+00:00
ET Panache Health,https://economictimes.indiatimes.com/magazines/panache/health,health,3,"650g cucumber, 20g namkeen: Top nutritionist reveals how different 100 calories can look",https://economictimes.indiatimes.com/articleshow/131925111.cms,2026-07-01T03:29:40+00:00
ET Panache Health,https://economictimes.indiatimes.com/magazines/panache/health,health,4,Is boba tea healthy? Harvard-trained gut doctor shares 8 common foods that may be harming your digestive health,https://economictimes.indiatimes.com/articleshow/131905725.cms,2026-07-01T03:29:40+00:00
ET Panache Health,https://economictimes.indiatimes.com/magazines/panache/health,health,5,Top neurologist lost 29 kilos. He also lowered his resting heart rate from 70 to 40. Here's how he did it,https://economictimes.indiatimes.com/articleshow/131901232.cms,2026-07-01T03:29:40+00:00
ET Panache Health,https://economictimes.indiatimes.com/magazines/panache/health,health,6,"High blood pressure? Top nutritionist reveals the fruits, vegetables and seeds to add to your diet",https://economictimes.indiatimes.com/articleshow/131888878.cms,2026-07-01T03:29:40+00:00
ET Panache Health,https://economictimes.indiatimes.com/magazines/panache/health,health,7,"Avocados, smoothies, muesli: Celebrity nutritionist reveals 5 healthy foods that may be secretly slowing your weight loss",https://economictimes.indiatimes.com/articleshow/131873849.cms,2026-07-01T03:29:40+00:00
ET Panache Health,https://economictimes.indiatimes.com/magazines/panache/health,health,8,"Correct sleep posture, mindful eating, mini walks: Harvard-trained gut doctor shares 6 simple ways to manage acid reflux naturally",https://economictimes.indiatimes.com/articleshow/131873775.cms,2026-07-01T03:29:40+00:00
ET Panache Health,https://economictimes.indiatimes.com/magazines/panache/health,health,9,"Hair fall bothering you? Top nutritionist shares 5 simple foods for stronger, healthier hair",https://economictimes.indiatimes.com/articleshow/131858777.cms,2026-07-01T03:29:40+00:00
ET Panache Health,https://economictimes.indiatimes.com/magazines/panache/health,health,10,"4 meals, 40 g fibre: Top nutritionist shares simple foods to help you meet your daily fibre goals",https://economictimes.indiatimes.com/articleshow/131836637.cms,2026-07-01T03:29:40+00:00
ET Panache Health,https://economictimes.indiatimes.com/magazines/panache/health,health,11,Techie kept getting migraines every Saturday. Top neurologist points to one hidden reason,https://economictimes.indiatimes.com/articleshow/131697400.cms,2026-07-01T03:29:40+00:00
ET Panache Health,https://economictimes.indiatimes.com/magazines/panache/health,health,12,Is a traditional Indian thali unhealthy? Celebrity nutritionist shares 5 common mistakes people make,https://economictimes.indiatimes.com/articleshow/131672908.cms,2026-07-01T03:29:40+00:00
ET Panache Health,https://economictimes.indiatimes.com/magazines/panache/health,health,13,Waking up tired every day? Harvard-trained gut doctor shares 10 simple habits that can improve sleep quality naturally,https://economictimes.indiatimes.com/articleshow/131593756.cms,2026-07-01T03:29:40+00:00
ET Panache Health,https://economictimes.indiatimes.com/magazines/panache/health,health,14,"Is travelling bad for human body? 3 troubling findings revealed by Bryan Johnson after recent trip, calls travel ‘barbaric’",https://economictimes.indiatimes.com/articleshow/131348522.cms,2026-07-01T03:29:40+00:00
ET Panache Health,https://economictimes.indiatimes.com/magazines/panache/health,health,15,Frequent acidity and heartburn? Celebrity nutritionist shares 3 simple steps to support healthy digestion naturally,https://economictimes.indiatimes.com/articleshow/131312478.cms,2026-07-01T03:29:40+00:00
ET Panache Health,https://economictimes.indiatimes.com/magazines/panache/health,health,16,Not stocks. Doctor says his best investment is a avocado plant that he planted 4 years ago at a cost of Rs 250,https://economictimes.indiatimes.com/articleshow/131302658.cms,2026-07-01T03:29:40+00:00
ET Panache Health,https://economictimes.indiatimes.com/magazines/panache/health,health,17,No equipment or brain games. Just 2 minutes hand exercises to boost brain health and prevent Dementia,https://economictimes.indiatimes.com/articleshow/131259427.cms,2026-07-01T03:29:40+00:00
ET Panache Health,https://economictimes.indiatimes.com/magazines/panache/health,health,18,"1 fruit, 5 benefits: Top nutritionist shares why having raw amla on an empty stomach can improve overall health",https://economictimes.indiatimes.com/articleshow/131228614.cms,2026-07-01T03:29:40+00:00
ET Panache Health,https://economictimes.indiatimes.com/magazines/panache/health,health,19,A common US tick bite can make you allergic to meat. Doctors warn of a strange syndrome,https://economictimes.indiatimes.com/articleshow/131222664.cms,2026-07-01T03:29:40+00:00
ET Panache Health,https://economictimes.indiatimes.com/magazines/panache/health,health,20,Pushpa 2 Online Leaked,https://economictimes.indiatimes.com/articleshow/115993157.cms,2026-07-01T03:29:40+00:00
ET Panache Health,https://economictimes.indiatimes.com/magazines/panache/health,health,21,Google Doodle Staurikosaurus,https://economictimes.indiatimes.com/articleshow/114370181.cms,2026-07-01T03:29:40+00:00
ET Panache Health,https://economictimes.indiatimes.com/magazines/panache/health,health,22,Google rejects‘too good’employee,https://economictimes.indiatimes.com/articleshow/114371359.cms,2026-07-01T03:29:40+00:00
ET Panache Health,https://economictimes.indiatimes.com/magazines/panache/health,health,23,Priyanka flashes belly button rings,https://economictimes.indiatimes.com/articleshow/114372935.cms,2026-07-01T03:29:40+00:00
ET Panache Health,https://economictimes.indiatimes.com/magazines/panache/health,health,24,Amid Lawrence Bishnoi,https://economictimes.indiatimes.com/articleshow/114367306.cms,2026-07-01T03:29:40+00:00
ET Panache Health,https://economictimes.indiatimes.com/magazines/panache/health,health,25,Varun Dhawan Samantha,https://economictimes.indiatimes.com/articleshow/114368753.cms,2026-07-01T03:29:40+00:00
ET Panache Health,https://economictimes.indiatimes.com/magazines/panache/health,health,26,Akshay Kumar COVID News,https://economictimes.indiatimes.com/articleshow/111685146.cms,2026-07-01T03:29:40+00:00
ET Panache Health,https://economictimes.indiatimes.com/magazines/panache/health,health,27,Sarfira Movie Review,https://economictimes.indiatimes.com/articleshow/111677493.cms,2026-07-01T03:29:40+00:00
ET Panache Health,https://economictimes.indiatimes.com/magazines/panache/health,health,28,Cristiano Ronaldo Retirement,https://economictimes.indiatimes.com/articleshow/111438820.cms,2026-07-01T03:29:40+00:00
ET Panache Health,https://economictimes.indiatimes.com/magazines/panache/health,health,29,Sonakshi Sinha Wedding,https://economictimes.indiatimes.com/articleshow/111203848.cms,2026-07-01T03:29:40+00:00
ET Panache Health,https://economictimes.indiatimes.com/magazines/panache/health,health,30,Sania Mirza Mohammed Shami,https://economictimes.indiatimes.com/articleshow/111157002.cms,2026-07-01T03:29:40+00:00
ET Panache Health,https://economictimes.indiatimes.com/magazines/panache/health,health,31,Bigg Boss OTT 3,https://economictimes.indiatimes.com/articleshow/111104026.cms,2026-07-01T03:29:40+00:00
ET Panache Health,https://economictimes.indiatimes.com/magazines/panache/health,health,32,Panchayat Season 3 OTT Release,https://economictimes.indiatimes.com/articleshow/110140474.cms,2026-07-01T03:29:40+00:00
ET Panache Health,https://economictimes.indiatimes.com/magazines/panache/health,health,33,Cannes 2024 Live Streaming,https://economictimes.indiatimes.com/articleshow/110116799.cms,2026-07-01T03:29:40+00:00
ET Panache Health,https://economictimes.indiatimes.com/magazines/panache/health,health,34,Pavitra Jayaram Death,https://economictimes.indiatimes.com/articleshow/110069299.cms,2026-07-01T03:29:40+00:00
ET Panache Health,https://economictimes.indiatimes.com/magazines/panache/health,health,35,Rituraj Singh Death,https://economictimes.indiatimes.com/articleshow/107842242.cms,2026-07-01T03:29:40+00:00
ET Panache Health,https://economictimes.indiatimes.com/magazines/panache/health,health,36,Fear and anger brew inside Meta amid AI frenzy,https://economictimes.indiatimes.com/articleshow/132104382.cms,2026-07-01T03:29:40+00:00
ET Panache Health,https://economictimes.indiatimes.com/magazines/panache/health,health,37,Powerball jackpot surges to $375 million for July 1 drawing - What the winner could actually take home on Wednesday night,https://economictimes.indiatimes.com/articleshow/132104638.cms,2026-07-01T03:29:40+00:00
ET Panache Health,https://economictimes.indiatimes.com/magazines/panache/health,health,38,"Several feared dead after bus catches fire following collision on Dausa's Jaipur-Bandikui expressway in Rajasthan, atleast 25 escape",https://economictimes.indiatimes.com/articleshow/132104712.cms,2026-07-01T03:29:40+00:00
ET Panache Health,https://economictimes.indiatimes.com/magazines/panache/health,health,39,Kotak reclaims India ECM lead with mega deals on horizon,https://economictimes.indiatimes.com/articleshow/132104682.cms,2026-07-01T03:29:40+00:00
ET Panache Health,https://economictimes.indiatimes.com/magazines/panache/health,health,40,FIFA World Cup 2026 top scorers: Who is leading the Golden Boot race?,https://economictimes.indiatimes.com/articleshow/132104535.cms,2026-07-01T03:29:40+00:00
ET Panache Health,https://economictimes.indiatimes.com/magazines/panache/health,health,41,Afghan air force strikes ISIS targets inside Pakistan; warns 'we'll target every threat',https://economictimes.indiatimes.com/articleshow/132104818.cms,2026-07-01T03:29:40+00:00
ET Panache Health,https://economictimes.indiatimes.com/magazines/panache/health,health,42,Asset servicing startup Dovetail Capital raises Rs 100 crore in funding from Elev8 Venture Partners,https://economictimes.indiatimes.com/articleshow/132104797.cms,2026-07-01T03:29:40+00:00
ET Panache Health,https://economictimes.indiatimes.com/magazines/panache/health,health,43,"if(typeof objAd !=""undefined""){ objAd.loadAds(); } Kerala Lottery Sthree Sakthi SS-526 result today (30-06-2026): Check Rs 1 crore prize winning number and full list here",https://economictimes.indiatimes.com/articleshow/132088434.cms,2026-07-01T03:29:40+00:00
ET Panache Health,https://economictimes.indiatimes.com/magazines/panache/health,health,44,Slumdogs no more: Can tycoons take the Mumbai Model to other cities?,https://economictimes.indiatimes.com/articleshow/132089928.cms,2026-07-01T03:29:40+00:00
ET Panache Health,https://economictimes.indiatimes.com/magazines/panache/health,health,45,Quote of the Day by Mother Teresa: ‘Some people come in our life as blessings; some come in your life as lessons’ - why not everyone is meant to stay in your life explained by Saint Teresa of Calcutta,https://economictimes.indiatimes.com/articleshow/132088903.cms,2026-07-01T03:29:40+00:00
ET Panache Health,https://economictimes.indiatimes.com/magazines/panache/health,health,46,"if(typeof objAd !=""undefined""){ objAd.loadAds(); } A pail of water may unleash India's ₹20 lakh crore opportunity",https://economictimes.indiatimes.com/articleshow/132086740.cms,2026-07-01T03:29:40+00:00
ET Panache Health,https://economictimes.indiatimes.com/magazines/panache/health,health,47,"if(typeof objAd !=""undefined""){ objAd.loadAds(); } How Ambani built Project Jupiter to launch India’s biggest IPO",https://economictimes.indiatimes.com/articleshow/132082679.cms,2026-07-01T03:29:40+00:00
ET Panache Health,https://economictimes.indiatimes.com/magazines/panache/health,health,48,"if(typeof objAd !=""undefined""){ objAd.loadAds(); } India's next stock market headache isn't oil but a bigger storm brewing in the skies",https://economictimes.indiatimes.com/articleshow/132083174.cms,2026-07-01T03:29:40+00:00
ET Panache Health,https://economictimes.indiatimes.com/magazines/panache/health,health,49,"As new Rajya Sabha MPs take oath, NDA edges closer to two-thirds mark",https://economictimes.indiatimes.com/articleshow/132083917.cms,2026-07-01T03:29:40+00:00
ET Panache Health,https://economictimes.indiatimes.com/magazines/panache/health,health,50,"if(typeof objAd !=""undefined""){ objAd.loadAds(); } Quote of the Day by Bruce Willis: “Who I am as a father is far more important to me than… – Inspiring lessons on parenting, fatherhood, sacrifice, perception, responsibility and why family matters more than public recognition by the American actor known for his deep insights into family values, resilience, and authentic living",https://economictimes.indiatimes.com/articleshow/132074881.cms,2026-07-01T03:29:40+00:00
ET Panache Health,https://economictimes.indiatimes.com/magazines/panache/health,health,51,"if(typeof objAd !=""undefined""){ objAd.loadAds(); } Gold rate today (June 30, 2026): Check 24k, 22k, 20k and 18k gold jewellery prices from IBJA, Joyalukkas, Malabar Gold & Diamonds and Tanishq in Delhi, Mumbai, Hyderabad, other cities",https://economictimes.indiatimes.com/articleshow/132087561.cms,2026-07-01T03:29:40+00:00
ET Panache Health,https://economictimes.indiatimes.com/magazines/panache/health,health,52,India plans to add strategic fuel reserves after Iran war shock,https://economictimes.indiatimes.com/articleshow/132087132.cms,2026-07-01T03:29:40+00:00
ET Panache Health,https://economictimes.indiatimes.com/magazines/panache/health,health,53,QR code in red envelope leads to “invite-only” Instagram page: What we know so far,https://economictimes.indiatimes.com/articleshow/121338235.cms,2026-07-01T03:29:40+00:00
ET Panache Health,https://economictimes.indiatimes.com/magazines/panache/health,health,54,"if(typeof objAd !=""undefined""){ objAd.loadAds(); } India's youngest self-made billionaire is looking for a room on D-Street",https://economictimes.indiatimes.com/articleshow/132087953.cms,2026-07-01T03:29:40+00:00
ET Panache Health,https://economictimes.indiatimes.com/magazines/panache/health,health,55,"if(typeof objAd !=""undefined""){ objAd.loadAds(); } India's much-delayed bullet train project picks up speed",https://economictimes.indiatimes.com/articleshow/132083170.cms,2026-07-01T03:29:40+00:00
ET Panache Health,https://economictimes.indiatimes.com/magazines/panache/health,health,56,'BJP looted Ram Mandir more than Ghaznavi': UBT Sena MP Sanjay Raut,https://economictimes.indiatimes.com/articleshow/132088893.cms,2026-07-01T03:29:40+00:00
ET Panache Health,https://economictimes.indiatimes.com/magazines/panache/health,health,57,"if(typeof objAd !=""undefined""){ objAd.loadAds(); } Greek proverb of the day: 'A fox is not caught twice in the...' - motivational saying teaches why past mistakes can become life’s greatest lessons",https://economictimes.indiatimes.com/articleshow/132077514.cms,2026-07-01T03:29:40+00:00
ET Panache Health,https://economictimes.indiatimes.com/magazines/panache/health,health,58,"Go to Horoscope Today, 1 July, 2026 Page",https://economictimes.indiatimes.com/articleshow/132095182.cms,2026-07-01T03:29:40+00:00
ET Panache Health,https://economictimes.indiatimes.com/magazines/panache/health,health,59,"Go to Horoscope Tomorrow, July 1, 2026 Page",https://economictimes.indiatimes.com/articleshow/132085665.cms,2026-07-01T03:29:40+00:00
ET Panache Health,https://economictimes.indiatimes.com/magazines/panache/health,health,60,"Go to Horoscope Today, 30 June, 2026 Page",https://economictimes.indiatimes.com/articleshow/132074407.cms,2026-07-01T03:29:40+00:00
ET Panache Health,https://economictimes.indiatimes.com/magazines/panache/health,health,61,Go to Happy Father’s Day Wishes 2026 Page,https://economictimes.indiatimes.com/articleshow/131885271.cms,2026-07-01T03:29:40+00:00
ET Panache Health,https://economictimes.indiatimes.com/magazines/panache/health,health,62,Go to DoorDash Down Page,https://economictimes.indiatimes.com/articleshow/131775980.cms,2026-07-01T03:29:40+00:00
ET Panache Health,https://economictimes.indiatimes.com/magazines/panache/health,health,63,Go to Crude Oil Price Today Page,https://economictimes.indiatimes.com/articleshow/131731293.cms,2026-07-01T03:29:40+00:00
ET Panache Health,https://economictimes.indiatimes.com/magazines/panache/health,health,64,Go to IAF AN-32 aircraft crashes Page,https://economictimes.indiatimes.com/articleshow/131698440.cms,2026-07-01T03:29:40+00:00
ET Panache Health,https://economictimes.indiatimes.com/magazines/panache/health,health,65,Go to Folarin Balogun Page,https://economictimes.indiatimes.com/articleshow/131696996.cms,2026-07-01T03:29:40+00:00
ET Panache Health,https://economictimes.indiatimes.com/magazines/panache/health,health,66,Go to is Facebook Instagram messenger Down Page,https://economictimes.indiatimes.com/articleshow/131687112.cms,2026-07-01T03:29:40+00:00
ET Panache Health,https://economictimes.indiatimes.com/magazines/panache/health,health,67,Go to Maggie Smith News Page,https://economictimes.indiatimes.com/articleshow/113743204.cms,2026-07-01T03:29:40+00:00
ET Panache Health,https://economictimes.indiatimes.com/magazines/panache/health,health,68,Go to Sunita Williams Space Station Routine Page,https://economictimes.indiatimes.com/articleshow/113340209.cms,2026-07-01T03:29:40+00:00
ET Panache Health,https://economictimes.indiatimes.com/magazines/panache/health,health,69,Go to Cristiano Ronaldo Youtube Channel Page,https://economictimes.indiatimes.com/articleshow/112701776.cms,2026-07-01T03:29:40+00:00
ET Panache Health,https://economictimes.indiatimes.com/magazines/panache/health,health,70,Go to Who is Miles Routledge Page,https://economictimes.indiatimes.com/articleshow/112706059.cms,2026-07-01T03:29:40+00:00
ET Panache Health,https://economictimes.indiatimes.com/magazines/panache/health,health,71,Go to Isha Ambani Lehenga Page,https://economictimes.indiatimes.com/articleshow/111678035.cms,2026-07-01T03:29:40+00:00
ET Panache Health,https://economictimes.indiatimes.com/magazines/panache/health,health,72,South Korean trade watchdog alleges Google abused its position in Android app store,https://economictimes.indiatimes.com/articleshow/132104849.cms,2026-07-01T03:29:40+00:00
ET Panache Health,https://economictimes.indiatimes.com/magazines/panache/health,health,73,Kotak Mahindra Bank shares in focus on deal to buy Deutsche Bank’s retail business for Rs 282 crore,https://economictimes.indiatimes.com/articleshow/132104836.cms,2026-07-01T03:29:40+00:00
ET Panache Health,https://economictimes.indiatimes.com/magazines/panache/health,health,74,"KPIT Tech shares in focus as company expects Q1 revenue decline, sharp hit to margins. Crash ahead?",https://economictimes.indiatimes.com/articleshow/132105006.cms,2026-07-01T03:29:40+00:00
ET Panache Health,https://economictimes.indiatimes.com/magazines/panache/health,health,75,Trump reports over $1.4 billion in income from crypto ventures,https://economictimes.indiatimes.com/articleshow/132105018.cms,2026-07-01T03:29:40+00:00
ET Panache Health,https://economictimes.indiatimes.com/magazines/panache/health,health,76,"Japanese bond yields rise on yen weakness, fiscal worries",https://economictimes.indiatimes.com/articleshow/132105061.cms,2026-07-01T03:29:40+00:00
ET Panache Health,https://economictimes.indiatimes.com/magazines/panache/health,health,77,VB-G RAM G Act to come into force on July 1; revised wage rates notified,https://economictimes.indiatimes.com/articleshow/132105064.cms,2026-07-01T03:29:40+00:00
ET Panache Health,https://economictimes.indiatimes.com/magazines/panache/health,health,78,FIFA World Cup 2026: Haaland's late strike lifts Norway past Ivory Coast into WC Round of 16,https://economictimes.indiatimes.com/articleshow/132105075.cms,2026-07-01T03:29:40+00:00
ET Panache Lifestyle,https://economictimes.indiatimes.com/magazines/panache/lifestyle,lifestyle,1,"‘Greatest goalkeeper on 4 legs’: Meet Ronaldo, the football-loving dog with remarkable goal-saving skills",https://economictimes.indiatimes.com/articleshow/132094355.cms,2026-07-01T03:29:40+00:00
ET Panache Lifestyle,https://economictimes.indiatimes.com/magazines/panache/lifestyle,lifestyle,2,"136 years, 1 simple food tradition: Meet Mumbai’s ‘dabbawalas’ delivering fresh home-cooked meals to busy office-goers. But this iconic tiffin service is slowly disappearing",https://economictimes.indiatimes.com/articleshow/132092821.cms,2026-07-01T03:29:40+00:00
ET Panache Lifestyle,https://economictimes.indiatimes.com/magazines/panache/lifestyle,lifestyle,3,How often should you wash your bed sheets? Doctors share 6 signs your bed sheets need washing,https://economictimes.indiatimes.com/articleshow/132087692.cms,2026-07-01T03:29:40+00:00
ET Panache Lifestyle,https://economictimes.indiatimes.com/magazines/panache/lifestyle,lifestyle,4,"‘Book of the year for me’: Nikhil Kamath shares 5 books that shaped his thinking about finance, life and human behaviour",https://economictimes.indiatimes.com/articleshow/132083826.cms,2026-07-01T03:29:40+00:00
ET Panache Lifestyle,https://economictimes.indiatimes.com/magazines/panache/lifestyle,lifestyle,5,"A hearty porridge from Tamil Nadu can help you beat the heat, reduce blood sugar",https://economictimes.indiatimes.com/articleshow/132074873.cms,2026-07-01T03:29:40+00:00
ET Panache Lifestyle,https://economictimes.indiatimes.com/magazines/panache/lifestyle,lifestyle,6,"After 5 years of hide and seek, Assam's most elusive animal finally spotted in wildlife park",https://economictimes.indiatimes.com/articleshow/132072909.cms,2026-07-01T03:29:40+00:00
ET Panache Lifestyle,https://economictimes.indiatimes.com/magazines/panache/lifestyle,lifestyle,7,Dreaming of moving to the mountains? Delhi couple living in Manali warns against 3 common mistakes,https://economictimes.indiatimes.com/articleshow/132070960.cms,2026-07-01T03:29:40+00:00
ET Panache Lifestyle,https://economictimes.indiatimes.com/magazines/panache/lifestyle,lifestyle,8,"No cutting trees yet, 200% stronger wood: Japan’s 600-year-old technique for producing wood is a lesson on sustainable forestry",https://economictimes.indiatimes.com/articleshow/132069942.cms,2026-07-01T03:29:40+00:00
ET Panache Lifestyle,https://economictimes.indiatimes.com/magazines/panache/lifestyle,lifestyle,9,Quote of the day by Bob Dylan: ‘Take care of all your memories as you cannot relive them. And remember when you are out there’ ; American music icon’s lesson on cherishing the past remains timeless’,https://economictimes.indiatimes.com/articleshow/132067558.cms,2026-07-01T03:29:40+00:00
ET Panache Lifestyle,https://economictimes.indiatimes.com/magazines/panache/lifestyle,lifestyle,10,Imtiaz Ali's Main Vaapas Aaunga is winning hearts and the box office. Here are 7 unforgettable Partition books you shouldn't miss,https://economictimes.indiatimes.com/articleshow/132064001.cms,2026-07-01T03:29:40+00:00
ET Panache Lifestyle,https://economictimes.indiatimes.com/magazines/panache/lifestyle,lifestyle,11,7 fruits you can grow at home that most people don’t know about,https://economictimes.indiatimes.com/articleshow/132065170.cms,2026-07-01T03:29:40+00:00
ET Panache Lifestyle,https://economictimes.indiatimes.com/magazines/panache/lifestyle,lifestyle,12,"No AC, no sugary soft drinks: Kareena Kapoor Khan’s nutritionist Rujuta Diwekar shares three natural, desi hacks to beat the heat at home",https://economictimes.indiatimes.com/articleshow/132055063.cms,2026-07-01T03:29:40+00:00
ET Panache Lifestyle,https://economictimes.indiatimes.com/magazines/panache/lifestyle,lifestyle,13,"Mahesh Babu’s nutritionist reveals one desi drink, that costs just Rs 20, can reduce blood sugar, fasten weight loss",https://economictimes.indiatimes.com/articleshow/132053345.cms,2026-07-01T03:29:40+00:00
ET Panache Lifestyle,https://economictimes.indiatimes.com/magazines/panache/lifestyle,lifestyle,14,"Before you fly, check your bag: These 4 everyday items could put your flight journey at risk if packed incorrectly",https://economictimes.indiatimes.com/articleshow/132050466.cms,2026-07-01T03:29:40+00:00
ET Panache Lifestyle,https://economictimes.indiatimes.com/magazines/panache/lifestyle,lifestyle,15,"Tamannaah Bhatia’s dietician says one so-called junk food, can actually help you lose weight and have clearer skin",https://economictimes.indiatimes.com/articleshow/132050619.cms,2026-07-01T03:29:40+00:00
ET Panache Lifestyle,https://economictimes.indiatimes.com/magazines/panache/lifestyle,lifestyle,16,'Don't make dates complicated': Ankur Warikoo shares 5 budget-friendly ideas to help couples connect better,https://economictimes.indiatimes.com/articleshow/132048632.cms,2026-07-01T03:29:40+00:00
ET Panache Lifestyle,https://economictimes.indiatimes.com/magazines/panache/lifestyle,lifestyle,17,"White-sand beaches, medieval charm, stunning skylines: 5 of the world's most beautiful cities every traveller should visit",https://economictimes.indiatimes.com/articleshow/132048159.cms,2026-07-01T03:29:40+00:00
ET Panache Lifestyle,https://economictimes.indiatimes.com/magazines/panache/lifestyle,lifestyle,18,Healing begins when you stop eating. TV actor Gurmeet Chaudhary says how fasting changed his health. He shares 2 habits behind his fitness routine,https://economictimes.indiatimes.com/articleshow/132047495.cms,2026-07-01T03:29:40+00:00
