source,source_url,category,rank,headline,link,collected_at_iso
ET Panache Worklife,https://economictimes.indiatimes.com/magazines/panache/worklife,worklife,27,Cristiano Ronaldo Retirement,https://economictimes.indiatimes.com/articleshow/111438820.cms,2026-04-13T09:52:31+00:00
ET Panache Worklife,https://economictimes.indiatimes.com/magazines/panache/worklife,worklife,28,Sonakshi Sinha Wedding,https://economictimes.indiatimes.com/articleshow/111203848.cms,2026-04-13T09:52:31+00:00
ET Panache Worklife,https://economictimes.indiatimes.com/magazines/panache/worklife,worklife,29,Sania Mirza Mohammed Shami,https://economictimes.indiatimes.com/articleshow/111157002.cms,2026-04-13T09:52:31+00:00
ET Panache Worklife,https://economictimes.indiatimes.com/magazines/panache/worklife,worklife,30,Bigg Boss OTT 3,https://economictimes.indiatimes.com/articleshow/111104026.cms,2026-04-13T09:52:31+00:00
ET Panache Worklife,https://economictimes.indiatimes.com/magazines/panache/worklife,worklife,31,Panchayat Season 3 OTT Release,https://economictimes.indiatimes.com/articleshow/110140474.cms,2026-04-13T09:52:31+00:00
ET Panache Worklife,https://economictimes.indiatimes.com/magazines/panache/worklife,worklife,32,Cannes 2024 Live Streaming,https://economictimes.indiatimes.com/articleshow/110116799.cms,2026-04-13T09:52:31+00:00
ET Panache Worklife,https://economictimes.indiatimes.com/magazines/panache/worklife,worklife,33,Pavitra Jayaram Death,https://economictimes.indiatimes.com/articleshow/110069299.cms,2026-04-13T09:52:31+00:00
ET Panache Worklife,https://economictimes.indiatimes.com/magazines/panache/worklife,worklife,34,Rituraj Singh Death,https://economictimes.indiatimes.com/articleshow/107842242.cms,2026-04-13T09:52:31+00:00
ET Panache Worklife,https://economictimes.indiatimes.com/magazines/panache/worklife,worklife,35,''I cry a lot in the bathroom': How Shah Rukh Khan turns failures into a blockbuster comebacks,https://economictimes.indiatimes.com/articleshow/130230608.cms,2026-04-13T09:52:31+00:00
ET Panache Worklife,https://economictimes.indiatimes.com/magazines/panache/worklife,worklife,36,Discretionary spending slows in India as uncertainty keeps consumer purchases at a bare minimum,https://economictimes.indiatimes.com/articleshow/130231920.cms,2026-04-13T09:52:31+00:00
ET Panache Worklife,https://economictimes.indiatimes.com/magazines/panache/worklife,worklife,37,"Sunrisers Hyderabad vs Rajasthan Royals: Check pitch report, weather update and more",https://economictimes.indiatimes.com/articleshow/130232049.cms,2026-04-13T09:52:31+00:00
ET Panache Worklife,https://economictimes.indiatimes.com/magazines/panache/worklife,worklife,38,Mark Zuckerberg 2.0: Meta is creating an AI version of CEO to take his place,https://economictimes.indiatimes.com/articleshow/130231930.cms,2026-04-13T09:52:31+00:00
ET Panache Worklife,https://economictimes.indiatimes.com/magazines/panache/worklife,worklife,39,"Pakistan stock markets crash: KSE 100 plunges 6,000 points as US-Iran ceasefire talks collapse",https://economictimes.indiatimes.com/articleshow/130232102.cms,2026-04-13T09:52:31+00:00
ET Panache Worklife,https://economictimes.indiatimes.com/magazines/panache/worklife,worklife,40,"You can now invest in fixed deposits on Zerodha's Coin: Rates, banks and how it works",https://economictimes.indiatimes.com/articleshow/130232154.cms,2026-04-13T09:52:31+00:00
ET Panache Worklife,https://economictimes.indiatimes.com/magazines/panache/worklife,worklife,41,"Noida protest: Cars set on fire, stones pelted during salary hike unrest; Watch video",https://economictimes.indiatimes.com/articleshow/130227194.cms,2026-04-13T09:52:31+00:00
ET Panache Worklife,https://economictimes.indiatimes.com/magazines/panache/worklife,worklife,42,"if(typeof objAd !=""undefined""){ objAd.loadAds(); } Two supertankers including Pakistan-flagged ship take a u-turn at Hormuz as US-Iran talks collapse",https://economictimes.indiatimes.com/articleshow/130203144.cms,2026-04-13T09:52:31+00:00
ET Panache Worklife,https://economictimes.indiatimes.com/magazines/panache/worklife,worklife,43,Sold property for Rs 94 lakh but lost Rs 21 lakh TDS due to buyer’s error; How Form 71 helped seller win relief from ITAT Delhi,https://economictimes.indiatimes.com/articleshow/130191667.cms,2026-04-13T09:52:31+00:00
ET Panache Worklife,https://economictimes.indiatimes.com/magazines/panache/worklife,worklife,44,"if(typeof objAd !=""undefined""){ objAd.loadAds(); } AP Inter results 2026 Date and Time: When and how to download scores from bie.ap.gov.in, past trends, other alternative ways and more",https://economictimes.indiatimes.com/articleshow/130201485.cms,2026-04-13T09:52:31+00:00
ET Panache Worklife,https://economictimes.indiatimes.com/magazines/panache/worklife,worklife,45,"if(typeof objAd !=""undefined""){ objAd.loadAds(); } Donald Trump orders Strait of Hormuz blockade, warns any Iranian firing at US could be ‘blown to hell’",https://economictimes.indiatimes.com/articleshow/130208585.cms,2026-04-13T09:52:31+00:00
ET Panache Worklife,https://economictimes.indiatimes.com/magazines/panache/worklife,worklife,46,"if(typeof objAd !=""undefined""){ objAd.loadAds(); } bie.ap.gov.in AP Inter Results 2026 Alternative Websites: Official website not working? How to check results on Manabadi portal, via SMS service and more",https://economictimes.indiatimes.com/articleshow/130201901.cms,2026-04-13T09:52:31+00:00
ET Panache Worklife,https://economictimes.indiatimes.com/magazines/panache/worklife,worklife,47,"India rejects China’s ‘fictitious’ renaming of places, reaffirms Arunachal as integral territory",https://economictimes.indiatimes.com/articleshow/130207378.cms,2026-04-13T09:52:31+00:00
ET Panache Worklife,https://economictimes.indiatimes.com/magazines/panache/worklife,worklife,48,"if(typeof objAd !=""undefined""){ objAd.loadAds(); } Kerala Lottery Samrudhi SM-50 Result Today (April 12, 2026): Top prize Rs 1 crore, full list here",https://economictimes.indiatimes.com/articleshow/130204748.cms,2026-04-13T09:52:31+00:00
ET Panache Worklife,https://economictimes.indiatimes.com/magazines/panache/worklife,worklife,49,"if(typeof objAd !=""undefined""){ objAd.loadAds(); } From setbacks to second wind, what next for Ola and Bhavish Aggarwal?",https://economictimes.indiatimes.com/articleshow/130202152.cms,2026-04-13T09:52:31+00:00
ET Panache Worklife,https://economictimes.indiatimes.com/magazines/panache/worklife,worklife,50,Inside America’s ‘final and best offer’ for Iran as 21-hour talks fail,https://economictimes.indiatimes.com/articleshow/130205882.cms,2026-04-13T09:52:31+00:00
ET Panache Worklife,https://economictimes.indiatimes.com/magazines/panache/worklife,worklife,51,QR code in red envelope leads to “invite-only” Instagram page: What we know so far,https://economictimes.indiatimes.com/articleshow/121338235.cms,2026-04-13T09:52:31+00:00
ET Panache Worklife,https://economictimes.indiatimes.com/magazines/panache/worklife,worklife,52,"if(typeof objAd !=""undefined""){ objAd.loadAds(); } Asha Bhosle, a defining voice of Hindi cinema, passes away at 92",https://economictimes.indiatimes.com/articleshow/130203356.cms,2026-04-13T09:52:31+00:00
ET Panache Worklife,https://economictimes.indiatimes.com/magazines/panache/worklife,worklife,53,"if(typeof objAd !=""undefined""){ objAd.loadAds(); } No soap, no facewash. Priyanka Chopra’s mother shares her one simple skincare routine for glowing skin and the actress follows it too. What is it?",https://economictimes.indiatimes.com/articleshow/130203193.cms,2026-04-13T09:52:31+00:00
ET Panache Worklife,https://economictimes.indiatimes.com/magazines/panache/worklife,worklife,54,A panicked race for barrels grips the global oil market,https://economictimes.indiatimes.com/articleshow/130205268.cms,2026-04-13T09:52:31+00:00
ET Panache Worklife,https://economictimes.indiatimes.com/magazines/panache/worklife,worklife,55,"if(typeof objAd !=""undefined""){ objAd.loadAds(); } Iran and US fail to reach a deal after 21 hours of negotiations in Pakistan, says J D Vance",https://economictimes.indiatimes.com/articleshow/130201480.cms,2026-04-13T09:52:31+00:00
ET Panache Worklife,https://economictimes.indiatimes.com/magazines/panache/worklife,worklife,56,Go to Stock Market Crash Today Page,https://economictimes.indiatimes.com/articleshow/130224414.cms,2026-04-13T09:52:31+00:00
ET Panache Worklife,https://economictimes.indiatimes.com/magazines/panache/worklife,worklife,57,"Go to Horoscope Tomorrow, 14 April 2026 Page",https://economictimes.indiatimes.com/articleshow/130226097.cms,2026-04-13T09:52:31+00:00
ET Panache Worklife,https://economictimes.indiatimes.com/magazines/panache/worklife,worklife,58,"Go to Horoscope Today, 13 April, 2026 Page",https://economictimes.indiatimes.com/articleshow/130209909.cms,2026-04-13T09:52:31+00:00
ET Panache Worklife,https://economictimes.indiatimes.com/magazines/panache/worklife,worklife,59,Go to Telangana TS Inter Results 2026 Page,https://economictimes.indiatimes.com/articleshow/130201602.cms,2026-04-13T09:52:31+00:00
ET Panache Worklife,https://economictimes.indiatimes.com/magazines/panache/worklife,worklife,60,Go to TCS Q4 Results FY26 Page,https://economictimes.indiatimes.com/articleshow/130140134.cms,2026-04-13T09:52:31+00:00
ET Panache Worklife,https://economictimes.indiatimes.com/magazines/panache/worklife,worklife,61,Go to Ola Electric share price Page,https://economictimes.indiatimes.com/articleshow/130132379.cms,2026-04-13T09:52:31+00:00
ET Panache Worklife,https://economictimes.indiatimes.com/magazines/panache/worklife,worklife,62,Go to DA hike delay news Page,https://economictimes.indiatimes.com/articleshow/130119625.cms,2026-04-13T09:52:31+00:00
ET Panache Worklife,https://economictimes.indiatimes.com/magazines/panache/worklife,worklife,63,Go to Eli Lilly Foundayo weight loss pill price Page,https://economictimes.indiatimes.com/articleshow/129980299.cms,2026-04-13T09:52:31+00:00
ET Panache Worklife,https://economictimes.indiatimes.com/magazines/panache/worklife,worklife,64,Go to SBI Server UPI Down Today Page,https://economictimes.indiatimes.com/articleshow/129945441.cms,2026-04-13T09:52:31+00:00
ET Panache Worklife,https://economictimes.indiatimes.com/magazines/panache/worklife,worklife,65,Go to 22k Gold Rate Today Page,https://economictimes.indiatimes.com/articleshow/129896445.cms,2026-04-13T09:52:31+00:00
ET Panache Worklife,https://economictimes.indiatimes.com/magazines/panache/worklife,worklife,66,Go to IRB Infrastructure share price Page,https://economictimes.indiatimes.com/articleshow/129891969.cms,2026-04-13T09:52:31+00:00
ET Panache Worklife,https://economictimes.indiatimes.com/magazines/panache/worklife,worklife,67,Go to Eid Mubarak Wishes Page,https://economictimes.indiatimes.com/articleshow/129702609.cms,2026-04-13T09:52:31+00:00
ET Panache Worklife,https://economictimes.indiatimes.com/magazines/panache/worklife,worklife,68,Go to Maggie Smith News Page,https://economictimes.indiatimes.com/articleshow/113743204.cms,2026-04-13T09:52:31+00:00
ET Panache Worklife,https://economictimes.indiatimes.com/magazines/panache/worklife,worklife,69,Go to Sunita Williams Space Station Routine Page,https://economictimes.indiatimes.com/articleshow/113340209.cms,2026-04-13T09:52:31+00:00
ET Panache Worklife,https://economictimes.indiatimes.com/magazines/panache/worklife,worklife,70,Go to Cristiano Ronaldo Youtube Channel Page,https://economictimes.indiatimes.com/articleshow/112701776.cms,2026-04-13T09:52:31+00:00
ET Panache Worklife,https://economictimes.indiatimes.com/magazines/panache/worklife,worklife,71,Go to Who is Miles Routledge Page,https://economictimes.indiatimes.com/articleshow/112706059.cms,2026-04-13T09:52:31+00:00
ET Panache Worklife,https://economictimes.indiatimes.com/magazines/panache/worklife,worklife,72,Go to Isha Ambani Lehenga Page,https://economictimes.indiatimes.com/articleshow/111678035.cms,2026-04-13T09:52:31+00:00
ET Panache Worklife,https://economictimes.indiatimes.com/magazines/panache/worklife,worklife,73,"Quote of the day by Coco Chanel: ‘Fashion is not something that exists only in dresses. Fashion is in the sky, in the street, in ideas and the way we live.’",https://economictimes.indiatimes.com/articleshow/130232232.cms,2026-04-13T09:52:31+00:00
ET Panache Worklife,https://economictimes.indiatimes.com/magazines/panache/worklife,worklife,74,Transgender law must retain self-identification: Trans activist Maya Thakur,https://economictimes.indiatimes.com/articleshow/130232280.cms,2026-04-13T09:52:31+00:00
ET Panache Worklife,https://economictimes.indiatimes.com/magazines/panache/worklife,worklife,75,The Rs 1 crore sweet spot: Prestige Group's Irfan Razack says housing demand shows no signs of letting up,https://economictimes.indiatimes.com/articleshow/130232436.cms,2026-04-13T09:52:31+00:00
ET Panache Worklife,https://economictimes.indiatimes.com/magazines/panache/worklife,worklife,76,"NSE's Rs 20,000 crore mega IPO gears up for launch: Who can sell shares via OFS? Check eligibility, rules, deadlines and more",https://economictimes.indiatimes.com/articleshow/130232508.cms,2026-04-13T09:52:31+00:00
ET Panache Worklife,https://economictimes.indiatimes.com/magazines/panache/worklife,worklife,77,"Ola launches new scooters S1 X+: Check price, battery range, top speed",https://economictimes.indiatimes.com/articleshow/130231962.cms,2026-04-13T09:52:31+00:00
ET Panache Worklife,https://economictimes.indiatimes.com/magazines/panache/worklife,worklife,78,Akhilesh blames BJP policies for Noida violence over wage protest; Cong seeks solution over repression,https://economictimes.indiatimes.com/articleshow/130232423.cms,2026-04-13T09:52:31+00:00
ET Panache Worklife,https://economictimes.indiatimes.com/magazines/panache/worklife,worklife,79,"Indian woman lands 'dream job' in Germany without knowing language, reveals 4-step strategy that actually works",https://economictimes.indiatimes.com/articleshow/130232368.cms,2026-04-13T09:52:31+00:00
ET Panache Worklife,https://economictimes.indiatimes.com/magazines/panache/worklife,worklife,80,"Quote of the day by James Dent: 'Intelligence is when you spot the flaw in your boss’s reasoning. Wisdom is...' Life lessons on intelligence, work culture and success by long-time columnist and reporter",https://economictimes.indiatimes.com/articleshow/130220780.cms,2026-04-13T09:52:31+00:00
ET Panache Worklife,https://economictimes.indiatimes.com/magazines/panache/worklife,worklife,81,SWITCH Mobility completes deliveries of 100 electric buses to Mauritius,https://economictimes.indiatimes.com/articleshow/130232550.cms,2026-04-13T09:52:31+00:00
ScienceDaily,https://www.sciencedaily.com/,science,1,Scientists Were Wrong About Lifespan. Your Genes Matter Way More Than We Thought,https://www.sciencedaily.com/releases/2026/04/260411022047.htm,2026-04-13T09:52:31+00:00
ScienceDaily,https://www.sciencedaily.com/,science,2,Black Hole Wakes After 100 Million Years and Erupts Like a Cosmic Volcano,https://www.sciencedaily.com/releases/2026/04/260411022037.htm,2026-04-13T09:52:31+00:00
ScienceDaily,https://www.sciencedaily.com/,science,3,Forget Daily Pills. This Shot Works When Blood Pressure Meds Fail,https://www.sciencedaily.com/releases/2026/04/260411022035.htm,2026-04-13T09:52:31+00:00
ScienceDaily,https://www.sciencedaily.com/,science,4,Stanford Scientists Discover “Natural Ozempic” Without Side Effects,https://www.sciencedaily.com/releases/2026/04/260412221946.htm,2026-04-13T09:52:31+00:00
ScienceDaily,https://www.sciencedaily.com/,science,5,Why Ozempic Doesn’t Work for Everyone: Scientists Just Found a Hidden Reason,https://www.sciencedaily.com/releases/2026/04/260411022029.htm,2026-04-13T09:52:31+00:00
ScienceDaily,https://www.sciencedaily.com/,science,6,"Neanderthals May Have Hunted and Eaten Outsiders, Chilling Cannibalism Study Finds",https://www.sciencedaily.com/releases/2026/04/260411022044.htm,2026-04-13T09:52:31+00:00
ScienceDaily,https://www.sciencedaily.com/,science,7,"110,000-year-old Discovery Rewrites Human History: Neanderthals and Homo Sapiens Worked Together",https://www.sciencedaily.com/releases/2026/04/260412071005.htm,2026-04-13T09:52:31+00:00
ScienceDaily,https://www.sciencedaily.com/,science,8,How Aggressive Breast Cancer Turns Off the Immune System,https://www.sciencedaily.com/releases/2026/04/260411022031.htm,2026-04-13T09:52:31+00:00
ScienceDaily,https://www.sciencedaily.com/,science,9,Hidden Weak Spots in HIV and Ebola Revealed with Breakthrough Nanodisc Technology,https://www.sciencedaily.com/releases/2026/04/260411022027.htm,2026-04-13T09:52:31+00:00
ScienceDaily,https://www.sciencedaily.com/,science,10,Life on Mars? Tiny Cells Just Survived Shock Waves and Toxic Soil,https://www.sciencedaily.com/releases/2026/04/260411022033.htm,2026-04-13T09:52:31+00:00
ScienceDaily,https://www.sciencedaily.com/,science,11,The Universe Is Expanding Too Fast and Scientists Still Can’t Explain It,https://www.sciencedaily.com/releases/2026/04/260411022025.htm,2026-04-13T09:52:31+00:00
ScienceDaily,https://www.sciencedaily.com/,science,12,Early Weight Gain Is Linked to Lifelong Health Consequences,https://www.sciencedaily.com/releases/2026/04/260411022023.htm,2026-04-13T09:52:31+00:00
ScienceDaily,https://www.sciencedaily.com/,science,13,"Two Simple Eating Habits Linked to Lower Weight, Study Finds",https://www.sciencedaily.com/releases/2026/04/260411090018.htm,2026-04-13T09:52:31+00:00
ScienceDaily,https://www.sciencedaily.com/,science,14,A 67-Year-Old “crazy” Theory About Vitamin B1 Has Finally Been Proven,https://www.sciencedaily.com/releases/2026/04/260411081426.htm,2026-04-13T09:52:31+00:00
ScienceDaily,https://www.sciencedaily.com/,science,15,Your Nose Could Detect Alzheimer’s Years Before Symptoms Begin,https://www.sciencedaily.com/releases/2026/04/260411043048.htm,2026-04-13T09:52:31+00:00
ScienceDaily,https://www.sciencedaily.com/,science,16,Scientists Finally Crack Mystery of Rare COVID Vaccine Blood Clots,https://www.sciencedaily.com/releases/2026/04/260409101106.htm,2026-04-13T09:52:31+00:00
ScienceDaily,https://www.sciencedaily.com/,science,17,Gravitational Waves May Be Hidden in the Light Atoms Emit,https://www.sciencedaily.com/releases/2026/04/260409101109.htm,2026-04-13T09:52:31+00:00
ScienceDaily,https://www.sciencedaily.com/,science,18,This Superconductivity Dies Then Comes Back to Life,https://www.sciencedaily.com/releases/2026/04/260409101108.htm,2026-04-13T09:52:31+00:00
ScienceDaily,https://www.sciencedaily.com/,science,19,Dragonflies Can See a Color Humans Can’t and It Could Change Medicine,https://www.sciencedaily.com/releases/2026/04/260409101059.htm,2026-04-13T09:52:31+00:00
ScienceDaily,https://www.sciencedaily.com/,science,20,Goodbye Colonoscopy? New Stool Test Detects 90% of Colorectal Cancers,https://www.sciencedaily.com/releases/2026/04/260409221823.htm,2026-04-13T09:52:31+00:00
ScienceDaily,https://www.sciencedaily.com/,science,21,Unusual Airborne Toxin Detected in the U.S. for the First Time,https://www.sciencedaily.com/releases/2026/04/260411084441.htm,2026-04-13T09:52:31+00:00
ScienceDaily,https://www.sciencedaily.com/,science,22,Scientists Open 40-Year-Old Salmon and Find a Surprising Sign of Ocean Recovery,https://www.sciencedaily.com/releases/2026/04/260401022027.htm,2026-04-13T09:52:31+00:00
ScienceDaily,https://www.sciencedaily.com/,science,23,Scientists Shocked to Find Lab Gloves May Be Skewing Microplastics Data,https://www.sciencedaily.com/releases/2026/03/260329222938.htm,2026-04-13T09:52:31+00:00
ScienceDaily,https://www.sciencedaily.com/,science,24,This New Carbon Material Could Make Carbon Capture Far More Affordable,https://www.sciencedaily.com/releases/2026/03/260328043549.htm,2026-04-13T09:52:31+00:00
ScienceDaily,https://www.sciencedaily.com/,science,25,Scientists Say We’ve Been Treating Alzheimer’s All Wrong,https://www.sciencedaily.com/releases/2026/04/260409101111.htm,2026-04-13T09:52:31+00:00
ScienceDaily,https://www.sciencedaily.com/,science,26,A Common Nutrient Could Supercharge Cancer Treatment,https://www.sciencedaily.com/releases/2026/04/260410083114.htm,2026-04-13T09:52:31+00:00
ScienceDaily,https://www.sciencedaily.com/,science,27,Scientists Finally Uncover Why Promising Cancer Drugs Keep Failing,https://www.sciencedaily.com/releases/2026/04/260409101055.htm,2026-04-13T09:52:31+00:00
ScienceDaily,https://www.sciencedaily.com/,science,28,Scientists Just Found a Hidden “Drain” Inside the Human Brain,https://www.sciencedaily.com/releases/2026/04/260408225934.htm,2026-04-13T09:52:31+00:00
ScienceDaily,https://www.sciencedaily.com/,science,29,Brain Study Reveals Hidden Link Between Autism and ADHD,https://www.sciencedaily.com/releases/2026/04/260408225941.htm,2026-04-13T09:52:31+00:00
ScienceDaily,https://www.sciencedaily.com/,science,30,Scientists Discover Hidden Gut Trigger Behind ALS and Dementia,https://www.sciencedaily.com/releases/2026/04/260408225944.htm,2026-04-13T09:52:31+00:00
ScienceDaily,https://www.sciencedaily.com/,science,31,Your DNA Has a Secret “Second Code” That Decides Which Genes Get Silenced,https://www.sciencedaily.com/releases/2026/04/260408225946.htm,2026-04-13T09:52:31+00:00
ScienceDaily,https://www.sciencedaily.com/,science,32,The Hidden Tradeoff Behind Today’s Most Popular Weight Loss Drugs,https://www.sciencedaily.com/releases/2026/04/260408225948.htm,2026-04-13T09:52:31+00:00
ScienceDaily,https://www.sciencedaily.com/,science,33,Scientists Discover Spice Synergy That Boosts Anti-inflammation 100x,https://www.sciencedaily.com/releases/2026/04/260408225950.htm,2026-04-13T09:52:31+00:00
ScienceDaily,https://www.sciencedaily.com/,science,34,This “Rotten Egg” Brain Gas Could Be the Key to Fighting Alzheimer’s Disease,https://www.sciencedaily.com/releases/2026/04/260408225933.htm,2026-04-13T09:52:31+00:00
ScienceDaily,https://www.sciencedaily.com/,science,35,Your Brain Could Help Solve Autism and Most People Don’t Know It,https://www.sciencedaily.com/releases/2026/04/260408095346.htm,2026-04-13T09:52:31+00:00
ScienceDaily,https://www.sciencedaily.com/,science,36,Scientists Map the Brain’s Hidden Wiring Using RNA Barcodes in Major Breakthrough,https://www.sciencedaily.com/releases/2026/04/260407193848.htm,2026-04-13T09:52:31+00:00
ScienceDaily,https://www.sciencedaily.com/,science,37,Breakthrough Water Filter Removes 98% of Toxic PFAS Forever Chemicals,https://www.sciencedaily.com/releases/2026/04/260408225951.htm,2026-04-13T09:52:31+00:00
ScienceDaily,https://www.sciencedaily.com/,science,38,Scientists Discover Reversible Male Birth Control That Stops Sperm Production,https://www.sciencedaily.com/releases/2026/04/260407193844.htm,2026-04-13T09:52:31+00:00
ScienceDaily,https://www.sciencedaily.com/,science,39,Your Vitamin D Levels in Midlife Could Shape Your Brain Decades Later,https://www.sciencedaily.com/releases/2026/04/260407073850.htm,2026-04-13T09:52:31+00:00
ScienceDaily,https://www.sciencedaily.com/,science,40,Scientists Just Watched Alzheimer’s Damage Happen in Real Time,https://www.sciencedaily.com/releases/2026/04/260406192922.htm,2026-04-13T09:52:31+00:00
ScienceDaily,https://www.sciencedaily.com/,science,41,Scientists Solve 30-Year Mystery of a Hidden Nutrient That Protects the Brain and Fights Cancer,https://www.sciencedaily.com/releases/2026/04/260407004815.htm,2026-04-13T09:52:31+00:00
ScienceDaily,https://www.sciencedaily.com/,science,42,Scientists Say 7 Days of Meditation Can Rewire Your Brain,https://www.sciencedaily.com/releases/2026/04/260406192913.htm,2026-04-13T09:52:31+00:00
ScienceDaily,https://www.sciencedaily.com/,science,43,Scientists Discover Hidden Brain Switch That Tells You to Stop Eating,https://www.sciencedaily.com/releases/2026/04/260406192811.htm,2026-04-13T09:52:31+00:00
ScienceDaily,https://www.sciencedaily.com/,science,44,Scientists Find Hidden Brain Cells Helping Deadly Cancer Grow,https://www.sciencedaily.com/releases/2026/04/260405003933.htm,2026-04-13T09:52:31+00:00
ScienceDaily,https://www.sciencedaily.com/,science,45,Scientists May Have Found a Way to Keep Your Bones Strong for Life,https://www.sciencedaily.com/releases/2026/04/260406080131.htm,2026-04-13T09:52:31+00:00
ScienceDaily,https://www.sciencedaily.com/,science,46,Scientists Found a Protein That Drives Brain Aging — and How to Stop It,https://www.sciencedaily.com/releases/2026/04/260405065236.htm,2026-04-13T09:52:31+00:00
ScienceDaily,https://www.sciencedaily.com/,science,47,Artificial Saliva Made from Sugarcane Protein Protects Teeth from Acid and Decay,https://www.sciencedaily.com/releases/2026/04/260403224458.htm,2026-04-13T09:52:31+00:00
ScienceDaily,https://www.sciencedaily.com/,science,48,Deafness Reversed: One Injection Restores Hearing in Just Weeks,https://www.sciencedaily.com/releases/2026/04/260403044651.htm,2026-04-13T09:52:31+00:00
ScienceDaily,https://www.sciencedaily.com/,science,49,The World Is Getting Brighter at Night but Some Places Are Going Dark,https://www.sciencedaily.com/releases/2026/04/260409101057.htm,2026-04-13T09:52:31+00:00
ScienceDaily,https://www.sciencedaily.com/,science,50,Scientists Built a Quantum Battery That Breaks the Rules of Charging,https://www.sciencedaily.com/releases/2026/04/260403224452.htm,2026-04-13T09:52:31+00:00
ScienceDaily,https://www.sciencedaily.com/,science,51,SpaceX Starship Could Slash Travel Time to Uranus in Half,https://www.sciencedaily.com/releases/2026/04/260402042759.htm,2026-04-13T09:52:31+00:00
ScienceDaily,https://www.sciencedaily.com/,science,52,Physicists Just Solved a Strange Fusion Mystery That Stumped Experts,https://www.sciencedaily.com/releases/2026/04/260401071957.htm,2026-04-13T09:52:31+00:00
