source,source_url,category,rank,headline,link,collected_at_iso
ScienceDaily Health & Medicine,https://www.sciencedaily.com/news/health_medicine/,science,60,Scientists Finally Crack an “undruggable” Pancreatic Cancer Target and Nearly Double Survival,https://www.sciencedaily.com/releases/2026/06/260604044247.htm,2026-07-01T03:29:40+00:00
ScienceDaily Health & Medicine,https://www.sciencedaily.com/news/health_medicine/,science,61,Brain Scans Reveal Two Distinct Types of Autism,https://www.sciencedaily.com/releases/2026/06/260602021634.htm,2026-07-01T03:29:40+00:00
ScienceDaily Health & Medicine,https://www.sciencedaily.com/news/health_medicine/,science,62,Vitamin B12 and Folate Deficiencies Linked to Chronic Fatigue,https://www.sciencedaily.com/releases/2026/05/260528082501.htm,2026-07-01T03:29:40+00:00
ScienceDaily Health & Medicine,https://www.sciencedaily.com/news/health_medicine/,science,63,Human Organoids Reveal How to Reverse “irreversible” Nerve Damage,https://www.sciencedaily.com/releases/2026/05/260528082459.htm,2026-07-01T03:29:40+00:00
ScienceDaily Health & Medicine,https://www.sciencedaily.com/news/health_medicine/,science,64,This Tomato-Soy Juice Reduced Inflammation in Just Four Weeks,https://www.sciencedaily.com/releases/2026/05/260529043644.htm,2026-07-01T03:29:40+00:00
ScienceDaily Health & Medicine,https://www.sciencedaily.com/news/health_medicine/,science,65,Scientists Say Guava Juice Could Make Iron Supplements Work Better,https://www.sciencedaily.com/releases/2026/05/260527023200.htm,2026-07-01T03:29:40+00:00
ScienceDaily Health & Medicine,https://www.sciencedaily.com/news/health_medicine/,science,66,New Brain Study Reveals Speech Learning Works Differently Than We Thought,https://www.sciencedaily.com/releases/2026/06/260619020514.htm,2026-07-01T03:29:40+00:00
ScienceDaily Health & Medicine,https://www.sciencedaily.com/news/health_medicine/,science,67,Your Brain Was Never Designed for This Much Bad News,https://www.sciencedaily.com/releases/2026/06/260614012006.htm,2026-07-01T03:29:40+00:00
ScienceDaily Health & Medicine,https://www.sciencedaily.com/news/health_medicine/,science,68,Scientists Thought Brain Inflammation Was Driving Long COVID but the Scans Told a Different Story,https://www.sciencedaily.com/releases/2026/05/260527023206.htm,2026-07-01T03:29:40+00:00
ScienceDaily Health & Medicine,https://www.sciencedaily.com/news/health_medicine/,science,69,Scientists Discover Hidden Gut-Brain Circuit That Triggers Protein Cravings,https://www.sciencedaily.com/releases/2026/05/260527023202.htm,2026-07-01T03:29:40+00:00
ScienceDaily Health & Medicine,https://www.sciencedaily.com/news/health_medicine/,science,70,Scientists Discover Why Ozempic and Wegovy Weight Loss Eventually Plateaus,https://www.sciencedaily.com/releases/2026/05/260525000453.htm,2026-07-01T03:29:40+00:00
ScienceDaily Health & Medicine,https://www.sciencedaily.com/news/health_medicine/,science,71,This DNA Repair Gene Went Rogue and Exposed a Cancer Weakness,https://www.sciencedaily.com/releases/2026/06/260619101349.htm,2026-07-01T03:29:40+00:00
ScienceDaily Health & Medicine,https://www.sciencedaily.com/news/health_medicine/,science,72,Scientists Discover a Hidden Cause of Aging Cells That Can Be Reversed,https://www.sciencedaily.com/releases/2026/06/260610003119.htm,2026-07-01T03:29:40+00:00
ScienceDaily Health & Medicine,https://www.sciencedaily.com/news/health_medicine/,science,73,Researchers Found 8 Common Food Additives Linked to High Blood Pressure and Heart Disease,https://www.sciencedaily.com/releases/2026/06/260617032204.htm,2026-07-01T03:29:40+00:00
ScienceDaily Health & Medicine,https://www.sciencedaily.com/news/health_medicine/,science,74,Millions Take Calcium and Vitamin D for Stronger Bones. A Major Review Finds Little Benefit,https://www.sciencedaily.com/releases/2026/06/260614011852.htm,2026-07-01T03:29:40+00:00
ScienceDaily Health & Medicine,https://www.sciencedaily.com/news/health_medicine/,science,75,New Depression Treatment Targets the Immune System Instead of the Brain,https://www.sciencedaily.com/releases/2026/05/260527023204.htm,2026-07-01T03:29:40+00:00
ScienceDaily Health & Medicine,https://www.sciencedaily.com/news/health_medicine/,science,76,New AI Body Map Reveals Obesity’s Hidden Attack on Facial Nerves,https://www.sciencedaily.com/releases/2026/05/260522023308.htm,2026-07-01T03:29:40+00:00
ScienceDaily Health & Medicine,https://www.sciencedaily.com/news/health_medicine/,science,77,A Single Protein May Be Holding Back CAR T Cancer Therapy,https://www.sciencedaily.com/releases/2026/06/260602021641.htm,2026-07-01T03:29:40+00:00
ScienceDaily Health & Medicine,https://www.sciencedaily.com/news/health_medicine/,science,78,Scientists Discover Why Alzheimer’s Risk Hits Women So Much Harder,https://www.sciencedaily.com/releases/2026/05/260519224312.htm,2026-07-01T03:29:40+00:00
ScienceDaily Health & Medicine,https://www.sciencedaily.com/news/health_medicine/,science,79,Scientists Discover Strange Link Between Vitamin D and Pain,https://www.sciencedaily.com/releases/2026/05/260519224308.htm,2026-07-01T03:29:40+00:00
ScienceDaily Health & Medicine,https://www.sciencedaily.com/news/health_medicine/,science,80,“Zombie Cells” Aren’t Always Bad and That Could Transform Anti-Aging Medicine,https://www.sciencedaily.com/releases/2026/05/260521072402.htm,2026-07-01T03:29:40+00:00
ScienceDaily Health & Medicine,https://www.sciencedaily.com/news/health_medicine/,science,81,Hidden Sugar Patterns on Human Cells Could Reveal Cancer Early,https://www.sciencedaily.com/releases/2026/05/260517211431.htm,2026-07-01T03:29:40+00:00
ScienceDaily Health & Medicine,https://www.sciencedaily.com/news/health_medicine/,science,82,Eating Grapes Daily Could Unlock Powerful Skin Protection,https://www.sciencedaily.com/releases/2026/05/260517211427.htm,2026-07-01T03:29:40+00:00
ScienceDaily Health & Medicine,https://www.sciencedaily.com/news/health_medicine/,science,83,New Study Debunks the Biggest Fear About Yo-Yo Dieting,https://www.sciencedaily.com/releases/2026/05/260515233331.htm,2026-07-01T03:29:40+00:00
ScienceDaily Health & Medicine,https://www.sciencedaily.com/news/health_medicine/,science,84,Scientists Discover Why Some Cancers Survive Chemotherapy,https://www.sciencedaily.com/releases/2026/05/260515233329.htm,2026-07-01T03:29:40+00:00
ScienceDaily Health & Medicine,https://www.sciencedaily.com/news/health_medicine/,science,85,Scientists Discover Tiny Gut Particles That May Drive Aging and Chronic Disease,https://www.sciencedaily.com/releases/2026/05/260515233322.htm,2026-07-01T03:29:40+00:00
ScienceDaily Health & Medicine,https://www.sciencedaily.com/news/health_medicine/,science,86,Researchers Block Key Protein That Helps Parkinson’s Spread Through the Brain,https://www.sciencedaily.com/releases/2026/05/260527023214.htm,2026-07-01T03:29:40+00:00
ScienceDaily Health & Medicine,https://www.sciencedaily.com/news/health_medicine/,science,87,Scientists Are Raising New Questions About Vitamin B12 and Cancer,https://www.sciencedaily.com/releases/2026/05/260526022009.htm,2026-07-01T03:29:40+00:00
ScienceDaily Health & Medicine,https://www.sciencedaily.com/news/health_medicine/,science,88,Scientists Reversed Biological Age in Older Adults With a 4-Week Diet Change,https://www.sciencedaily.com/releases/2026/05/260511213144.htm,2026-07-01T03:29:40+00:00
ScienceDaily Health & Medicine,https://www.sciencedaily.com/news/health_medicine/,science,89,Scientists Discover Hidden Fat-Burning Switch That Could Strengthen Bones,https://www.sciencedaily.com/releases/2026/05/260511213141.htm,2026-07-01T03:29:40+00:00
ScienceDaily Health & Medicine,https://www.sciencedaily.com/news/health_medicine/,science,90,"Ozempic Delivers Major Weight Loss in Adults Over 65, Study Finds",https://www.sciencedaily.com/releases/2026/05/260510234654.htm,2026-07-01T03:29:40+00:00
ScienceDaily Health & Medicine,https://www.sciencedaily.com/news/health_medicine/,science,91,People Who Lost the Most Weight on Ozempic Saw Huge Health Benefits,https://www.sciencedaily.com/releases/2026/05/260518041432.htm,2026-07-01T03:29:40+00:00
ScienceDaily Health & Medicine,https://www.sciencedaily.com/news/health_medicine/,science,92,"Scientists Say 8,500 Steps a Day Could Stop Weight from Creeping Back",https://www.sciencedaily.com/releases/2026/05/260510234655.htm,2026-07-01T03:29:40+00:00
ScienceDaily Health & Medicine,https://www.sciencedaily.com/news/health_medicine/,science,93,The Supplements Older Adults Actually Need and the Ones They Don't,https://www.sciencedaily.com/releases/2026/06/260605023408.htm,2026-07-01T03:29:40+00:00
ScienceDaily Health & Medicine,https://www.sciencedaily.com/news/health_medicine/,science,94,Eating More Beans and Soy Could Slash High Blood Pressure Risk by Nearly 30%,https://www.sciencedaily.com/releases/2026/05/260523103906.htm,2026-07-01T03:29:40+00:00
ScienceDaily Health & Medicine,https://www.sciencedaily.com/news/health_medicine/,science,95,Scientists Say Just 30 Minutes of Exercise a Week Could Transform Your Health,https://www.sciencedaily.com/releases/2026/05/260515002126.htm,2026-07-01T03:29:40+00:00
ScienceDaily Health & Medicine,https://www.sciencedaily.com/news/health_medicine/,science,96,Ultra-Processed Foods Linked to Higher Risk of Heart Disease and Early Death,https://www.sciencedaily.com/releases/2026/05/260509210644.htm,2026-07-01T03:29:40+00:00
ScienceDaily Health & Medicine,https://www.sciencedaily.com/news/health_medicine/,science,97,Eating Eggs Could Cut Alzheimer’s Risk by 27%,https://www.sciencedaily.com/releases/2026/05/260506225214.htm,2026-07-01T03:29:40+00:00
ScienceDaily Health & Medicine,https://www.sciencedaily.com/news/health_medicine/,science,98,The Dark Side of Weight Loss Drugs: Ozempic's Surprising Hidden Cost,https://www.sciencedaily.com/releases/2026/05/260504154016.htm,2026-07-01T03:29:40+00:00
ScienceDaily Health & Medicine,https://www.sciencedaily.com/news/health_medicine/,science,99,This Simple Blood Test Might Detect Depression Before Symptoms Appear,https://www.sciencedaily.com/releases/2026/05/260504023827.htm,2026-07-01T03:29:40+00:00
ScienceDaily Health & Medicine,https://www.sciencedaily.com/news/health_medicine/,science,100,Scientists Reveal Creatine’s Hidden Power Beyond Muscle Gains,https://www.sciencedaily.com/releases/2026/05/260504023828.htm,2026-07-01T03:29:40+00:00
ScienceDaily Health & Medicine,https://www.sciencedaily.com/news/health_medicine/,science,101,Hidden Driving Danger When Edible Cannabis and Alcohol Mix,https://www.sciencedaily.com/releases/2026/05/260529043656.htm,2026-07-01T03:29:40+00:00
ScienceDaily Health & Medicine,https://www.sciencedaily.com/news/health_medicine/,science,102,Scientists Shut Down Cancer DNA Repair to Overcome Drug Resistance,https://www.sciencedaily.com/releases/2026/06/260610003052.htm,2026-07-01T03:29:40+00:00
ScienceDaily Health & Medicine,https://www.sciencedaily.com/news/health_medicine/,science,103,Scientists Discover Why Some DNA-Doubled Cells Refuse to Die,https://www.sciencedaily.com/releases/2026/05/260523103908.htm,2026-07-01T03:29:40+00:00
ScienceDaily Health & Medicine,https://www.sciencedaily.com/news/health_medicine/,science,104,Popular GLP-1 Weight-Loss Drugs Like Ozempic Slash Heart Attack and Stroke Risk,https://www.sciencedaily.com/releases/2026/05/260520093731.htm,2026-07-01T03:29:40+00:00
ScienceDaily Health & Medicine,https://www.sciencedaily.com/news/health_medicine/,science,105,MIT Scientists Finally Reveal the Hidden Structure of a Mysterious High-Tech Material,https://www.sciencedaily.com/releases/2026/05/260504023831.htm,2026-07-01T03:29:40+00:00
ScienceDaily Health & Medicine,https://www.sciencedaily.com/news/health_medicine/,science,106,One Fat Helped Pancreatic Cancer Grow While Another Cut Disease in Half,https://www.sciencedaily.com/releases/2026/06/260601025349.htm,2026-07-01T03:29:40+00:00
ScienceDaily Health & Medicine,https://www.sciencedaily.com/news/health_medicine/,science,107,New “Trojan Horse” Obesity Drug Supercharges Weight Loss in Early Tests,https://www.sciencedaily.com/releases/2026/05/260506225428.htm,2026-07-01T03:29:40+00:00
ScienceDaily Health & Medicine,https://www.sciencedaily.com/news/health_medicine/,science,108,Scientists Find Natural Compounds That Hit COVID-19 from Every Angle,https://www.sciencedaily.com/releases/2026/05/260506225217.htm,2026-07-01T03:29:40+00:00
ScienceDaily Health & Medicine,https://www.sciencedaily.com/news/health_medicine/,science,109,"Common Knee Surgery Found Ineffective, May Make Things Worse",https://www.sciencedaily.com/releases/2026/05/260505234603.htm,2026-07-01T03:29:40+00:00
ScienceDaily Health & Medicine,https://www.sciencedaily.com/news/health_medicine/,science,110,First-Ever 3D View Shows How Killer T Cells Destroy Cancer,https://www.sciencedaily.com/releases/2026/04/260429102021.htm,2026-07-01T03:29:40+00:00
ScienceDaily Health & Medicine,https://www.sciencedaily.com/news/health_medicine/,science,111,Scientists Say This Simple Music Trick Can Boost Workout Endurance by 20%,https://www.sciencedaily.com/releases/2026/05/260508003123.htm,2026-07-01T03:29:40+00:00
ScienceDaily Health & Medicine,https://www.sciencedaily.com/news/health_medicine/,science,112,A Hidden Map in Your Nose Could Explain How Smell Works,https://www.sciencedaily.com/releases/2026/04/260429102025.htm,2026-07-01T03:29:40+00:00
ScienceDaily Health & Medicine,https://www.sciencedaily.com/news/health_medicine/,science,113,Scientists Discover a Hidden Brain “cleaning” Effect Triggered by Movement,https://www.sciencedaily.com/releases/2026/05/260501052832.htm,2026-07-01T03:29:40+00:00
ScienceDaily Health & Medicine,https://www.sciencedaily.com/news/health_medicine/,science,114,MIT Scientists Turn Chaotic Laser Light Into Powerful Brain Imaging Tool,https://www.sciencedaily.com/releases/2026/04/260428045542.htm,2026-07-01T03:29:40+00:00
ScienceDaily Health & Medicine,https://www.sciencedaily.com/news/health_medicine/,science,115,Scientists Found the Hidden Switch Fueling Alzheimer’s Brain Inflammation,https://www.sciencedaily.com/releases/2026/05/260530053424.htm,2026-07-01T03:29:40+00:00
ScienceDaily Health & Medicine,https://www.sciencedaily.com/news/health_medicine/,science,116,Scientists Supercharge Natural Killer Cells to Fight Aggressive Cancers,https://www.sciencedaily.com/releases/2026/05/260523103910.htm,2026-07-01T03:29:40+00:00
ScienceDaily Health & Medicine,https://www.sciencedaily.com/news/health_medicine/,science,117,One in Five People May Carry This Hidden Cholesterol Risk Without Knowing It,https://www.sciencedaily.com/releases/2026/05/260515002151.htm,2026-07-01T03:29:40+00:00
ScienceDaily Health & Medicine,https://www.sciencedaily.com/news/health_medicine/,science,118,New Drugs Could Wipe out the “zombie Cells” Linked to Cancer and Aging,https://www.sciencedaily.com/releases/2026/05/260509210646.htm,2026-07-01T03:29:40+00:00
ScienceDaily Health & Medicine,https://www.sciencedaily.com/news/health_medicine/,science,119,Humans May Have Hidden Regenerative Powers,https://www.sciencedaily.com/releases/2026/06/260617032207.htm,2026-07-01T03:29:40+00:00
ScienceDaily Health & Medicine,https://www.sciencedaily.com/news/health_medicine/,science,120,Ultra-Processed Foods May Be Stealing Your Focus Even If You Eat Healthy,https://www.sciencedaily.com/releases/2026/06/260608040017.htm,2026-07-01T03:29:40+00:00
ScienceDaily Health & Medicine,https://www.sciencedaily.com/news/health_medicine/,science,121,Scientists Reversed Liver Aging With Young Gut Bacteria in Stunning Study,https://www.sciencedaily.com/releases/2026/05/260509210643.htm,2026-07-01T03:29:40+00:00
ScienceDaily Health & Medicine,https://www.sciencedaily.com/news/health_medicine/,science,122,"You Don’t Need Intense Workouts to Build Muscle, New Study Reveals",https://www.sciencedaily.com/releases/2026/05/260501052830.htm,2026-07-01T03:29:40+00:00
ScienceDaily Health & Medicine,https://www.sciencedaily.com/news/health_medicine/,science,123,New Beetle Species Found Just Outside a Lab,https://www.sciencedaily.com/releases/2026/06/260619020519.htm,2026-07-01T03:29:40+00:00
ScienceDaily Health & Medicine,https://www.sciencedaily.com/news/health_medicine/,science,124,Asteroid Triggered 330-Foot Tsunami,https://www.sciencedaily.com/releases/2026/06/260623011230.htm,2026-07-01T03:29:40+00:00
ScienceDaily Health & Medicine,https://www.sciencedaily.com/news/health_medicine/,science,125,Missing the Signs of Alien Life,https://www.sciencedaily.com/releases/2026/06/260623083121.htm,2026-07-01T03:29:40+00:00
ScienceDaily Health & Medicine,https://www.sciencedaily.com/news/health_medicine/,science,126,A Powerful New Probe of Dark Energy,https://www.sciencedaily.com/releases/2026/06/260621060315.htm,2026-07-01T03:29:40+00:00
ScienceDaily Health & Medicine,https://www.sciencedaily.com/news/health_medicine/,science,127,A Strange New Quantum Phase Emerges,https://www.sciencedaily.com/releases/2026/06/260619101330.htm,2026-07-01T03:29:40+00:00
ScienceDaily Health & Medicine,https://www.sciencedaily.com/news/health_medicine/,science,128,The Hidden Power of the Unconscious Brain,https://www.sciencedaily.com/releases/2026/06/260624025514.htm,2026-07-01T03:29:40+00:00
ScienceDaily Society,https://www.sciencedaily.com/news/top/society/,science,1,Why Scientists Fear We're Missing Evidence of Extraterrestrial Life,https://www.sciencedaily.com/releases/2026/06/260623083121.htm,2026-07-01T03:29:40+00:00
ScienceDaily Society,https://www.sciencedaily.com/news/top/society/,science,2,Think Human Anatomy Is Finished? Scientists Say Think Again,https://www.sciencedaily.com/releases/2026/06/260618041511.htm,2026-07-01T03:29:40+00:00
ScienceDaily Society,https://www.sciencedaily.com/news/top/society/,science,3,"Ancient DNA Reveals Plague Was Already Killing Humans 5,500 Years Ago",https://www.sciencedaily.com/releases/2026/06/260618041450.htm,2026-07-01T03:29:40+00:00
ScienceDaily Society,https://www.sciencedaily.com/news/top/society/,science,4,Yellowstone Wolves May Not Have Reshaped the National Park After All,https://www.sciencedaily.com/releases/2026/06/260613215510.htm,2026-07-01T03:29:40+00:00
ScienceDaily Society,https://www.sciencedaily.com/news/top/society/,science,5,Why Middle Age Is Becoming a Breaking Point in the U.S.,https://www.sciencedaily.com/releases/2026/06/260613215430.htm,2026-07-01T03:29:40+00:00
ScienceDaily Society,https://www.sciencedaily.com/news/top/society/,science,6,"The 1,100-year-old Mystery of Montana’s Lost Bison Hunting Site Finally Solved",https://www.sciencedaily.com/releases/2026/06/260610003056.htm,2026-07-01T03:29:40+00:00
ScienceDaily Society,https://www.sciencedaily.com/news/top/society/,science,7,AI-designed Universal Coronavirus Vaccine Passes First Human Trial,https://www.sciencedaily.com/releases/2026/06/260605023357.htm,2026-07-01T03:29:40+00:00
ScienceDaily Society,https://www.sciencedaily.com/news/top/society/,science,8,Hidden Driving Danger When Edible Cannabis and Alcohol Mix,https://www.sciencedaily.com/releases/2026/05/260529043656.htm,2026-07-01T03:29:40+00:00
ScienceDaily Society,https://www.sciencedaily.com/news/top/society/,science,9,Scientists Create Global Treasure Map Pointing to Hidden Rare Earth Deposits,https://www.sciencedaily.com/releases/2026/05/260525000450.htm,2026-07-01T03:29:40+00:00
ScienceDaily Society,https://www.sciencedaily.com/news/top/society/,science,10,Scientists Discover Massive Natural Hydrogen Source Beneath Canada,https://www.sciencedaily.com/releases/2026/05/260519224317.htm,2026-07-01T03:29:40+00:00
ScienceDaily Society,https://www.sciencedaily.com/news/top/society/,science,11,Who Are the Japanese? Huge DNA Discovery Rewrites History,https://www.sciencedaily.com/releases/2026/05/260514003314.htm,2026-07-01T03:29:40+00:00
ScienceDaily Society,https://www.sciencedaily.com/news/top/society/,science,12,"A Supervolcano Nearly Wiped Out Humanity 74,000 Years Ago, but Humans Did Something Incredible",https://www.sciencedaily.com/releases/2026/05/260510234711.htm,2026-07-01T03:29:40+00:00
ScienceDaily Society,https://www.sciencedaily.com/news/top/society/,science,13,The Universe May Be Hiding Conscious Minds Stranger Than We Can Imagine,https://www.sciencedaily.com/releases/2026/06/260623083146.htm,2026-07-01T03:29:40+00:00
ScienceDaily Society,https://www.sciencedaily.com/news/top/society/,science,14,Early Humans Were Bringing Fire Into Caves 1.8 Million Years Ago,https://www.sciencedaily.com/releases/2026/06/260623083123.htm,2026-07-01T03:29:40+00:00
ScienceDaily Society,https://www.sciencedaily.com/news/top/society/,science,15,Chinese Sodium Battery Surprised Scientists by Matching Key Tesla Benchmarks,https://www.sciencedaily.com/releases/2026/06/260621060305.htm,2026-07-01T03:29:40+00:00
ScienceDaily Society,https://www.sciencedaily.com/news/top/society/,science,16,A Single Cobalt Shock Could Trigger Global EV Battery Supply Chaos,https://www.sciencedaily.com/releases/2026/06/260619101402.htm,2026-07-01T03:29:40+00:00
ScienceDaily Society,https://www.sciencedaily.com/news/top/society/,science,17,SpaceX Wants to Build AI Data Centers in Space. Will It Work?,https://www.sciencedaily.com/releases/2026/06/260618041501.htm,2026-07-01T03:29:40+00:00
ScienceDaily Society,https://www.sciencedaily.com/news/top/society/,science,18,Your Brain Was Never Designed for This Much Bad News,https://www.sciencedaily.com/releases/2026/06/260614012006.htm,2026-07-01T03:29:40+00:00
ScienceDaily Society,https://www.sciencedaily.com/news/top/society/,science,19,Why Grandparents Matter More Than Ever for Children's Mental Health,https://www.sciencedaily.com/releases/2026/06/260613034206.htm,2026-07-01T03:29:40+00:00
ScienceDaily Society,https://www.sciencedaily.com/news/top/society/,science,20,New Fentanyl Vaccine Blocks Deadly Overdoses Before They Start,https://www.sciencedaily.com/releases/2026/06/260612032029.htm,2026-07-01T03:29:40+00:00
ScienceDaily Society,https://www.sciencedaily.com/news/top/society/,science,21,"A Legendary Golden Fabric Lost for 2,000 Years Has Returned",https://www.sciencedaily.com/releases/2026/06/260612021000.htm,2026-07-01T03:29:40+00:00
ScienceDaily Society,https://www.sciencedaily.com/news/top/society/,science,22,Ancient DNA Shared With Neanderthals May Explain Human Language,https://www.sciencedaily.com/releases/2026/06/260611024612.htm,2026-07-01T03:29:40+00:00
ScienceDaily Society,https://www.sciencedaily.com/news/top/society/,science,23,Everyone Thought These Helmets Were Roman Until Scientists Uncovered the Truth,https://www.sciencedaily.com/releases/2026/06/260606075515.htm,2026-07-01T03:29:40+00:00
ScienceDaily Society,https://www.sciencedaily.com/news/top/society/,science,24,Stonehenge's Most Mysterious Stone Traveled 700 Kilometers Across Britain,https://www.sciencedaily.com/releases/2026/06/260608040003.htm,2026-07-01T03:29:40+00:00
ScienceDaily Society,https://www.sciencedaily.com/news/top/society/,science,25,AI Won’t Replace You but Someone Using AI Might,https://www.sciencedaily.com/releases/2026/05/260525000448.htm,2026-07-01T03:29:40+00:00
ScienceDaily Society,https://www.sciencedaily.com/news/top/society/,science,26,Scientists Say Dante’s Inferno Described an Asteroid Impact 500 Years Before Modern Science,https://www.sciencedaily.com/releases/2026/05/260510234658.htm,2026-07-01T03:29:40+00:00
ScienceDaily Society,https://www.sciencedaily.com/news/top/society/,science,27,"Ice Age Humans in China Crafted Surprisingly Advanced Stone Tools 146,000 Years Ago",https://www.sciencedaily.com/releases/2026/05/260508003113.htm,2026-07-01T03:29:40+00:00
ScienceDaily Society,https://www.sciencedaily.com/news/top/society/,science,28,"A Child's Tooth and Strange Green Stones Uncover a 5,500-Year-Old Mystery",https://www.sciencedaily.com/releases/2026/06/260603023914.htm,2026-07-01T03:29:40+00:00
ScienceDaily Society,https://www.sciencedaily.com/news/top/society/,science,29,Ancient Chemistry Trick Unlocks New Type of Glass That Traps CO2 and Hydrogen,https://www.sciencedaily.com/releases/2026/05/260521072404.htm,2026-07-01T03:29:40+00:00
ScienceDaily Society,https://www.sciencedaily.com/news/top/society/,science,30,The Dark Side of Weight Loss Drugs: Ozempic's Surprising Hidden Cost,https://www.sciencedaily.com/releases/2026/05/260504154016.htm,2026-07-01T03:29:40+00:00
ScienceDaily Society,https://www.sciencedaily.com/news/top/society/,science,31,"Lost 1,200-Year-Old Manuscript Contains the First English Poem",https://www.sciencedaily.com/releases/2026/05/260515233337.htm,2026-07-01T03:29:40+00:00
ScienceDaily Society,https://www.sciencedaily.com/news/top/society/,science,32,Scientists Just Discovered Africa Is Closer to Breaking Apart Than We Thought,https://www.sciencedaily.com/releases/2026/04/260424233204.htm,2026-07-01T03:29:40+00:00
ScienceDaily Society,https://www.sciencedaily.com/news/top/society/,science,33,"Malaria Didn’t Just Kill Early Humans, It Shaped Who We Became",https://www.sciencedaily.com/releases/2026/05/260502233859.htm,2026-07-01T03:29:40+00:00
ScienceDaily Society,https://www.sciencedaily.com/news/top/society/,science,34,Scientists Think They Finally Know Why Neanderthals Vanished,https://www.sciencedaily.com/releases/2026/04/260427050609.htm,2026-07-01T03:29:40+00:00
ScienceDaily Society,https://www.sciencedaily.com/news/top/society/,science,35,NASA Just Took a Huge Step Toward the Moon After Artemis II Success,https://www.sciencedaily.com/releases/2026/05/260504023837.htm,2026-07-01T03:29:40+00:00
ScienceDaily Society,https://www.sciencedaily.com/news/top/society/,science,36,Ancient DNA Reveals a Lost Population Near Paris Replaced by Strangers,https://www.sciencedaily.com/releases/2026/04/260421042800.htm,2026-07-01T03:29:40+00:00
